;title;content;date;author;tags;url;website-domain;region
39048;"""Se non stai con me ti devi buttare giù"", violenza e minacce di morte alla ex compagna: 43enne del...";"Nel pomeriggio di ieri, 8 aprile 2020, i Carabinieri della Compagnia di Marcianise e della Stazione Carabinieri di San Nicola la Strada hanno dato esecuzione ad un'ordinanza di applicazione della misura cautelare degli arresti domiciliari emessa dall'Ufficio Gip del Tribunale sede, su richiesta di questa Procura della Repubblica, nei confronti del 43enne P. G., per il reato di stalking aggravato. La tempestiva attività di indagine, diretta dalla Procura della Repubblica, era originata dalla denuncia presentata dalla vittima (ex convivente del P. G.) ed attraverso le sue dichiarazioni è stato possibile acquisire un grave quadro indiziario a carico dell'indagato, persona peraltro già gravata da diversi precedenti penali. In particolare, secondo quanto emerso nel corso delle indagini, l'uomo, già sottoposto in passato a misura cautelare per il reato di maltrattamenti in famiglia commesso ai danni della medesima persona offesa (all'epoca dei fatti con lui convivente), una volta tornato in libertà, all'esito di un periodo di detenzione protrattosi per circa tre anni, si era reso autore di comportamenti pesantemente vessatori ai danni della denunciante, ormai decisa a recidere ogni legame con l'ex compagno, al fine di indurla a tornare con lui. Da quel momento, infatti, a fronte della resistenza opposta dalla donna, l'indagato, in più occasioni, aveva minacciato quest'ultima di morte, anche alla presenza del figlio minore, escludendo che la stessa potesse intessere un minima vita di relazione (significative le minacce quali : ""Se non stai con me, ti devi buttare giù!"", ""Io ti uccido e ucciderò qualsiasi persona che si dovesse avvicinare a e te!""), appostandosi inoltre nei pressi dell'abitazione della vittima, nel tentativo di avvicinarla, fino a giungere ad aggredirla in almeno due circostanze, così costringendo la donna a vivere in un costante e profondo stato di ansia e timore, per la propria incolumità. Le dichiarazioni rese dalla donna trovavano pieno riscontro in altre fonti e negli ulteriori elementi acquisiti in fase indagini. In ragione del quadro indiziario acquisito, la Procura della Repubblica chiedeva rapidamente la misura cautelare coercitiva, poi accolta dal Giudice per le indagini preliminari.";2020-04-9; Campanianotizie;['Arresti Domiciliari', 'Stalking', 'Carabinieri', 'Campania', 'Marcianise', 'Arresti'];http://www.campanianotizie.com/cronaca/caserta/155255-se-non-stai-con-me-ti-devi-buttare-giu-violenza-minacce-morte-ex-compagna-43enne-casertano-domiciliari-stalking.html;www.campanianotizie.com;['campania']
39072;VIDEO Produzione di mascherine e gel igienizzante senza autorizzazione, altra fabbrica scoperta nel...;Il Comando Provinciale della Guardia di Finanza di Napoli ha sequestrato nei confronti di un’impresa di Brusciano oltre 5700 confezioni di gel igienizzante per mani, da 500 ml cadauno, e più di 1000 mascherine prodotte senza autorizzazione ministeriale. L’operazione si inserisce nell’ambito della costante attività di controllo economico del territorio finalizzata a contrastare, soprattutto in questo periodo di emergenza sanitaria, pratiche commerciali disoneste, truffe e frodi a danno dei consumatori. In particolare, le Fiamme Gialle del 1° Nucleo Operativo Metropolitano Napoli hanno individuato una fabbrica che produceva, senza autorizzazioni, liquido igienizzante per le mani con etichette che presentavano il prodotto - con scritte e simboli ingannevoli - come disinfettante in grado di eliminare fino al 99,9% di batteri, funghi e virus. L’obiettivo è stato selezionato, anche sulla scorta delle numerose segnalazioni pervenute al numero di pubblica utilità “117” e a seguito di specifiche analisi di rischio condotte attraverso piattaforme di e-commerce. Le attività si sono poi estese presso un punto vendita di Napoli dove è stato sequestrato il restante prodotto igienizzante, appena consegnato dalla ditta produttrice. I rappresentanti delle due società sono stati denunciati all’Autorità Giudiziaria per il reato di “vendita di prodotti industriali con segni mendaci” e rischiano fino a 2 anni di reclusione e la multa fino a 20.000 euro. Gli stessi finanzieri, inoltre, hanno sottoposto a sequestro 1000 mascherine, prodotte da due imprese, di abbigliamento e antinfortunistica, attive nei quartieri Chiaia ed Arenella di Napoli, che sono state rivendute, in assenza dell’autorizzazione dell’Istituto Superiore di Sanità, a farmacie delle province di Napoli e Foggia.;2020-04-9; Campanianotizie;['Video', 'Guardia di Finanza', 'Campania', 'Napoli', 'Brusciano'];http://www.campanianotizie.com/cronaca/napoli/155258-video-produzione-di-mascherine-e-gel-igienizzante-senza-autorizzazione-altra-fabbrica-scoperta-nel-napoletano-5700-confezioni-di-prodotto-sequestrate-e-due-responsabili-denunciati.html;www.campanianotizie.com;['campania']
39204;VIDEO Mascherine e gel igienizzante senza autorizzazione, altra fabbrica scoperta nel Napoletano:...;Il Comando Provinciale della Guardia di Finanza di Napoli ha sequestrato nei confronti di un’impresa di Brusciano oltre 5700 confezioni di gel igienizzante per mani, da 500 ml cadauno, e più di 1000 mascherine prodotte senza autorizzazione ministeriale. L’operazione si inserisce nell’ambito della costante attività di controllo economico del territorio finalizzata a contrastare, soprattutto in questo periodo di emergenza sanitaria, pratiche commerciali disoneste, truffe e frodi a danno dei consumatori. In particolare, le Fiamme Gialle del 1° Nucleo Operativo Metropolitano Napoli hanno individuato una fabbrica che produceva, senza autorizzazioni, liquido igienizzante per le mani con etichette che presentavano il prodotto - con scritte e simboli ingannevoli - come disinfettante in grado di eliminare fino al 99,9% di batteri, funghi e virus. L’obiettivo è stato selezionato, anche sulla scorta delle numerose segnalazioni pervenute al numero di pubblica utilità “117” e a seguito di specifiche analisi di rischio condotte attraverso piattaforme di e-commerce. Le attività si sono poi estese presso un punto vendita di Napoli dove è stato sequestrato il restante prodotto igienizzante, appena consegnato dalla ditta produttrice. I rappresentanti delle due società sono stati denunciati all’Autorità Giudiziaria per il reato di “vendita di prodotti industriali con segni mendaci” e rischiano fino a 2 anni di reclusione e la multa fino a 20.000 euro. Gli stessi finanzieri, inoltre, hanno sottoposto a sequestro 1000 mascherine, prodotte da due imprese, di abbigliamento e antinfortunistica, attive nei quartieri Chiaia ed Arenella di Napoli, che sono state rivendute, in assenza dell’autorizzazione dell’Istituto Superiore di Sanità, a farmacie delle province di Napoli e Foggia.;2020-04-9; Campanianotizie;['Video', 'Guardia di Finanza', 'Campania', 'Napoli', 'Brusciano'];http://www.campanianotizie.com/cronaca/napoli/155258-video-mascherine-e-gel-igienizzante-senza-autorizzazione-altra-fabbrica-scoperta-nel-napoletano-5700-confezioni-di-prodotto-sequestrate-e-due-responsabili-denunciati.html;www.campanianotizie.com;['campania']
39317;VIDEO Igienizzante e salviettine disinfettanti farlocche, continuano i controlli sulle fabbriche...;La Compagnia della Guardia di Finanza di Torre Annunziata ha sequestrato più di 5.300 flaconi di gel igienizzante e oltre 1.500 blister di salviettine per mani con simboli ingannevoli e tali da indurre in errore il consumatore in merito alle loro proprietà sanitarie. In particolare, le Fiamme Gialle hanno individuato tra Boscoreale e Santa Maria la Carità una rete di produzione e vendita di detergenti che pubblicizzava le funzioni disinfettanti dei prodotti, pur non avendo ricevuto alcuna autorizzazione dal Ministero della Salute che ne attestasse l’efficacia. Le etichette dei flaconi di gel e delle salviettine igienizzanti riportavano, infatti, diciture ingannevoli relativamente alle loro proprietà biocide: tra i pittogrammi anche l’icona sbarrata della molecola del coronavirus e un simbolo riconducibile alla tipica croce rossa indicante il “presidio medico chirurgico” e prive delle autorizzazioni del Ministero della Salute. I responsabili sono stati denunciati per frode in commercio e rischiano fino a 2 anni di reclusione o la multa fino a 2.000 euro. L’operazione si inserisce nell’ambito della costante attività di controllo economico del territorio disposta dal Gruppo di Torre Annunziata e finalizzata a contrastare, soprattutto in questo periodo di emergenza sanitaria, pratiche commerciali disoneste, truffe e frodi a danno dei consumatori.;2020-04-10; Campanianotizie;['Video', 'Guardia di Finanza', 'Campania', 'Torre Annunziata'];http://www.campanianotizie.com/cronaca/napoli/155265-video-igienizzante-e-salviettine-disinfettanti-farlocche-continuano-i-controlli-sulle-fabbriche-non-autorizzate-nel-napoletano-5300-confezioni-di-prodotto-sequestrate-e-responsabili-denunciati.html;www.campanianotizie.com;['campania']
39318;VIDEO E FOTO Controlli anti Covid nel Napoletano: pusher 24enne ai domiciliari, sospesa attività di...;La Tenenza della Guardia di Finanza di Baia ha arrestato a Bacoli un 24enne trovato in possesso di 120 grammi tra hashish e marijuana. In particolare le Fiamme Gialle hanno prima fermato l’uomo, che aveva assunto atteggiamenti reticenti senza fornire una valida motivazione che giustificasse la sua presenza in strada, e successivamente hanno perquisito la sua abitazione, dove sono stati ritrovati un bilancino di precisione ed un coltello. Gli ulteriori approfondimenti hanno poi consentito di riscontrare che il soggetto utilizzava il proprio motoveicolo senza patente e senza copertura assicurativa. L’uomo, denunciato per spaccio di sostanze stupefacenti, è ora agli arresti domiciliari in attesa del giudizio per direttissima. L’operazione si inserisce nell’ambito dei controlli disposti dal Gruppo di Giugliano finalizzati a verificare il rispetto delle limitazioni per il contenimento del contagio da Covid-19. Tra i casi da segnalare quelli in cui i finanzieri, non solo della Tenenza di Baia ma anche della Compagnia di Pozzuoli, hanno sanzionato alcuni cittadini mentre prendevano il sole, altri mentre pescavano o passeggiavano sul lungomare, nonché i titolari di una pasticceria che confezionava pastiere pronte per essere messe in vendita. L’attività è stata sospesa e i prodotti dolciari devoluti in beneficenza.;2020-04-10; Campanianotizie;['Video', 'Droga', 'Guardia di Finanza', 'Arresti', 'Bacoli'];http://www.campanianotizie.com/cronaca/napoli/155266-video-foto-controlli-anti-covid-napoletano-pusher-domiciliari-pasticceria-sospesa.html;www.campanianotizie.com;['campania']
39378;Coronavirus, altra vittima nel Casertano: muore in ospedale una donna di Casal di Principe....;"Dopo il dato confortante di ieri con soli 3 nuovi contagi da Coronavirus in provincia di Caserta, la giornata odierna è iniziata con un nuovo decesso. La città di Casal di Principe si sveglia con una nuova vittima e con un nuovo contagio. Una delle pazienti positiva al Covid-19 è deceduta in ospedale, mentre è risultato positivo un componente della famiglia di un altro contagiato. A renderlo noto è stato il sindaco Renato Natale che ha dichiarato: ""Ai familiari della paziente deceduta vanno le condoglianze dell'amministrazione e della città; alle persone positive, gli auguri di pronta guarigione, a tutti noi l'invito a restare a casa, per rispetto di chi non ce l'ha fatta e per evitare di dover piangere altri morti. Un Venerdì Santo di passione, ma presto avremo la resurrezione. Coraggio e pazienza"".";2020-04-10; Campanianotizie;['Campania', 'Caserta'];http://www.campanianotizie.com/cronaca/caserta/155271-coronavirus-altra-vittima-nel-casertano-muore-in-ospedale-una-donna-di-casal-di-principe-registrato-anche-un-nuovo-contagio.html;www.campanianotizie.com;['campania']
39379;"Vietata la vendita di dolci pasquali in Campania, la denuncia dell'associazione Konsumer: ""Pane sì...";"Le misure anti contagio Covid-19 adottate in questo periodo, hanno creato un danno milionario lasciando più di 100mila addetti del comparto alimentare senza lavoro. Obblighi che hanno determinato discriminazioni tra gli artigiani del settore alimentare e quelli del settore della panificazione. A difesa di artigiani e consumatori si è schierata la Konsumer. Carlo Pileri, Portavoce nazionale dell'Associazione, sul caso ha dichiarato: ""Chiudere pasticcerie e pizzerie a taglio non serve a salvare dal coronavirus, ma crea una inspiegabile disparità di trattamento con lavorazioni artigiane analoghe come i forni. Il danno non è solo per gli addetti del settore (circa 70.000 per le pasticcerie, 50.000 circa per le pizzerie a taglio) ma soprattutto per i consumatori costretti a dover acquistare solo nella grande distribuzione prodotti prevalentemente industriali. La creazione di un oligopolio di vendita al dettaglio dovrebbe chiamare in causa l’antitrust per valutare se le motivazioni sanitarie effettivamente sussistono per chiudere le pasticcerie o se non fossero sufficienti garanzie di accesso di un cliente per volta come avviene per i forni e per altri esercizi commerciali. A Pasqua questa discriminazione è ancora più forte ed iniqua, peraltro molto sofferta anche dai cittadini che, già preoccupati per la diffusione del virus, non possono nemmeno consolarsi con il 'comfort food'. È infatti noto il potere di molti alimenti di alleviare dispiaceri e nostalgie, soddisfacendo un bisogno emotivo. Perché dunque non rassicurare, in questo momento di profonda tristezza, esercenti e consumatori con una pastiera artigianale che riporta alla mente storia e tradizione?""";2020-04-10; Campanianotizie;['Campania'];http://www.campanianotizie.com/cronaca/napoli/155272-vietata-vendita-dolci-pasquali-campania-denuncia-konsumer-discriminazione-senza-criterio.html;www.campanianotizie.com;['campania']
39650;Aversa, i vigili lo invitano a rispettare le misure anti contagio e tornare a casa ma vengono...;Il lungo periodo di costrizione in casa può diventare pesante ed avere anche delle brutte conseguenze come quelle che si sono verificate ad Aversa, dove un uomo, forse per l’esasperazione dovuta alla quarantena forzata a causa del Coronavirus, ha reagito nel peggiore dei modi di fronte ad un agente della polizia municipale che lo ha sorpreso in strada dopo le 18:30 e lo ha invitato a rientrare nella sua abitazione. Ne è subito nata un’accesa discussione che ben presto è degenerata in colluttazione.  Si è reso necessario di un altro agente della municipale per bloccare l’uomo in preda al raptus e condurlo nel locale commissariato della polizia di stato per le procedure del caso.;2020-04-10; Campanianotizie;['Campania', 'Aversa'];http://www.campanianotizie.com/cronaca/caserta/155283-aversa-i-vigili-lo-invitano-a-rispettare-le-misure-anti-contagio-e-tornare-a-casa-ma-vengono-aggrediti-dalluomo-denunciato.html;www.campanianotizie.com;['campania']
39739;Controlli anti contagio da Coronavirus, sfidano i divieti per andare a comprare la droga: 8 persone...;"Il Gruppo della Guardia di Finanza di Frattamaggiore, nell’ambito dei servizi predisposti nelle zone più sensibili dell’area nord di Napoli per contenere il diffondersi del “Coronavirus”, ha sanzionato e segnalato alla Prefettura, al termine di circa 100 controlli, 47 persone prive di legittime motivazioni per gli spostamenti. Tra queste, le Fiamme Gialle frattesi hanno verbalizzato, nei pressi del “Parco Verde” di Caivano, in collaborazione con i “Baschi Verdi” della Compagnia di Giugliano in Campania e con il supporto delle unità cinofile di Napoli e Capodichino, 8 persone trovate in possesso di alcune decine di grammi di eroina, hashish e marijuana. Altre 2 sono state denunciate per inottemperanza ad un foglio di via emesso dal Questore e per reiterazione nella guida senza patente; sono state, inoltre, sequestrate 2 autovetture per violazioni al Codice della Strada. L’operazione si inserisce nell’ambito dell’intensificazione dei controlli sugli spostamenti disposta dal Comando Provinciale di Napoli in questa fase cruciale del contrasto al COVID-19, che hanno riguardato solo in questa settimana complessivamente 4500 persone, di cui 319 sanzionate.";2020-04-11; Campanianotizie;['Campania', 'Caivano', 'Guardia di Finanza', 'Frattamaggiore', 'Napoli', 'Prefettura'];http://www.campanianotizie.com/cronaca/napoli/155285-controlli-anti-contagio-da-coronavirus-sfidano-i-divieti-per-andare-a-comprare-la-droga-8-persone-denunciate-a-caivano.html;www.campanianotizie.com;['campania']
39747;Raccolta fondi nel carcere di Napoli-Poggioreale, detenuti raccolgono 1607 euro e li donano...;"Non solo proteste e rivolte da parte dei detenuti del carcere di Napoli-Poggioreale: in molti hanno aderito ad un’iniziativa benefica donando la somma di 1607 euro all'ospedale per le malattie infettive Cotugno, eccellenza sanitaria partenopea. Lo rende noto il sindacato di polizia penitenziaria Osapp. La raccolta fondi è stata avviata tra coloro che sono detenuti in tre reparti della casa circondariale partenopea. ""Un gesto lodevole - secondo il segretario dell'Osapp Campania Vincenzo Palmieri - che dimostra sensibilità verso chi affronta in prima linea l'emergenza da Covid-19"". L'iniziativa è stata possibile anche grazie alla mediazione del direttore Carlo Berdini e del comandante della polizia penitenziaria Gaetano Diglio. Per Palmieri, ""generalizzare sull'opinione della popolazione detenuta è un grave errore: molti si sono ravveduti e dissociati dalle rivolte del mese scorso. Altri invece si lasciati andare anche a offese ai danni degli agenti, non comprendendo la gravità dell'emergenza storica"".";2020-04-11; Campanianotizie;['Carceri', 'Campania', 'Napoli', 'Poggioreale', 'Proteste'];http://www.campanianotizie.com/cronaca/napoli/155287-raccolta-fondi-nel-carcere-di-napoli-poggioreale-detenuti-raccolgono-1607-euro-e-li-donano-allospedale-cotugno-per-la-lotta-contro-il-coronavirus.html;www.campanianotizie.com;['campania']
39748;Vendita di dolci pasquali online in violazione delle norme anti contagio: la polizia postale chiude...;Gli uffici della Polizia delle comunicazioni di Napoli e di Salerno, nell’ambito dell’attività di prevenzione e contrasto agli illeciti in rete, hanno individuato numerose pasticcerie che effettuavano vendita online al dettaglio di dolci tipicamente prodotti in Campania in occasione delle festività pasquali. In particolare, le aziende in questione, tutte con sede legale nella Regione Campania, avevano realizzato delle pagine web dedicate alla vendita online, corredate dalle fotografie dei prodotti offerti, con l’indicazione del relativo prezzo per ciascuna unità, garantendo altresì la consegna sull’intero territorio nazionale. Come noto, la vendita online al dettaglio di prodotti dolciari è vietata fino al 14 aprile 2020 dall’ordinanza del Presidente della Regione Campania n. 25 del 28 marzo 2020, emessa ai sensi dell’art. 32, comma 3, della legge 23 dicembre 1978, n. 833. Gli operatori della Polizia delle Comunicazioni di Napoli e Salerno hanno, pertanto, notificato ai rappresentanti legali delle imprese in questione una sanzione amministrativa pecuniaria e hanno imposto l’immediata cessazione della vendita online mediante chiusura delle pagine web dedicate.;2020-04-11; Campanianotizie;['Polizia Postale', 'Polizia', 'Campania', 'Napoli', 'Salerno'];http://www.campanianotizie.com/cronaca/napoli/155288-vendita-di-dolci-pasquali-online-in-violazione-delle-norme-anti-contagio-la-polizia-postale-chiude-le-pagine-web-e-sanziona-le-aziende-produttrici-della-campania.html;www.campanianotizie.com;['campania']
39749;Castel Voltuno, spari contro l'abitazione e minacce ai vicini: 40enne dal carcere ai domiciliari...;R. A., 40enne di Castel Volturno, detenuto nel carcere di Santa Maria Capua Vetere per essersi reso responsabile insieme al fratello (S. A.) ed altre due persone, di detenzione illegale in luogo pubblico di arma comune da sparo e minacce nei confronti dei vicini, potrà tornare a casa: i giudici del Tribunale di Santa Maria Capua Vetere hanno accolto l'istanza del difensore di fiducia Ferdinando Letizia formulata sulla scorta del decreto Covid-19, disponendo la sostituzione della misura cautelare della custodia in carcere con quella meno afflittiva degli arresti domiciliari. La motivazione alla base dell'istanza di sostituzione della misura cautelare proposta dal suo legale, ha evidenziato le pregresse patologie da cui è affetto R. A. che rientrano nei quadri patologici per i quali è possibile riconnettere un elevato rischio di complicanze da Covid-19.;2020-04-11; Campanianotizie;['Castelvolturno', 'Carceri', 'Santa Maria Capua Vetere'];http://www.campanianotizie.com/cronaca/caserta/155289-castel-voltuno-spari-contro-labitazione-e-minacce-ai-vicini-40enne-dal-carcere-ai-domiciliari-per-il-rischio-covid.html;www.campanianotizie.com;['campania']
39773;Attentato dinamitardo nel Napoletano, bomba carta esplode fuori ad un negozio di elettrodomestici a...;Poco prima delle 02.00 della scorsa notte è stata fatta esplodere una bomba carta davanti al negozio di elettrodomestici e casalinghi 'Well.com' in via Libertà, 340 a Portici. La deflagrazione ha provocato danni alla saracinesca dell'esercizio commerciale. Fortunatamente nessuna persona è risultata ferita. Un aiuto alle indagini potrebbe essere fornito dalle telecamere di videosorveglianza presenti in zona, che si stanno acquisendo in queste ore. Sull'episodio procedono i Carabinieri della sezione operativa della Compagnia di Torre del Greco.;2020-04-11; Campanianotizie;['Attentato Dinamitardo', 'Esplosione Bomba', 'Campania', 'Portici', 'Carabinieri'];http://www.campanianotizie.com/cronaca/napoli/155286-attentato-dinamitardo-nel-napoletano-bomba-carta-esplode-fuori-ad-un-negozio-di-elettrodomestici-a-portici-indagano-i-carabinieri.html;www.campanianotizie.com;['campania']
39774;Raccolta fondi nel carcere di Napoli-Poggioreale, detenuti raccolgono 1607 euro e li donano...;"Non solo proteste e rivolte da parte dei detenuti del carcere di Napoli-Poggioreale: in molti hanno aderito ad un’iniziativa benefica donando la somma di 1607 euro all'ospedale per le malattie infettive Cotugno, eccellenza sanitaria partenopea. Lo rende noto il sindacato di polizia penitenziaria Osapp. La raccolta fondi è stata avviata tra coloro che sono detenuti in tre reparti della casa circondariale partenopea. ""Un gesto lodevole - secondo il segretario dell'Osapp Campania Vincenzo Palmieri - che dimostra sensibilità verso chi affronta in prima linea l'emergenza da Covid-19"". L'iniziativa è stata possibile anche grazie alla mediazione del direttore Carlo Berdini e del comandante della polizia penitenziaria Gaetano Diglio. Per Palmieri, ""generalizzare sull'opinione della popolazione detenuta è un grave errore: molti si sono ravveduti e dissociati dalle rivolte del mese scorso. Altri invece si lasciati andare anche a offese ai danni degli agenti, non comprendendo la gravità dell'emergenza storica"".";2020-04-11; Campanianotizie;['Carceri', 'Campania', 'Napoli', 'Poggioreale', 'Proteste'];http://www.campanianotizie.com/cronaca/napoli/155287-raccolta-fondi-nel-carcere-di-napoli-poggioreale-detenuti-raccolgono-1607-euro-e-li-donano-allospedale-cotugno-per-la-lotta-contro-il-coronavirus.html;www.campanianotizie.com;['campania']
39775;Vendita di dolci pasquali online in violazione delle norme anti contagio: la polizia postale chiude...;Gli uffici della Polizia delle comunicazioni di Napoli e di Salerno, nell’ambito dell’attività di prevenzione e contrasto agli illeciti in rete, hanno individuato numerose pasticcerie che effettuavano vendita online al dettaglio di dolci tipicamente prodotti in Campania in occasione delle festività pasquali. In particolare, le aziende in questione, tutte con sede legale nella Regione Campania, avevano realizzato delle pagine web dedicate alla vendita online, corredate dalle fotografie dei prodotti offerti, con l’indicazione del relativo prezzo per ciascuna unità, garantendo altresì la consegna sull’intero territorio nazionale. Come noto, la vendita online al dettaglio di prodotti dolciari è vietata fino al 14 aprile 2020 dall’ordinanza del Presidente della Regione Campania n. 25 del 28 marzo 2020, emessa ai sensi dell’art. 32, comma 3, della legge 23 dicembre 1978, n. 833. Gli operatori della Polizia delle Comunicazioni di Napoli e Salerno hanno, pertanto, notificato ai rappresentanti legali delle imprese in questione una sanzione amministrativa pecuniaria e hanno imposto l’immediata cessazione della vendita online mediante chiusura delle pagine web dedicate.;2020-04-11; Campanianotizie;['Polizia Postale', 'Polizia', 'Campania', 'Napoli', 'Salerno'];http://www.campanianotizie.com/cronaca/napoli/155288-vendita-di-dolci-pasquali-online-in-violazione-delle-norme-anti-contagio-la-polizia-postale-chiude-le-pagine-web-e-sanziona-le-aziende-produttrici-della-campania.html;www.campanianotizie.com;['campania']
