;title;content;date;author;tags;url;website-domain;region
42343;Aggressione ai danni della convivente, 23enne finisce in manette a Grottammare;Nella notte tra martedì 14 e mercoledì 15 aprile, i Carabinieri di San Benedetto del Tronto sono intervenuti presso un’abitazione di Grottammare in seguito alla richiesta di soccorso di una donna.Quest’ultima, infatti, è stata vittima di una brutale aggressione da parte del convivente, un 23enne di origini campane, il quale è stato colto sul fatto dai militari accorsi sul posto.Dopo aver bloccato il giovane, le forze dell’ordine hanno affidato la vittima delle violenze al personale sanitario del 118: la giovane è stata poi condotta per accertamenti presso l’ospedale “Mazzoni” di Ascoli Piceno, dove le sarebbero state riscontrate lesioni plurime al volto e alla testa.Secondo quanto da lei raccontato, altri episodi analoghi si sarebbero verificati nel corso degli ultimi mesi. Per il 23enne è infine scattato l’arresto con l’accusa di maltrattamenti in famiglia, lesioni e minacce e il conseguente trasferimento presso il carcere di Fermo.;2020-04-17; Marche Notizie;['Marche', 'Grottammare', 'Carabinieri', 'San Benedetto Del Tronto'];https://www.ascolinotizie.it/34476/aggressione-ai-danni-della-convivente-23enne-finisce-in-manette-a-grottammare;www.ascolinotizie.it;['marche']
44021;Spaccio di sostanze stupefacenti, due arresti tra San Benedetto e Grottammare;Al termine di lunghe indagini portate avanti nell’arco di diversi mesi, due spacciatori sono stati tratti in arresto tra Grottammare e San Benedetto del Tronto.A far scattare le manette ai polsi dei due individui in questione, un 32enne di Grottammare e una 30enne russa residente a San Benedetto, sono stati gli agenti della Polizia di Stato di Ascoli Piceno, i quali si erano messi al lavoro sull’attività illecita dei due pusher a partire da un caso di overdose verificatosi a San Benedetto nei mesi scorsi.Dopo numerosi appostamenti e pedinamenti, i poliziotti hanno infine arrestato i due giovani, dediti al traffico di sostanze stupefacenti in diverse località del Piceno: in tal frangente, gli spacciatori ricorrevano a un determinato “linguaggio in codice” per comunicare tra di loro e con i numerosi clienti.Infine, su indicazione del Gip del Tribunale di Ascoli Piceno, il 32enne è stato posto agli arresti domiciliari, mentre la sua complice non potrà invece allontanarsi da San Benedetto del Tronto.;2020-04-21; Marche Notizie;['Droga', 'Arresti', 'Marche', 'San Benedetto Del Tronto', 'Grottammare', 'Inchieste-investigazioni-indagini'];https://www.ascolinotizie.it/34501/spaccio-di-sostanze-stupefacenti-due-arresti-tra-san-benedetto-e-grottammare;www.ascolinotizie.it;['marche']
44514;Acquaviva Picena, automobilista in ospedale in seguito a un incidente stradale;Soccorritori in azione nella mattinata di martedì 21 aprile nelle vicinanze di Acquaviva Picena, dove un anziano di 77 anni è rimasto ferito dopo essere uscito di strada al volante della propria vettura.Intorno alle ore 9.00 l’uomo stava percorrendo la strada Panoramica in direzione di San Benedetto del Tronto quando, per cause sconosciute, egli ha perso il controllo dell’automobile, finendo dapprima contro un muro e successivamente in un fossato adiacente alla sede stradale.Il 77enne, rimasto ferito seppure fortunatamente non in maniera grave, è stato quindi soccorso dal personale sanitario del 118, che dopo avergli prestato le prime cure ne ha disposto il trasferimento presso l’ospedale “Mazzoni” di Ascoli Piceno.;2020-04-22; Marche Notizie;['Incidenti Stradali'];https://www.ascolinotizie.it/34509/acquaviva-picena-automobilista-in-ospedale-in-seguito-a-un-incidente-stradale;www.ascolinotizie.it;['marche']
46945;San Benedetto, trovato in mare il cadavere di una donna di 60 anni;Tragica scoperta a San Benedetto del Tronto nel primo pomeriggio di martedì 28 aprile: il corpo senza vita di una donna di 60 anni è stato infatti rinvenuto in mare nei pressi del porto.La vittima, Clementina Di Marco, risiedeva a Tortoreto ed era solita recarsi in città per portare avanti la propria attività di venditrice ambulante assieme al marito.Il suo cadavere è stato avvistato intorno alle ore 13.00 a pochi metri dalla costa. A nulla è valso il tempestivo soccorso di Guardia Costiera, Guardia di Finanza e Vigili del Fuoco, che non hanno potuto fare altro che constatare il decesso della donna.Dato che il corpo non presenterebbe tracce di violenza, resta ancora da appurare se si sia trattato di suicidio o di una tragica fatalità.;2020-04-29; Marche Notizie;['Marche', 'San Benedetto Del Tronto', 'Tortoreto'];https://www.ascolinotizie.it/34554/san-benedetto-trovato-in-mare-il-cadavere-di-una-donna-di-60-anni;www.ascolinotizie.it;['marche']
49184;Picconi nel bagagliaio dellauto, denunciati due 33enni a San Benedetto del Tronto;Nel corso dei controlli condotti nella giornata di sabato 2 maggio, la Polizia di Stato di San Benedetto del Tronto ha denunciato a piede libero un uomo e una donna, entrambi 33enne, in quanto sorpresi in possesso di due attrezzi da lavoro.La coppia, originaria dell’Europa dell’est, è stata fermata sul lungomare Marconi a bordo di una Seat Ibiza. I due non hanno saputo fornire una motivazione valida per giustificare il loro spostamento, cosicché gli agenti hanno deciso di passare al setaccio la loro automobile.Nel bagagliaio della vettura i poliziotti hanno così rinvenuto due picconi, arnesi che sono poi stati posti sotto sequestro. Incapaci di chiarire a cosa servissero gli attrezzi in questione, i due 33enni sono quindi stati denunciati per porto abusivo di armi od oggetti atti a offendere.;2020-05-5; Marche Notizie;['Marche', 'San Benedetto Del Tronto', 'Polizia', 'Lavoro'];https://www.ascolinotizie.it/34597/picconi-nel-bagagliaio-dellauto-denunciati-due-33enni-a-san-benedetto-del-tronto;www.ascolinotizie.it;['marche']
49666;Truffa online ai danni di una donna residente in Bulgaria, denunciati due uomini;Nei giorni scorsi la Guardia di Finanza ha denunciato un cittadino extracomunitario di 32 anni, residente ad Ascoli Piceno ma domiciliato a Porto San Giorgio, ritenuto responsabile di una truffa ai danni di una donna bulgara. Per mesi quest’ultima era stata ingannata su internet dall’individuo in questione e da un suo complice, un 40enne di Alba Adriatica, che le aveva fatto credere di essere un militare canadese in missione di pace in Iraq. Dietro al pagamento di svariate migliaia di euro, la donna credeva di aiutare l’amato a lasciare il proprio incarico per poi raggiungerla in Bulgaria, eventualità che non si è però mai realizzata.La vittima del raggiro si era quindi rivolta alle forze dell’ordine del proprio Paese, che grazie alla collaborazione con le Fiamme Gialle hanno infine individuato il sedicente militare e il suo aiutante, che aveva interpretato la parte del suo sostituto in Iraq, anch’egli bisognoso di denaro per accettare l’incarico al posto del 32enne. Dalle indagini condotte è inoltre emerso come i due avessero già messo a segno truffe analoghe nei confronti di altre donne residenti in diversi Paesi europei.;2020-05-6; Marche Notizie;['Truffe', 'Guardia di Finanza', 'Marche', 'Ascoli Piceno'];https://www.ascolinotizie.it/34604/truffa-online-ai-danni-di-una-donna-residente-in-bulgaria-denunciati-due-uomini;www.ascolinotizie.it;['marche']
50560;Scontro tra auto e moto a Folignano, grave un centauro di 54 anni;Nella serata di giovedì 7 maggio un motociclista di 54 anni è rimasto ferito in maniera grave in seguito a un incidente stradale avvenuto a Folignano.Secondo quanto ricostruito dai Carabinieri, intorno alle ore 21.00 l’uomo stava percorrendo via Cuneo nella frazione di Villa Pigna quando si è scontrato violentemente con un’automobile, venendo perciò sbalzato sull’asfalto.Sul posto è dunque accorso il personale sanitario del 118, che dopo aver prestato le prime cure al 54enne si è occupato del trasporto in codice rosso di quest’ultimo presso l’ospedale “Mazzoni” di Ascoli Piceno. Per via dei numerosi traumi riportati nella caduta, il centauro vi è tutt’ora ricoverato in gravi condizioni.;2020-05-8; Marche Notizie;['Folignano', 'Carabinieri', 'Piemonte', 'Cuneo'];https://www.ascolinotizie.it/34620/scontro-tra-auto-e-moto-a-folignano-grave-un-centauro-di-54-anni;www.ascolinotizie.it;['marche', 'piemonte']
