;title;content;date;author;tags;url;website-domain;region
31659;Buonismo: quartiere di Torino fuori controllo, 50 antagonisti assaltano Polizia | Video;"Effetti e conseguenze del buonismo in alcune parti d’Italia: “Torino è una bomba che sta scoppiando nelle mani inerti della sindaca e della ministra dell’Interno”.Lo ha riferito oggi Augusta Montaruli, parlamentare di FdI, in merito all’assalto avvenuto in corso Giulio Cesare a Torino (zona Aurora).“Gli anarchici nel quartiere Barriera di Milano a Torino vanno fermati. La violenza contro i controlli anti rapine e contro i controlli anti-coronavirus hanno la priorità” ha aggiunto l’assessore regionale piemontese Fabrizio Ricca (Lega).Seondo le prime informazioni, riportate dall’agenzia Ansa, una cinquantina di antagonisti appartenenti all’area anarchica, sembrerebbe spalleggiati anche da migranti, hanno cercato di impedire l’intervento degli agenti che stavano bloccando due rapinatori, i quali avevano scippato la collanina a una pensionata.La Polizia ha poi arrestato quattro persone, due uomini e due donne. Altri sono stati fermati e identificati.(Aggiornamento agenzia Ansa ore 19,20: gli investigatori della Questura parlano di un gruppo composto da antagonisti di area anarchica, extracomunitari e alcuni rom. I due presunti rapinatori – marocchini di 28 e 36 anni – sono finiti al Commissariato più vicino: uno dei due aveva con sé il bottino del colpo, una catenina d’oro, più qualche grammo di sostanza stupefacente).Alcuni antagonisti hanno anche cercato di aizzare i cittadini della zona, scesi a decine per strada, contro la Polizia: “Il virus lo hanno portato in giro loro. Ci stanno facendo ammalare, ci stanno ammazzando e non ci danno i soldi per sopravvivere. È ora di scendere in strada”.“Qualcuno – ha aggiunto Monaruli – sta provando a controllare illegittimamente il territorio per permettere traffici illegali. Per questo i poliziotti vengono aggrediti in strada mentre cercano di far rispettare le norme sul coronavirus nel quartiere Aurora, dove da giorni denunciamo assembramenti di immigrati ingiustificati.È inaccettabile il linciaggio anarchico a cui abbiamo assistito oggi.Ancora peggio che gli agenti siano costretti ad andare via dopo gli arresti e prevalga la folla fomentata dagli antagonisti.Una parte di Torino è fuori controllo. Lo dimostrano le immagini stesse.Sono decine ormai le interrogazioni e gli interventi per mettere in attenzione il Ministero dell’Interno e il sindaco Appendino.Non possiamo permettere che ci siano aree della nostra città in cui la Polizia subisca aggressioni e linciaggi alla prima alzata di paletta”.Ecco il video di una parte dei fatti accaduti oggi a Torino pubblicato su fb dall’utente Andrea NutiDj.
";2020-04-19; Liguria Notizie;['Torino', 'Piemonte', 'Polizia', 'Video', 'Anarchia', 'Liguria'];https://www.ligurianotizie.it/buonismo-quartiere-di-torino-fuori-controllo-50-antagonisti-assaltano-polizia-video/2020/04/19/378798/;www.ligurianotizie.it;['liguria', 'piemonte']
31724;Forte Ratti, va a fare passeggiata e cade in un dirupo: morto 64enne;Un malore con successiva caduta in un dirupo.Al momento, è l’ipotesi principale della morte di un escursionista, avvenuta nel tardo pomeriggio nei pressi di Forte Ratti sulle alture di Genova.Si tratta di un 64enne che, secondo quanto riferito, pare fosse addetto a un maneggio di cavalli in zona e nonostante i divieti imposti dal decreto Conte sull’emergenza coronavirus avrebbe deciso di fare una passeggiata in compagnia di un amico.In ogni caso, a dare l’allarme è stato proprio il suo amico, che ha chiamato i soccorsi.Sono quindi intervenute le squadre del Soccorso alpino, Protezione civile e Carabinieri.L’elicottero dei VVF si è alzato in volo, ma a causa del maltempo non ha potuto raccogliere e trasportare la salma, che comunque è stata poi recuperata e, su richiesta del pm di turno, sarà messa a disposizione dell’autorità giudiziaria. ;2020-04-19; Liguria Notizie;['Liguria', 'Genova'];https://www.ligurianotizie.it/forte-ratti-va-a-fare-passeggiata-e-cade-in-un-dirupo-morto-64enne/2020/04/19/378842/;www.ligurianotizie.it;['liguria']
31841;Auto contro guardrail sullA10 a Valleggia;Questa mattina, intorno 8,30, si è verificato un incidente stradale sull’autostrada A10 all’altezza di Valleggia.Un’auto stava procedendo in direzione di Savona quando per cause ancora sconosciute ha sbandato schiantandosi contro il guardrail.Sul posto è intervenuta la polizia stradale e i soccorsi del 118 con la Croce Bianca di Spotorno;2020-04-20; Liguria Notizie;['Incidenti Stradali', 'Liguria'];https://www.ligurianotizie.it/auto-contro-guardrail-sulla10-a-valleggia/2020/04/20/378863/;www.ligurianotizie.it;['liguria']
31937;Via Mura degli Zingari, rubano scooter: genovese e romeno presi dai carabinieri;La scorsa notte i carabinieri della Stazione dell’Arma di Ge- San Teodoro e Scali, di pattuglia in via Mura degli Zingari, hanno bloccato un genovese e un romeno che in flagranza del reato di “concorso in furto aggravato” stavano rubando uno scooter, regolarmente parcheggiato, di proprietà di un 38enne abitante in zona.Entrambi i malfattori hanno 24 anni e sono gravati da pregiudizi di polizia.Durante la perquisizione, sono stati trovati in possesso di numerosi attrezzi allo scasso e nella disponibilità del romeno è stata trovata anche una dose di “ketamina”.Il mezzo recuperato sarà restituito al legittimo proprietario.Gli arrestati sono stati rinchiusi carcere di Marassi. ;2020-04-20; Liguria Notizie;['Carabinieri', 'San Teodoro'];https://www.ligurianotizie.it/via-mura-degli-zingari-rubano-scooter-genovese-e-romeno-presi-dai-carabinieri/2020/04/20/378903/;www.ligurianotizie.it;['liguria']
31938;Pizzicati due ladri accumulatori seriali e autori furto magazzini comunali;Non si è ancora conclusa l’attività dei poliziotti che sabato notte hanno arrestato due ladri scoperti in una villetta sulle alture di Quinto.All’interno di un capanno annesso all’abitazione di uno dei due è stata infatti rinvenuta una montagna di oggetti, anche di ingente valore, la maggior parte dei quali probabile provento di furti commessi, almeno, in questi ultimi quattro anni.Numerosi pannelli fotovoltaici, utensili da giardinaggio, biciclette, selle da cavallo, motoveicoli smontati, attrezzatura da edilizia acrobatica, sacche da mazze da golf e molto altro. Due motoseghe a scoppio, dopo una capillare ricerca da parte degli stessi agenti, sono state già state ricondotte al furto perpetrato nel 2016 nei magazzini comunali di via Raimondo.Nei prossimi giorni proseguirà l’attività di catalogazione della merce per l’eventuale riconsegna ai legittimi proprietari.;2020-04-20; Liguria Notizie;['Arresti'];https://www.ligurianotizie.it/pizzicati-due-ladri-accumulatori-seriali-e-autori-furto-magazzini-comunali/2020/04/20/378907/;www.ligurianotizie.it;['liguria']
31939;Addetti supermercato rubano da scaffali: presi 29enne di Montoggio e 26enne genovese;Ieri i carabinieri del Nucleo Radiomobile, al termine degli accertamenti, hanno identificato e denunciato in stato di libertà per “tentato furto aggravato in concorso” un 29enne di Montoggio, magazziniere e un 26enne genovese, operaio, entrambi incensurati.I due, dipendenti di un supermercato genovese, erano stati sorpresi dal personale addetto alla vigilanza mentre rubavano generi alimentari e prodotti per l’igiene personale, per un importo di 50 euro circa.La merce è stata recuperata e restituita al titolare responsabile del supermercato. ;2020-04-20; Liguria Notizie;['Carabinieri', 'Nucleo Radiomobile', 'Concorsi'];https://www.ligurianotizie.it/addetti-supermercato-rubano-da-scaffali-presi-29enne-di-montoggio-e-26enne-genovese/2020/04/20/378905/;www.ligurianotizie.it;['liguria']
31940;E una 31enne italiana lautrice del furto da Tigotà;La polizia ha denunciato una 31enne italiana per furto aggravato e continuato.Una dipendente del negozio di cosmetici tigotà di Corso Torino, ha notato una cliente aggirarsi con fare sospetto presso gli scaffali e vedendole un anomalo rigonfiamento nelle tasche le ha chiesto cosa nascondesse.La donna ha tirato fuori una confezione di profumo dalle tasche e altre due dallo zaino.Trenta minuti prima la commessa aveva ricevuto una telefonata da una sua collega dello stesso negozio di via San Vincenzo che le segnalava il furto di 8 confezioni di crema per il corpo da parte di una donna che corrispondeva perfettamente alla donna che aveva appena rubato i profumi in Corso Torino.I poliziotti dell’UPG hanno così denunciato la donna, che è già conosciuto alle forze dell’ordine per reati contro il patrimonio, per il reato di furto aggravato e continuato.Tenta furto da Tigotà in corso Torino, preso dalla polizia;2020-04-20; Liguria Notizie;['Polizia', 'Torino', 'Piemonte'];https://www.ligurianotizie.it/e-una-31enne-italiana-lautrice-del-furto-da-tigota/2020/04/20/378922/;www.ligurianotizie.it;['liguria', 'piemonte']
31973;Gli uomini del Commissariato Chiavari fermano pusher albanese;Gli uomini del Commissariato di Chiavari, a seguito di indagine e dopo alcuni servizi di appostamento, hanno visto un 44enne albanese uscire e rientrare più volte dalla sua abitazione dopo aver preso contatti con persone che lo attendevano in strada.Sabato mattina gli agenti hanno così deciso di intervenire entrando all’interno della casa dell’uomo trovandolo in possesso di alcune confezioni di cocaina per di 11 gr, della somma di euro 150 suddivisa in banconote di piccolo taglio e di numerosi pezzi di cellophane idonei a confezionare la droga.Durante la compilazione degli atti sul telefono del 44enne sono arrivate alcune chiamate tra le quali un messaggio vocale “Whatsapp” di un certo “Marcello” che gli diceva: sto per arrivare a Chiavari per acquistare il solito, come l’altra volta. Gli agenti a quel punto si sono recati nel luogo dell’appuntamento, fissato in una via di Chiavari, fermando così un soggetto risultato poi essere “Marcello”, un genovese di 47 anni che ha poi confessato di essere lì per comprare droga dal pusher.;2020-04-20; Liguria Notizie;['Liguria', 'Chiavari', 'Droga', 'Inchieste-investigazioni-indagini'];https://www.ligurianotizie.it/gli-uomini-del-commissariato-chiavari-fermano-pusher-albanese/2020/04/20/378952/;www.ligurianotizie.it;['liguria']
31974;La polizia ferma in via Gramsci ghanese con marijuana e 420 euro;Una volante del Commissariato Centro, durante il regolare controllo del territorio, intorno alle 3.30 di sabato notte, ha notato un 23enne ghanese seduto su di una panchina vicino alla fermata del bus di via Gramsci.Gli agenti hanno deciso di controllarlo “pizzicandolo” in possesso di circa 7 gr di marjiuana. Il giovane, senza fissa dimora e con precedenti penali, è stato anche trovato in possesso della somma di 420 euro suddivisa in banconote di piccolo taglio.;2020-04-20; Liguria Notizie;['Polizia', 'Droga', 'Liguria'];https://www.ligurianotizie.it/la-polizia-ferma-in-via-gramsci-ghanese-con-marijuana-e-420-euro/2020/04/20/378958/;www.ligurianotizie.it;['liguria']
31994;Giovane chiama la polizia e denuncia lite in famiglia, ma aveva fumato;Nella giornata di ieri, domenica, intorno a mezzogiorno, una volante della Questura è stata inviata in un’abitazione del centro per una segnalazione di lite in famiglia.Una volta arrivati gli agenti hanno trovato i due coniugi stupiti dal loro arrivo in quanto non avevano ne’ litigato ne’, tanto meno, chiamato la Polizia aggiungendo che forse era stato il figlio a fare la telefonata, dopo essere uscito di casa per fare la spesa.Il padre a quel punto lo ha chiamato al cellulare e quando il giovane, un 20enne, è rientrato a casa, ha dichiarato agli agenti, con fare delirante, che aveva fatto lui la telefonata perché il padre tradisce la madre, raccontando particolari poco attendibili.Gli agenti hanno immediatamente notato i classici comportamenti di chi assume sostanze stupefacenti ed hanno così deciso di controllarlo trovandolo in possesso di un involucro di cellophane contenente 3.50 gr d cannabis.Il giovane ha poi dichiarato di aver comprato la sostanza da un suo amico coetaneo che vive poco distante, utilizzando i 50 euro che i genitori gli avevano dato per fare la spesa.I poliziotti, dopo aver segnalato il 20enne come assuntore di droga, sono andati a fare visita al suo amico.Una volta entrati nell’appartamento hanno trovato, nella cameretta, 5 gr di cannabis e una banconota da 50 euro presumibilmente ricevuta dall’amico per l’acquisto di droga.;2020-04-20; Liguria Notizie;['Polizia', 'Droga', 'Liguria'];https://www.ligurianotizie.it/giovane-chiama-la-polizia-e-denuncia-lite-in-famiglia-ma-aveva-fumato/2020/04/20/378961/;www.ligurianotizie.it;['liguria']
31995;La polizia scopre in una casa a Staglieno pusher con lhashish;Gli agenti della Questura, seguendo una segnalazione per un presunto spaccio di sostanze stupefacenti, sono andati in salita della Crosetta, nei pressi di via delle Ginestre, a Staglieno per vederci chiaro.Una volta individuata la casa sospetta gli agenti sono entrati ed il proprietario, un genovese di 56 anni, alla vista delle divise ha fatto uno scatto fulmineo per andare a nascondere in camera da letto alcune dosi di droga.In effetti gli agenti hanno rinvenuto circa 26 grammi di cannabis, un bilancino di precisione e la somma di 150 euro suddivisa in tre banconote da 50 euro.;2020-04-20; Liguria Notizie;['Polizia', 'Droga', 'Liguria'];https://www.ligurianotizie.it/la-polizia-scopre-in-una-casa-a-staglieno-pusher-con-lhashish/2020/04/20/378970/;www.ligurianotizie.it;['liguria']
31996;Controlli anticovid anche sui bus: sanzionato per la quarta volta ecuadoriano;Proseguono i controlli anticovid della polizia. Ecco alcuni casi.Ore 14.45 – 16.20. Piazza della Commenda. Intensificati i controlli nel centro storico cittadino, in risposta anche alle numerose segnalazioni circa la presenza costante di persone in strada nonostante le misure di contenimento del covid-19.I poliziotti del Commissariato Centro e della Questura di Genova hanno effettuato posti di controllo estendendo l’attività anche ai passeggeri in salita o discesa degli autobus di linea. Nello specifico domenica pomeriggio, nei pressi di piazza della Commenda, hanno sanzionato un 23enne ed una 27enne romena già sanzionati non meno di un mese fa.È scattata la prima sanzione anche per un albanese 27enne ed un 28enne ecuadoriano.Nella top five dei sanzionati di ieri però risulta un 24enne ecuadoriano che dal 14 marzo scorso (data della prima sanzione) con quella di ieri ne ha collezionate ben quattro.Ore 23.20. Via Bari: i poliziotti dell’U.P.G e S.P. e del Commissariato centro hanno sanzionato 4 giovani genovesi, 3 diciasettenni ed un neo diciottenne, perché, oltre a non aver nessun buon motivo per andarsene in giro, se ne stavano comodamente sui binari della Funicolare Principe-Granarolo. Sanzionati e riaffidati ai genitori con la speranza che abbiano imparato la lezione.;2020-04-20; Liguria Notizie;['Polizia', 'Liguria'];https://www.ligurianotizie.it/controlli-anticovid-anche-sui-bus-sanzionato-per-la-quarta-volta-ecuadoriano/2020/04/20/378980/;www.ligurianotizie.it;['liguria']
32020;Rogo in via Lomellini: bombole gas ma i Lagunari intervenuti lo stesso. Condomini salvi;La scorsa notte una pattuglia dell’Esercito, formata dai nostri Lagunari, impiegata nell’operazione Strade Sicure a presidio del Centro storico di Genova, è stata allertata da alcuni cittadini per un incendio nell’appartamento di un palazzo storico della centralissima via Lomellini.Appreso della presenza di persone ancora all’interno, pur messi a conoscenza anche della presenza di alcune bombole di gas, i militari non hanno esitato a entrare nel palazzo per allertare i condomini e velocizzare l’evacuazione, in attesa dell’arrivo dei Vigili del Fuoco, giunti poi sul posto in pochi minuti.Durante il successivo intervento di bonifica dell’edificio il comandante della pattuglia si è coordinato con il capo squadra dei pompieri al fine di garantire ogni possibile supporto, mentre due militari hanno garantito la necessaria cornice di sicurezza mantenendo i presenti a debita distanza.Una volta terminate le operazioni di spegnimento del rogo e messa in sicurezza dell’edificio, i soldati hanno ripreso il normale pattugliamento tra il plauso generale dei cittadini, che li hanno ringraziati per il loro prezioso lavoro.Il distaccamento “Complesso Minore Genova” opera nell’ambito dell’operazione “Strade Sicure” inserito nel “Raggruppamento Piemonte e Liguria” che impiega 422 militari per il controllo di obiettivi e siti sensibili nelle città di Torino, Caselle, Vercelli, Saluggia, Novara, Genova e Ventimiglia.A Genova il pattugliamento di “Strade Sicure” è affidato alla responsabilità del Reggimento Lagunari “Serenissima”.Dallo scorso 3 dicembre il colonnello Christian Ingala, comandante del “Reggimento Artiglieria a Cavallo”, è al comando del “Raggruppamento Piemonte e Liguria”.;2020-04-20; Liguria Notizie;['Incendi', 'Liguria', 'Genova'];https://www.ligurianotizie.it/rogo-in-via-lomellini-bombole-gas-ma-i-lagunari-intervenuti-lo-stesso-condomini-salvi/2020/04/20/378979/;www.ligurianotizie.it;['liguria']
32023;Giovane chiama la polizia e denuncia lite in famiglia, ma aveva fumato;Nella giornata di ieri, domenica, intorno a mezzogiorno, una volante della Questura è stata inviata in un’abitazione del centro per una segnalazione di lite in famiglia.Una volta arrivati gli agenti hanno trovato i due coniugi stupiti dal loro arrivo in quanto non avevano ne’ litigato ne’, tanto meno, chiamato la Polizia aggiungendo che forse era stato il figlio a fare la telefonata, dopo essere uscito di casa per fare la spesa.Il padre a quel punto lo ha chiamato al cellulare e quando il giovane, un 20enne, è rientrato a casa, ha dichiarato agli agenti, con fare delirante, che aveva fatto lui la telefonata perché il padre tradisce la madre, raccontando particolari poco attendibili.Gli agenti hanno immediatamente notato i classici comportamenti di chi assume sostanze stupefacenti ed hanno così deciso di controllarlo trovandolo in possesso di un involucro di cellophane contenente 3.50 gr d cannabis.Il giovane ha poi dichiarato di aver comprato la sostanza da un suo amico coetaneo che vive poco distante, utilizzando i 50 euro che i genitori gli avevano dato per fare la spesa.I poliziotti, dopo aver segnalato il 20enne come assuntore di droga, sono andati a fare visita al suo amico.Una volta entrati nell’appartamento hanno trovato, nella cameretta, 5 gr di cannabis e una banconota da 50 euro presumibilmente ricevuta dall’amico per l’acquisto di droga.;2020-04-20; Liguria Notizie;['Polizia', 'Droga', 'Liguria'];https://www.ligurianotizie.it/giovane-chiama-la-polizia-e-denuncia-lite-in-famiglia-ma-aveva-fumato/2020/04/20/378961/;www.ligurianotizie.it;['liguria']
32065;Appartamento a fuoco in via Fereggiano, sul posto i VVF;Erano circa le 14 di oggi quando un incendio è divampato in un appartamento all’ultimo piano in via Fereggiano a Genova Marassi.Sul posto sono intervenute tre squadre dei vigili del fuoco, la polizia locale e la polizia.Gli abitanti dell’edificio sono scesi in strada per il denso fumo. A chiamare i soccorsi è stata la proprietaria dell’appartamento che ha sentito uno scoppio e poi ha visto il fumo e le fiamme sul terrazzo.Non si registrano feriti.;2020-04-20; Liguria Notizie;['Vigili Del Fuoco', 'Fereggiano', 'Incendi', 'Liguria', 'Genova', 'Polizia'];https://www.ligurianotizie.it/appartamento-a-fuoco-in-via-fereggiano-sul-posto-i-vvf/2020/04/20/379010/;www.ligurianotizie.it;['liguria']
32186;Crollo del ponte Albiano Magra, la procura di Massa indaga 17 persone;In merito al crollo del ponte di Albiano Magra, il ponte della Caprigliola, la procura di Massa ha iscritto nel registro degli indagati 17 persone.Crollo ponte tra Aulla e Ceparana, un ferito | Video e FotoNell’ambito dell’inchiesta, la prcura ha chiesto al Gip di effettuare l’incidente probatorio per determinare la causa del crollo.Al momento l’ipotesi di reato dell’inchiesta è disastro colposo. Tra i 17 indagati figurano anche i dirigenti e tecnici di Anas e Provincia, in merito alla gestione della manutenzione del ponte. Nel crollo, avvenuto lo scorso 8 aprile scorso, era rimasto ferito un giovane trasportatore, mentre un operaio della Tim ne era uscito indenne dopo aver abbandonato il furgone sul ponte. Oltre al reato di crollo e disastro colposo, nel fascicolo della procura apuana si ipotizza anche quello di lesioni.;2020-04-20; Liguria Notizie;['Giustizia', 'Toscana', 'Aulla', 'Video', 'Inchieste-investigazioni-indagini', 'Liguria'];https://www.ligurianotizie.it/crollo-del-ponte-albiano-magra-la-procura-di-massa-indaga-17-persone/2020/04/20/379038/;www.ligurianotizie.it;['liguria', 'toscana']
32191;Una dozzina di esposti in procura a Genova per morti in Rsa. Indagano carabinieri Nas;Sono una decina gli esposti presentati in procura a Genova dai parenti di alcuni anziani morti nelle Rsa del territorio, mentre altri due sono stati presentati da associazioni.Tutte le denunce confluiranno nel fascicolo aperto nei giorni scorsi per epidemia colposa.I magistrati hanno delegato alle indagini i carabinieri del Nas.Gli investigatori dovranno acquisire tutti i dati relativi ai ricoveri e ai decessi presso le varie strutture per nziani e gli uffici pubblici dove potrebbero essere conservati, come l’Anagrafe o le Asl.Negli esposti, in sostanza, è stato denunciato il fatto che le strutture non avrebbero effettuato i tamponi, sarebbero state carenti per quanto riguarda la distribuzione dei dispositivi di protezione individuale e non avrebbero separato in modo idoneo gli anziani ospiti positivi o sospetti positivi da quelli negativi per evitare la diffusione del contagio da Covid-19.I dati raccolti verranno poi analizzati dal pool di esperti incaricato dalla procura per capire se vi siano state negligenze nella gestione dell’emergenza coronavirus. ;2020-04-20; Liguria Notizie;['Giustizia', 'Liguria', 'Genova', 'Carabinieri', 'Nas'];https://www.ligurianotizie.it/una-dozzina-di-esposti-in-procura-a-genova-per-morti-in-rsa-indagano-carabinieri-nas/2020/04/20/379065/;www.ligurianotizie.it;['liguria']
32192;Genova, lo scorso weekend 8443 controlli in strada e 225 sanzioni Polizia locale;“Prosegue il lavoro di monitoraggio sul territorio della Polizia locale di Genova. Lo scorso weekend sono stati effettuati 8443 controlli elevando 225 sanzioni”.Lo ha riferito oggi il sindaco di Genova Marco Bucci, in merito al monitoraggio delle violazioni alle norme del decreto Conte e delle ordinanze regionali e comunali sull’emergenza coronavirus.“Le attività e esercizi commerciali controllati – ha aggiunto il primo cittadino – sono stati 87 con una sola sanzione. I nostri agenti lavorano per la tutela della nostra salute e della nostra sicurezza”. ;2020-04-20; Liguria Notizie;['Liguria', 'Genova', 'Sanzioni', 'Polizia', 'Lavoro'];https://www.ligurianotizie.it/genova-lo-scorso-weekend-8443-controlli-in-strada-e-225-sanzioni-polizia-locale/2020/04/20/379070/;www.ligurianotizie.it;['liguria']
32199;Al via test a tappeto nelle carceri liguri: finora positivi un detenuto e un agente;“Tra qualche giorno partiranno test sierologici a tappeto su tutta la popolazione carceraria ligure e su tutti gli agenti di Polizia penitenziaria”.Lo ha annunciato stasera la vicepresidente e assessore regionale alla Sanita’ Sonia Viale, dopo una video-conferenza con il provveditore di Liguria, Piemonte e Valle d’Aosta.“In Liguria – ha spiegato Viale – il sistema di protezione delle carceri ha funzionato.Abbiamo registrato un solo caso positivo di un detenuto del carcere di Marassi e un altro caso che ha riguardato un agente di Polizia penitenziaria”. ;2020-04-20; Liguria Notizie;['Carceri', 'Polizia', 'Polizia Penitenziaria', 'Video', 'Liguria'];https://www.ligurianotizie.it/al-via-test-a-tappeto-nelle-carceri-liguri-finora-positivi-un-detenuto-e-un-agente/2020/04/20/379061/;www.ligurianotizie.it;['liguria']
32202;Va dal padre morente per lultimo saluto, ma viene sanzionato;E’ quanto è successo ad un uomo di Pietra Ligure che è stato fermato ieri dai carabinieri mentre era in auto in provincia di Pavia.Secondo quanto spiega l’Ansa, l’uomo, beneficiario della legge 104 per assistere il padre malato terminale, ha spiegato di essere andato nel pavese per l’ultimo saluto all’anziano genitore, ma i militari non hanno ritenuto si trattasse di assoluta urgenza e hanno sanzionato il savonese per violazione del Dpcm sul Coronavirus.;2020-04-20; Liguria Notizie;['Liguria', 'Pietra Ligure', 'Carabinieri', 'Lombardia', 'Pavia'];https://www.ligurianotizie.it/va-dal-padre-morente-per-lultimo-saluto-ma-viene-sanzionato/2020/04/20/379056/;www.ligurianotizie.it;['liguria', 'lombardia']
32339;Le rubano le mascherine dalla posta, ma la Polizia gliele regala;Aveva atteso, presso la propria abitazione in via San Bartolomeo del Fossato, per giorni, l’arrivo delle mascherine distribuite dalla Regione, per scoprire, poi, che la sua cassetta della posta era stata forzata e qualcuno gliele aveva rubate.Lo sconforto della signora era così tangibile durante la telefonata alla sala operativa che si è deciso di mandare una pattuglia a casa sua per portarle alcune mascherine in dotazione agli agenti delle volanti.La signora davanti ai poliziotti e all’inaspettato “regalo” non è riuscita a contenere lacrime di gioia.;2020-04-21; Liguria Notizie;['Polizia', 'Liguria'];https://www.ligurianotizie.it/le-rubano-le-mascherine-dalla-posta-ma-la-polizia-gliele-regala/2020/04/21/379131/;www.ligurianotizie.it;['liguria']
