;title;content;date;author;tags;url;website-domain;region
12973;Certosa, donna in quarantena esce di casa e va in giro: andavo in farmacia. Denunciata;“Evade” dalla quarantena per sospetto contagio da coronavirus ed esce di casa “per andare in farmacia”.Secondo quanto riferito stamane dal Comando della Polizia locale di Genova “è successo a Certosa, in Val Polcevera, dove una donna in quarantena, sostenendo di non essere riuscita a contattare la Asl e i numeri di emergenza e di avere bisogno di una mascherina per un parente, è uscita e si è diretta in una farmacia della zona”.“Sono intervenuti – hanno aggiunto dal Comando – gli agenti del V Distretto di Polizia locale, che hanno ricostruito i suoi movimenti. Escluso che sia venuta in contatto con chicchessia, sia per strada sia in farmacia.Dopo aver provveduto a fornirle una mascherina di quelle in dotazione, gli agenti hanno segnalato la donna all’autorità giudiziaria per non aver rispettato il decreto del presidente del Consiglio, emanato per limitare la diffusione del contagio”. ;2020-03-20; Liguria Notizie;['Polizia', 'Liguria', 'Genova'];https://www.ligurianotizie.it/certosa-donna-in-quarantena-esce-di-casa-e-va-in-giro-andavo-in-farmacia-denunciata/2020/03/20/372730/;www.ligurianotizie.it;['liguria']
13000;Via Celesia, bar aperto nonostante divieti anti coronavirus: denunciato 29enne albanese;Ieri i carabinieri di Rivarolo hanno riferito che un barista albanese di 29 anni è stato denunciato in stato di libertà per inosservanza delle restrizioni imposte dal decreto Conte sull’emergenza coronavirus.Inoltre, sono stati denunciati un suo connazionale di 45 anni e un siciliano di 60 anni.I tre denunciati risultano gravati da pregiudizi di polizia.I militari, nei giorni scorsi, hanno controllato il bar sito in via Celesia, risultato aperto nonostante i divieti imposti.Il 29enne è stato anche denunciato per “oltraggio a pubblico ufficiale” poiché dopo il controllo ha proferito frasi offensive nei confronti dei carabinieri.   ;2020-03-20; Liguria Notizie;['Carabinieri', 'Decreti', 'Liguria'];https://www.ligurianotizie.it/via-celesia-bar-aperto-nonostante-divieti-anti-coronavirus-denunciato-29enne-albanese/2020/03/20/372751/;www.ligurianotizie.it;['liguria']
13005;Covid-19 sempre in agguato: dopo diversi giorni registrato nuovo caso positivo a Vò;La notte scorsa è stato registrato un nuovo caso di persona positiva a Covid-19 a Vo’ Euganeo, il primo focolaio di coronavirus nel Padovano, dopo diversi giorni in cui il bilancio dei contagiati segnava zero.Lo ha riferito stamane l’agenzia Ansa.Vò, quarto giorno consecutivo senza nuovi casi positivi a coronavirusDal report di Regione Veneto, i positivi nella cittadina padovana sono così saliti a 83 dall’inizio dell’epidemia.Padova (escluso Vo’) è la provincia con più casi (943, +42 rispetto a ieri), seguita da Verona (784, +66) e Treviso (719, +49). ;2020-03-20; Liguria Notizie;[];https://www.ligurianotizie.it/covid-19-sempre-in-agguato-dopo-diversi-giorni-registrato-nuovo-caso-positivo-a-vo/2020/03/20/372761/;www.ligurianotizie.it;['liguria']
13085;Dopo maresciallo alla Spezia, appuntato a Bergamo morto con coronavirus;Fuori di casa e in strada per difendere noi e fare il suo dovere.Purtroppo la scorsa notte si è registrata un’altra vittima, legata al contagio da Covid-19, tra le Forze dell’ordine.Si tratta di Claudio Polzoni, carabiniere di 47 anni, appuntato scelto dell’Arma. Il militare era ricoverato all’ospedale Papa Giovanni XXIII di Bergamo.L’appuntato scelto era in servizio da anni alla centrale operativa del comando provinciale di via delle Valli a Bergamo. Sposato, ha lasciato una figlia di 10 anni.Grande il dolore e il cordoglio tra la cittadinanza della città lombarda e tra i colleghi dell’Arma.Ieri un altro lutto aveva colpito i carabinieri, con la morte del maresciallo maggiore Massimiliano Maggi, addetto alla stazione di La Spezia Principale e residente nel Comune di Beverino.Il 53enne era risultato positivo al coronavirus ed era stato ricoverato nel reparto di Terapia intensiva del Sant’Andrea. Sposato, ha lasciato due figli.Anche in questo caso, nella città del Levante ligure c’è stato grande cordoglio e dolore tra la cittadinanza e i colleghi dell’Arma.   ;2020-03-20; Liguria Notizie;['Liguria', 'La Spezia', 'Lombardia', 'Bergamo', 'Carabinieri'];https://www.ligurianotizie.it/dopo-maresciallo-alla-spezia-appuntato-a-bergamo-morto-con-coronavirus/2020/03/20/372768/;www.ligurianotizie.it;['liguria', 'lombardia']
13086;E a Sanremo lospedale mette i fiori sulle bare dei pazienti che muoiono soli;“Metteremo i fiori ad accompagnare le salme di chi, pur morendo solo, è avvolto da cure amorevoli e mani che accompagnano”.Il piccolo, ma grande gesto di “umanità nella solidarietà” è partito dai sanitari del reparto di Malattie Infettive e accolto da tutto il personale dell’ospedale di Sanremo.“Questa mattina – hanno spiegato – la Floris Sanremo, azienda del Gruppo Agora, ha inviato a tutti gli operatori sanitari centinaia di ranuncoli e altri fiori recisi. Un omaggio floreale di ringraziamento al personale ASL, accolto con il cuore, che si è trasformato in un gesto straordinario.Su proposta dei responsabili del reparto di Malattie Infettive, parte di questo omaggio floreale verrà infatti utilizzato come segno di vicinanza nei confronti dei pazienti deceduti in queste ore”.“Il mio pensiero – ha sottolineato il direttore del reparto Giovanni Cenderello – è andato a queste persone, decedute, senza i loro cari vicino. Così ho proposto alle caposala di utilizzare parte di questi fiori per accompagnare la sepoltura dei pazienti”.Un sentimento subito condiviso dai colleghi di reparto e accolto dalle caposala dell’ospedale di Sanremo. I fiori accompagneranno i pazienti nel loro ultimo viaggio.  ;2020-03-20; Liguria Notizie;['Liguria', 'San Remo', 'Ospedali'];https://www.ligurianotizie.it/e-a-sanremo-lospedale-mette-i-fiori-sulle-bare-dei-pazienti-che-muoiono-soli/2020/03/20/372783/;www.ligurianotizie.it;['liguria']
13151;Piazza Masnata, 3 mocciosi non rispettano norme decreto: denunciati per la seconda volta;Emergenza coronavirus e norme decreto Conte. A Genova molti continuano a uscire di casa senza giustificato motivo, ma la Polizia di Stato controlla e anche ieri sono fioccate le denunce.Ecco alcuni casi riferiti dai responsabili della Questura di Genova tra ieri e la scorsa notte.“Ore 10.00, via Pionieri Aviatori d’Italia: un 25enne residente nel Centro storico viene notato all’interno della Marina Genova Aeroporto intento a riparare un veicolo in sosta smontato in più parti. I poliziotti gli chiedono cosa sta facendo e lui risponde che sta sostituendo il motore alla sua auto con un altro precedentemente acquistato e trasportato sul posto. Denunciato.Ore 13.30, via Felice Cavallotti: i poliziotti dell’U.P.G. intervengono per un furto presso un ristorante. Il titolare fornisce le immagini delle telecamere in cui si vede chiaramente l’intrusione nel locale attraverso la forzatura della porta. Alle successive ore 15,30 gli stessi poliziotti riconoscono il ladro che passeggia in via Isonzo. Lo fermano e lui dichiara di avere 4 dosi di sostanza oppiacea per un totale di 4 grammi addosso e ammette il furto della mattina indicando dove ha nascosto il cacciavite usato per scassinare la porta. Denunciato per il furto, per l’inosservanza alle norme anti-contagio e sanzionato per lo stupefacente.Ore 16,40, passeggiata Anita Garibaldi: un uomo di 76 anni, residente nei vicoli, passeggia a Nervi  incurante dei divieti e del pericolo cui si espone. Dice che Nervi fa parte di Genova e quindi ha diritto a starci. Denunciato.Ore 18.00, via Piacenza: due 22enni, un genovese ed un ecuadoriano, sostano nei pressi dell’uscita di un supermercato. Sono lì già da un po’ ma non hanno sacchetti per le mani. I poliziotti del Commissariato San Fruttuoso chiedono di mostrare l’autocertificazione ma loro non l’hanno appresso. Gli agenti gliene consegnano due copie da compilare sul posto e quando le ritirano leggono le motivazioni: ‘Non c’è motivo’ scrivono entrambi. I due sono molto nervosi, tanto da insospettire gli operatori che approfondiscono il controllo e li trovano in possesso di marijuana. Denunciati per l’inosservanza al decreto e segnalati in via amministrativa per la detenzione dello stupefacente.Ore 00,10, via Sestri: Un romeno di 33 anni passeggia con un’italiana di 52 anni asserendo di non conoscere le disposizioni ministeriali contro il diffondersi dell’epidemia. Denunciati da operatori delle Volanti dell’U.P.G.Ore 3.30, piazza Masnata: 6 giovani di età compresa tra i 24 e i 18 anni, tre dei quali già segnalati per lo stesso motivo martedì scorso, vengono notati dai poliziotti del Commissariato Cornigliano mentre chiacchierano attorno ad un’auto parcheggiata lungo la careggiata. Interrogati circa la loro presenza in strada a quell’ora, rispondono con fare arrogante e con parole poco ‘eleganti’ di essere scocciati di questi continui controlli sentendosi liberi di fare ciò che vogliono, essendo assolutamente disinteressati alla pandemia in atto. Tutti segnalati per l’inosservanza al D.P.C.M. del 9 marzo scorso e tre di loro anche per false attestazioni”. ;2020-03-20; Liguria Notizie;['Decreti', 'Liguria', 'Genova', 'Polizia'];https://www.ligurianotizie.it/piazza-masnata-3-mocciosi-non-rispettano-norme-decreto-denunciati-per-la-seconda-volta/2020/03/20/372793/;www.ligurianotizie.it;['liguria']
13282;Coronavirus e procedure per tamponi ai poliziotti;Mentre l’Ordine dei Medici di Genova chiede il tampone per tutti gli operatori sanitari, i medici e le forze dell’ordine asintomatici, il SIAP, sindacato di polizia, chiede chiarezza a questori e dirigenti della polizia di Genova e Liguria sul rispetto delle procedure per i tamponi ai poliziotti sintomatici al COVID-19.“In questo momento drammatico per tutta la nostra Regione che sta combattendo contro l’avanzata del contagio da Covid-19 – si legge in una nota – il fenomenale impegno messo in campo da tutti gli operatori sanitari, medici e volontari che operano a contatto diretto con gli infetti dentro gli ospedali è supportato all’esterno dalle forze dell’ordine che si trovano in prima linea per fare rispettare le regole a quei cittadini che incredibilmente non si rendono ancora conto della gravità della situazione.In prima linea esposti ad un rischio subdolo, invisibile e terribilmente aggressivo.La scarsità dei DPI impone un rigoroso utilizzo del personale che deve lavorare in sicurezza ma nello stesso tempo deve anche essere monitorato sotto il profilo diagnostico.In queste ore assistiamo a dibattiti sempre più accesi tra chi sostiene o meno l’opportunità di “tamponare” il più possibile la popolazione asintomatica oppure “almeno” tutti gli operatori sanitari e le forze dell’ordine. Per ultimo anche l’Ordine dei Medici.Proposte che ovviamente chi rappresenta sindacalmente ed in qualità di RLS le donne e gli uomini della Polizia di Stato ovviamente non può far altro che approvare.Nel frattempo il SIAP In attesa dell’introduzione di nuovi protocolli sanitari che introducano nuovi criteri per l’effettuazione del tampone per accertamento positività a Covid-19, ha comunque preso una posizione formale nei confronti di tutti i Datori di Lavoro della Polizia di Stato di Genova ed a brevissimo anche sul territorio ligure per chiedere al Questore e a tutte le Specialità e Specializzazioni.In sintesi abbiamo chiesto di essere informati urgentemente sulle procedure che in questo momento vengono indicate dai Medici Competenti nel caso di dipendenti che evidenziano sintomi sui quali non si ha la certezza di un contatto diretto con una persona che ha avuto riscontri di tampone positivo (caso in cui dovrebbe scattare la quarantena anche per gli asintomatici).Inoltre attendiamo indicazioni da Questore e Dirigenti in merito alle procedure seguite nel caso in cui i dipendenti sintomatici vengono posti in “quarantena”, dopo casi di contatto diretto valutati dal Medico Competente, il quale dovrebbe prescrivere con rapidità, l’effettuazione di tamponi per garantire il più possibile il personale da eventuale contagio.Infine abbiamo chiesto di essere informati ogni qualvolta si dovesse prefigurare l’esigenza di mettere in quarantena domiciliare dipendenti che avessero avuto contatti con il dipendente sintomatico.C’è bisogno di chiarezza e trasparenza nei protocolli sanitari in una situazione di rischio che ha travolto quelle procedure di valutazione che già in condizioni ordinarietà istituzionale non risultavano adeguate, figuriamoci durante una pandemia mai vista nell’era moderna.Pertanto in attesa che qualcuno decida giustamente sui tamponi agli operatori sanitari ai medici e alle forze dell’ordine asintomatici pretendiamo certezze sulle procedure in vigore previste dal Istituto Nazionale di Sanità per i poliziotti sintomatici al Covid-19.”;2020-03-20; Liguria Notizie;['Liguria', 'Genova', 'Polizia'];https://www.ligurianotizie.it/coronavirus-e-procedure-per-tamponi-ai-poliziotti/2020/03/20/372851/;www.ligurianotizie.it;['liguria']
13313;Lascia libero per strada il cane, che morde una donna: denunciato per lesioni;Ieri i carabinieri di Borzonasca, dopo una querela presentata in caserma da una 53enne, hanno denunciato in stato di libertà per “lesioni personali colpose”, un 57enne del posto.Il 57enne, lo scorso mese di novembre, aveva omesso di custodire il proprio cane, che poi aveva morsicato a una gamba la donna.Una volta medicata, la 53enne era stata dimessa dall’ospedale di Lavagna con lesioni giudicate guaribili in 12 giorni. ;2020-03-20; Liguria Notizie;['Carabinieri', 'Liguria'];https://www.ligurianotizie.it/lascia-libero-per-strada-il-cane-che-morde-una-donna-denunciato-per-lesioni/2020/03/20/372883/;www.ligurianotizie.it;['liguria']
13314;Cogorno, auto sperona moto: conducente albanese fugge. Denunciato;Ieri mattina un 25 enne albanese, abitante a Cogorno, è stato denunciato in stato di libertà per “lesioni personali gravi, fuga del conducente in caso di lesioni stradali e omissioni di soccorso” dai Carabinieri della Stazione di Casarza Ligure.Lo straniero mentre stava transitando nel centro di Cogorno alla guida dell’auto di proprietà del genitore, ieri ha infatti speronato un motociclo, alla cui guida vi era un 24 enne di Ne.Anziché fermarsi, si è dato alla fuga senza prestare soccorso alla vittima, che, a seguito della caduta, ha riportato lesioni giudicate guaribili in 40 giorni dai sanitari dell’ospedale di Lavagna. ;2020-03-20; Liguria Notizie;['Cogorno', 'Carabinieri', 'Casarza Ligure', 'Liguria'];https://www.ligurianotizie.it/cogorno-auto-sperona-moto-conducente-albanese-fugge-denunciato/2020/03/20/372885/;www.ligurianotizie.it;['liguria']
13370;Furbetti che non rispettano decreto Conte: a Genova controlli anche con elicottero Arma;Controlli a tappeto sui furbetti che non rispettano le regole e le norme contenute nel decreto Conte sull’emergenza coronavirus.Oggi a Genova si è alzato in volo anche l’elicottero dei carabinieri.Il velivolo ha sorvolato la città nel pomeriggio e ha segnalato alle pattuglie a terra dove c’era il maggior numero di persone concentrate in strada.Oggi sono state impegnate 17 pattuglie nei controlli da Sampierdarena a Nervi, passando per Caricamento e il Centro città.Si tratta di “una sorveglianza dinamica per evitare assembramenti e comportamenti scorretti”.Centinaia le persone controllate e decine quelle multate perché trovate in giro senza giustificato motivo. ;2020-03-20; Liguria Notizie;['Decreti', 'Liguria', 'Genova', 'Carabinieri'];https://www.ligurianotizie.it/furbetti-che-non-rispettano-decreto-conte-a-genova-controlli-anche-con-elicottero-arma/2020/03/20/372925/;www.ligurianotizie.it;['liguria']
13605;Piazza Masnata, giovani ancora a zonzo: marocchino e genovese denunciati. La lunga lista;I responsabili della Questura di Genova stamane hanno comunicato le nuove denunce per inosservanza del decreto Conte sull’emergenza coronavirus.Piazza Masnata, 3 mocciosi non rispettano norme decreto: denunciati per la seconda voltaTra i tanti casi, ecco alcuni “casi degni di nota” riferiti dalla questura genovese.“Ore 12.00, piazzale Kennedy: una volante dell’UPGSP, durante un posto di controllo, ferma 2 marocchini di 32 e 37 anni a bordo di una macchina e lontani dalla loro residenza,  a spasso senza motivo. Denunciati.Ore 16.20, via Burlando: una pattuglia della Questura sorprende un cittadino della Guinea di 32 anni alla fermata dell’autobus di via Burlando. Il giovane ha cercato di giustificarsi dichiarando di essere andato a trovare un amico per poi cambiare versione dicendo di averlo incontrato a Brignole per caso e di aver preso l’autobus con lui solo per scambiare due chiacchere. Denunciato.Ore 16.15, via Balbi: gli uomini del Commissariato Prè si imbattono in un 26enne genovese, con tanto di autocertificazione compilata con la dicitura: “vado a comprare dello stupefacente!!??…”. In effetti il giovane aveva con sé una bustina contenente 11 gr di cannabis. Denunciato e segnalato come assuntore di sostanze stupefacenti alla Prefettura.Ore 17.00, via Prè: sempre gli agenti delle Volanti intercettano in via Prè un genovese di 28 anni, residente a Rivarolo, in giro nel Centro storico senza motivo. Denunciato.Ore 21.00, Chiavari: i poliziotti del Commissariato di Chiavari ‘pizzicano’ un genovese di 19 anni, agli arresti domiciliari, passeggiare nei pressi della Stazione Ferroviaria di Lavagna. Denunciato sia per evasione che per inosservanza al decreto.Ore 00.50, via Pieragostini: una volante della Questura sorprende un 26enne colombiano di ritorno da una cena a casa di amici poiché a suo dire era ‘snervato’ dalla permanenza domiciliari imposta dal Governo. Denunciato.Ore 01.00, piazza Masnata: gli agenti del Commissariato di Cornigliano trovano un marocchino di 22 anni e un genovese di 21 anni, seduti a fumare su di una panchina, entrambi residenti in un altro quartiere. I due giovani hanno anche ammesso di essere lì per sfruttare la linea Wi-fi del comune di Genova. Per i due ‘navigatori del web’ è scattata la denuncia”. ;2020-03-21; Liguria Notizie;['Liguria', 'Genova', 'Decreti'];https://www.ligurianotizie.it/piazza-masnata-giovani-ancora-a-zonzo-marocchino-e-genovese-denunciati-la-lunga-lista/2020/03/21/373000/;www.ligurianotizie.it;['liguria']
13620;Decreto Conte e lasciati fuori, primo arresto a Genova: pregiudicato tunisino chiuso dentro;Ieri mattina i Carabinieri della Stazione dell’Arma di Ge-Maddalena, impegnati in uno specifico controllo mirato al controllo del territorio, hanno notato aggirarsi a piedi un 28enne tunisino, pregiudicato, irregolare sul territorio, lasciato fuori e mai rimpatriato, attualmente sottoposto alla misura del divieto di dimora nel Comune di Genova.Il nordafricano, in violazione sia della disposizione dell’autorità giudiziaria, sia delle norme del decreto Conte sull’emergenza coronavirus, si aggirava tranquillamente per le vie del Centro storico.Dai successivi accertamenti, i militari hanno inoltre riscontrato che a carico dello straniero era stata emessa un’ordinanza di custodia cautelare in carcere.Pertanto, il tunisino è stato arrestato e rinchiuso nel carcere di Marassi. ;2020-03-21; Liguria Notizie;['Decreti', 'Liguria', 'Genova', 'Pregiudicati', 'Carabinieri'];https://www.ligurianotizie.it/decreto-conte-e-lasciati-fuori-primo-arresto-a-genova-pregiudicato-tunisino-chiuso-dentro/2020/03/21/373013/;www.ligurianotizie.it;['liguria']
13636;Assembramento a Busalla per la droga: 7 giovani denunciati. In tasca hashish;Ieri, nel corso di un controllo del territorio, i Carabinieri di Busalla hanno visto e quindi fermato un gruppo di persone secondo quanto previsto dalle norme del decreto Conte sull’emergenza coronavirus.I sette giovani, che erano lì da tempo, una volta identificati sono risultati residenti fuori dal Comune di Busalla.Pertanto, sono stati denunciati per inosservanza del decreto.Inoltre, un 19enne, gravato da pregiudizi di polizia, abitante a Savignone, è stato trovato trovato in possesso di sostanza stupefacente del tipo “hashish” che è stata sequestrata dai carabinieri. ;2020-03-21; Liguria Notizie;['Busalla', 'Droga', 'Carabinieri', 'Decreti'];https://www.ligurianotizie.it/assembramento-a-busalla-per-la-droga-7-giovani-denunciati-in-tasca-hashish/2020/03/21/373021/;www.ligurianotizie.it;['liguria']
13649;Vanno a rubare champagne: romeni denunciati per furto e violazione decreto Conte;I responsabili della Questura di Genova oggi hanno riferito di avere denunciato due cittadini rumeni di 22 e 24 anni per furto e per inosservanza del decreto Conte sull’emergenza coronavirus.Sabato scorso due giovani avevano rubato, all’interno di un’enoteca di via Sestri, due bottiglie di champagne del valore di 609 euro.Il titolare, in sede di denuncia, aveva consegnato ai poliziotti le registrazioni della videosorveglianza, dove erano ben visibili i volti dei ladri.Grazie alla diffusione delle immagini da parte degli agenti del Commissariato Sestri-Ponente a tutti i colleghi delle Volanti, ieri pomeriggio, in piazza Montano, gli stranieri sono stati riconosciuti da una pattuglia del Commissariato di Cornigliano mentre erano in compagnia di altri due connazionali.I quattro romeni, gravati di numerosi precedenti, sono stati denunciati per inosservanza al decreto Conte. Mentre i due ladruncoli sono stati anche denunciati per furto in concorso. ;2020-03-21; Liguria Notizie;['Decreti', 'Liguria', 'Genova'];https://www.ligurianotizie.it/vanno-a-rubare-champagne-romeni-denunciati-per-furto-e-violazione-decreto-conte/2020/03/21/373006/;www.ligurianotizie.it;['liguria']
13744;Sampierdarena, al Villa Scassi rubate 50 mascherine destinate a infermieri e medici;Furto di mascherine la scorsa notte nell’ospedale Villa Scassi di Sampierdarena.A presentare la denuncia ai carabinieri sono stati i responsabili della direzione sanitaria, dopo avere constato che un armadietto era stato scassinato dai ladri.I criminali hanno portato via una cinquantina di mascherine.A Genova è il primo furto di dispositivi di protezione individuale da un ospedale.Alla Spezia, nei giorni scorsi, la Polizia aveva denunciato due persone, dopo avere scoperto che le mascherine rubate venivano poi vendute a 20 euro sul web. ;2020-03-21; Liguria Notizie;['Carabinieri', 'Liguria'];https://www.ligurianotizie.it/sampierdarena-al-villa-scassi-rubate-50-mascherine-destinate-a-infermieri-e-medici/2020/03/21/373089/;www.ligurianotizie.it;['liguria']
13763;Sestri Levante, carabiniere risultato positivo a coronavirus: dimesso e già a casa;Il coronavirus colpisce la caserma dell’Arma in via Val di Canepa a Sestri Levante.Un carabiniere è risultato positivo al tampone del Covid-19 e, dopo un ricovero in ospedale, è stato dimesso e trascorrerà la quarantena presso il suo domicilio.Il militare due settimane fa era andato a fare visita a un famigliare nella zona di Piacenza.A Sestri Levante è stata predisposta la sanificazione della caserma, degli uffici e degli alloggi del personale.La sede dell’Arma è rimasta chiusa soltanto durante tali operazioni e oggi è regolarmente funzionante e aperta al pubblico “ovviamente secondo le modalità previste dal decreto” Conte sull’emergenza coronavirus. ;2020-03-21; Liguria Notizie;['Liguria', 'Sestri Levante', 'Carabinieri'];https://www.ligurianotizie.it/sestri-levante-carabiniere-risultato-positivo-a-coronavirus-dimesso-e-gia-a-casa/2020/03/21/373093/;www.ligurianotizie.it;['liguria']
13825;Bucci: oltre mille controlli e 126 denunciati solo da Polizia locale di Genova;Ieri sono state circa mille le persone controllate dagli agenti della Polizia locale di Genova, di cui 126 denunciate per violazione del decreto Conte sull’emergenza coronavirus.Gli agenti hanno inoltre controllato quasi 400 attività commerciali.Lo ha riferito il sindaco Marco Bucci ieri sera su fb.“Una giornata intensa di controlli – ha spiegato Bucci – per tutelare la nostra comunità grazie al lavoro dei 500 tra volontari della Protezione civile e agenti della Polizia locale. Ringrazio anche i genovesi che, in larghissima parte, hanno recepito il messaggio. Stiamo a casa”.  ;2020-03-22; Liguria Notizie;['Polizia', 'Liguria', 'Genova', 'Decreti'];https://www.ligurianotizie.it/bucci-oltre-mille-controlli-e-126-denunciati-solo-da-polizia-locale-di-genova/2020/03/22/373150/;www.ligurianotizie.it;['liguria']
