;title;content;date;author;tags;url;website-domain;region
1855;Scoperto ad Acquasanta Terme il cadavere dell80enne scomparso;Si sono concluse tragicamente nella tarda mattinata di martedì 12 maggio le ricerche di Lucio Monti, scomparso nel nulla da diversi giorni dalla propria abitazione di Favalanciata, frazione del comune di Acquasanta Terme.Il corpo senza vita dell’80enne è stato infatti rinvenuto intorno alle 12.30 dal personale del Gruppo di Soccorso Alpino e Speleologico, che si è avvalso dell’impiego di apposite unità cinofile. Il cadavere è stato scoperto in un fossato situato a poca distanza da un appezzamento di terreno di proprietà dell’anziano, il quale era solito recarvisi quotidianamente.Non è ancora chiaro cosa abbia provocato il decesso dell’uomo, al cui salma sarà ora sottoposta agli accertamenti del caso prima di essere infine riconsegnata ai suoi familiari.;2020-05-12; Marche Notizie;[];https://www.ascolinotizie.it/34663/scoperto-ad-acquasanta-terme-il-cadavere-dell80enne-scomparso;www.ascolinotizie.it;['marche']
4995;Grottammare, latitante 21enne arrestato per traffico di sostanze stupefacenti;Un 21enne di origini albanesi, già condannato in Germania per una vicenda relativa al traffico di sostanze stupefacenti, è stato rintracciato e arrestato a Grottammare. Il giovane, residente a San Benedetto del Tronto, era entrato a far parte di un’organizzazione criminale operante in diversi Paesi europei, motivo per il quale la sentenza del tribunale tedesco ne aveva disposto un periodo di reclusione pari a 11 anni e 3 mesi.Resosi irreperibile, dapprima il 21enne è stato cercato dai Carabinieri presso la sua abitazione, venendo successivamente individuato nel centro di Grottammare: dopo un breve e infruttuoso tentativo di fuga, egli è stato infine condotto presso il carcere di Marino del Tronto.;2020-05-19; Marche Notizie;['Marche', 'Grottammare', 'Latitanti', 'Arresti', 'Droga', 'San Benedetto Del Tronto'];https://www.ascolinotizie.it/34714/grottammare-latitante-21enne-arrestato-per-traffico-di-sostanze-stupefacenti;www.ascolinotizie.it;['marche']
5588;Scappa dai Carabinieri da Grottammare a Ripatransone, arrestato automobilista di 47 anni;Un 47enne di Grottammare è stato tratto in arresto nella tarda serata di martedì 19 maggio al termine di un pericoloso inseguimento.Tutto ha avuto inizio intorno alle ore 23.00 sul lungomare di Grottammare, dove una pattuglia di Carabinieri stava compiendo dei controlli stradali di routine. Quando i militari hanno tentato di fermare il 47enne, tuttavia, quest’ultimo ha dapprima sterzato verso di loro come se volesse investirli, per poi allontanarsi a gran velocità.L’automobilista, braccato dai Carabinieri stessi, è stato successivamente bloccato nel territorio comunale di Ripatransone grazie a un posto di blocco istituito dalle forze dell’ordine lungo la Strada Provinciale “Valtesino”. Nei suoi confronti sono scattate le manette con l’accusa di resistenza a pubblico ufficiale.;2020-05-20; Marche Notizie;['Carabinieri', 'Marche', 'Grottammare', 'Ripatransone', 'Arresti'];https://www.ascolinotizie.it/34723/scappa-dai-carabinieri-da-grottammare-a-ripatransone-arrestato-automobilista-di-47-anni;www.ascolinotizie.it;['marche']
6750;Ripatransone, anziano di 84 anni muore schiacciato da una lastra di cemento;Un anziano di 84 anni è deceduto a Ripatransone nella giornata di giovedì 21 maggio dopo essere stato schiacciato da un lastrone di cemento.Nel pomeriggio l’uomo si era recato presso un proprio appezzamento di terreno situato in campagna per effettuare dei lavori: col passare delle ore i suoi familiari, preoccupati nel non vederlo rincasare, ne hanno quindi segnalato la scomparsa, dando il via alle ricerche.A trovare il corpo senza vita dell’anziano proprio nel terreno di sua proprietà sono stati i Vigili del Fuoco. I sanitari del 118 presenti sul posto non hanno potuto fare altro che constatare il decesso dell’84enne.;2020-05-22; Marche Notizie;['Ripatransone'];https://www.ascolinotizie.it/34738/ripatransone-anziano-di-84-anni-muore-schiacciato-da-una-lastra-di-cemento;www.ascolinotizie.it;['marche']
8642;Scontro tra due vetture ad Ascoli Piceno, ferita unautomobilista;Due automobili sono state coinvolte in un incidente stradale verificatosi nella mattinata di martedì 26 maggio ad Ascoli Piceno.L’impatto ha avuto luogo intorno alle ore 10.00 nei pressi di Porta Cappuccina, all’incrocio tra via Pergolesi e via Verdi. Ad avere la peggio è stata la donna al volante di uno dei due veicoli, rimasta temporaneamente incastrata tra le lamiere del proprio mezzo.L’automobilista è stata quindi soccorsa dai Vigili del Fuoco del distaccamento locale, i quali dopo averla estratta l’hanno affidata ai sanitari del 118 per le cure del caso: la ferita è stata quindi condotta per accertamenti presso l’ospedale “Mazzoni” di Ascoli, dov’è arrivata in condizioni stabili e non gravi.Presente sul posto anche il personale della Polizia Locale per i rilievi di rito.;2020-05-26; Marche Notizie;['Incidenti Stradali', 'Marche', 'Ascoli Piceno'];https://www.ascolinotizie.it/34775/scontro-tra-due-vetture-ad-ascoli-piceno-ferita-unautomobilista;www.ascolinotizie.it;['marche']
9724;Incidente stradale sul raccordo Ascoli-Mare, ferita una donna di 33 anni;Paura nella notte tra mercoledì 27 e giovedì 28 maggio per un’automobilista di 33 anni, protagonista di un incidente stradale lungo l’Ascoli-Mare.Intorno all’1.00 la donna si stava dirigendo verso la costa a bordo della propria vettura quando, all’altezza di Spinetoli, ha improvvisamente perso il controllo del mezzo, finendo così contro il guard-rail posto a lato della carreggiata.Sul posto si sono così precipitati i sanitari del 118, che dopo aver prestato alla ferita le prime cure del caso si sono dedicati al suo trasporto presso l’ospedale “Mazzoni” di Ascoli Piceno: la 33enne, non in pericolo di vita, avrebbe riportato però diversi traumi in varie parti del corpo.;2020-05-28; Marche Notizie;['Incidenti Stradali'];https://www.ascolinotizie.it/34802/incidente-stradale-sul-raccordo-ascoli-mare-ferita-una-donna-di-33-anni;www.ascolinotizie.it;['marche']
13448;Morte sul lavoro a San Benedetto, due gli indagati con laccusa di omicidio colposo;Nell’ambito dell’inchiesta sorta a seguito della morte sul lavoro del 65enne Paolo Guerino, la Procura della Repubblica di Ascoli Piceno sarebbe in procinto di iscrivere due persone al registro degli indagati. L’accusa a loro carico è di omicidio colposo.Entrambi i soggetti in questione sarebbero collegati alla ditta appaltatrice dei lavori che, nella mattinata di martedì 18 febbraio, hanno causato il decesso dell’operaio a San Benedetto del Tronto: nonostante fosse stato prontamente soccorso, Guerino era poi spirato poco dopo essere stato trasportato d’urgenza all’ospedale “Madonna del Soccorso”.Nel frattempo, i sopralluoghi effettuati dalle forze dell’ordine e dal personale dell’Asur avrebbero portato alla scoperta del mancato puntellamento del tratto dov’è avvenuto il crollo fatale, che sarebbe quindi potuto essere evitato seguendo le normali procedure di sicurezza.Nella giornata di giovedì 20 febbraio si è svolto inoltre l’esame autoptico nei confronti della salma del 65enne, il cui corpo sarà quindi riconsegnato alla famiglia.;2020-02-20; Marche Notizie;['Lavoro', 'Marche', 'Omicidi', 'Inchieste-investigazioni-indagini', 'Giustizia', 'Ascoli Piceno'];https://www.ascolinotizie.it/33817/morte-sul-lavoro-a-san-benedetto-due-gli-indagati-con-laccusa-di-omicidio-colposo;www.ascolinotizie.it;['marche']
13943;Incidente a seguito di un malore, automobilista 65enne muore ad Acquasanta Terme;Un uomo di 65 anni è rimasto ucciso nella mattinata di venerdì 21 febbraio in seguito a un incidente stradale avvenuto nella frazione di Fleno di Acquasanta Terme.La tragedia ha avuto luogo intorno alle 10.30. La vittima, Rosato Di Mattia, si trovava alla guida della propria automobile quando si è improvvisamente sentito male, perdendo il controllo della vettura e finendo contro un camion posteggiato a lato della carreggiata.Il 65enne è stato prontamente soccorso dai sanitari del 118, che avrebbero dovuto quindi affidarlo all’eliambulanza giunta nel frattempo per il trasporto d’urgenza all’ospedale regionale di Torrette di Ancona. Di Mattia, tuttavia, è deceduto prima di potervi essere condotto.L’esatta dinamica dell’accaduto è ora al vaglio dei Carabinieri del distaccamento locale.;2020-02-21; Marche Notizie;['Incidenti Stradali', 'Omicidi'];https://www.ascolinotizie.it/33823/incidente-a-seguito-di-un-malore-automobilista-65enne-muore-ad-acquasanta-terme;www.ascolinotizie.it;['marche']
15793;Esce di strada e finisce contro un albero, 38enne perde la vita a Ripatransone;Un uomo di 38 anni ha perso la vita nella notte tra martedì 25 e mercoledì 26 febbraio in seguito a un incidente stradale verificatosi nel territorio comunale di Ripatransone. Intorno alla mezzanotte Luigi Vagnoni si trovava al volante della propria Fiat Punto in contrada Fonte Abeceto quando, per cause non ancora del tutto chiarite, ha perso il controllo della vettura per poi finire contro un albero situato a lato della sede stradale.Inutile ogni tentativo di soccorso nei confronti del 38enne, che è purtroppo deceduto pochi minuti dopo l’arrivo sul posto del personale sanitario del 118. Sul posto anche i Carabinieri per ricostruire l’esatta dinamica di quanto accaduto.;2020-02-26; Marche Notizie;['Ripatransone', 'Incidenti Stradali'];https://www.ascolinotizie.it/33891/esce-di-strada-e-finisce-contro-un-albero-38enne-perde-la-vita-a-ripatransone;www.ascolinotizie.it;['marche']
19449;Incendio nella notte a Spinetoli, intervengono sul posto i Vigili del Fuoco;Momenti di apprensione a Spinetoli nella tarda serata di giovedì 5 marzo per via dell’incendio che ha interessato un condominio ubicato in via Palazzi.L’allarme è stato lanciato intorno alle ore 23.00 da alcuni residenti, spaventati dalla copiosa mole di fumo proveniente da uno dei garage situati alla base dell’edificio.Sul posto sono dunque accorsi i Vigili del Fuoco provenienti dal distaccamento di Ascoli Piceno, che al termine di due ore di sforzi hanno infine avuto la meglio sulle fiamme. La palazzina ha comunque riportato seri danni a seguito dell’accaduto, tanto da venire ritenuta inagibile: per i residenti è stata pertanto disposta l’evacuazione immediata.A scatenare l’incendio, che non ha fortunatamente provocato feriti o intossicati, sarebbe stato un guasto elettrico.;2020-03-6; Marche Notizie;['Incendi', 'Spinetoli', 'Vigili Del Fuoco'];https://www.ascolinotizie.it/33997/incendio-nella-notte-a-spinetoli-intervengono-sul-posto-i-vigili-del-fuoco;www.ascolinotizie.it;['marche']
21367;Monteprandone, giovane cade in scooter sulla Salaria: interviene leliambulanza;Un ragazzo di 18 anni è rimasto ferito in maniera grave in seguito a un incidente stradale verificatosi a Monteprandone nella serata di lunedì 9 marzo.Secondo quanto ricostruito, il giovane stava percorrendo la via Salaria in sella al proprio scooter quando, forse a causa di un dosso artificiale, ha perso il controllo del veicolo, finendo così rovinosamente sull’asfalto.A seguito dell’allarme lanciato da alcuni automobilisti in transito, sul posto sono accorsi i sanitari del 118, che dopo aver prestato al 18enne le prime cure del caso ne hanno disposto il trasporto all’ospedale “Madonna del Soccorso” di San Benedetto del Tronto. Da qui il ragazzo è stato infine condotto in eliambulanza all’ospedale regionale di Torrette di Ancona per via della gravità delle lesioni riportate nella caduta.;2020-03-11; Marche Notizie;['Monteprandone', 'Incidenti Stradali'];https://www.ascolinotizie.it/34074/monteprandone-giovane-cade-in-scooter-sulla-salaria-interviene-leliambulanza;www.ascolinotizie.it;['marche']
23107;Spaccio nelle strade di San Benedetto del Tronto, tre le persone tratte in arresto;Tre persone sono state tratte in arresto nel corso dell’ultimo fine settimana a San Benedetto del Tronto con l’accusa di detenzione di stupefacenti ai fini di spaccio.A finire in manette sono stati due fratelli di origini campane di 58 e 52 anni e una 54enne del posto, compagna di uno di loro. I Carabinieri del comando locale hanno dapprima fermato nei pressi della Statale Adriatica uno dei due uomini, che ha dichiarato loro di essere diretto in una vicina farmacia sebbene privo di ricetta. Una volta rincasato, egli ha tentato invano di disfarsi della droga in suo possesso, venendo però bloccato dai militari.Quest’ultimi sono così riusciti a mettere le mani su all’incirca 150 grammi tra cocaina e eroina, che se immessi sul mercato avrebbero fruttato un guadagno stimabile in oltre 20.000 euro. Per i tre soggetti in questione è scattato inevitabilmente l’arresto.;2020-03-16; Marche Notizie;['Marche', 'San Benedetto Del Tronto', 'Gianfranco Fini'];https://www.ascolinotizie.it/34125/spaccio-nelle-strade-di-san-benedetto-del-tronto-tre-le-persone-tratte-in-arresto;www.ascolinotizie.it;['marche']
25950;Controlli della Polizia tra Ascoli Piceno e San Benedetto, un arresto e due denunce;Nel corso del fine settimana appena trascorso i controlli della Polizia di Stato di Ascoli Piceno e San Benedetto del Tronto hanno condotto a un arresto e a due denunce.A finire in manette è stato un 45enne di nazionalità marocchina, sorpreso dagli agenti nella serata di sabato 21 marzo all’esterno di un minimarket di piazza Garibaldi. Gli accertamenti svolti nei confronti di tale individuo hanno evidenziato come egli fosse ricercato da un mese su indicazione della Procura della Repubblica di Pescara: i poliziotti hanno così messo in atto il provvedimento di carcerazione emanato a suo carico, trasferendolo poi nel carcere di Marino del Tronto, dove dovrà scontare una condanna a sei mesi di reclusione per aver partecipato a una rissa nel capoluogo abruzzese.Ventiquattr’ore prima, a Porto d’Ascoli, un 30enne del luogo era stato denunciato per non aver rispettato le misure di contenimento anti-Coronavirus, in quanto sorpreso per strada senza un motivo valido.Sempre nella giornata di sabato, invece, un 27enne ascolano è stato denunciato per minacce a seguito di una furibonda lite familiare. Gli agenti sono intervenuti presso l’abitazione da lui condivisa con la madre, una donna di 58 anni in regime di arresti domiciliari, riscontrando gravi danni provocati dal giovane a mobili e infissi mediante l’utilizzo di un lungo coltello. Oltre all’arma in questione, all’interno dell’appartamento la Polizia ha inoltre rinvenuto e posto sotto sequestro altre lame potenzialmente pericolose.;2020-03-23; Marche Notizie;['Polizia', 'Marche', 'Ascoli Piceno', 'San Benedetto Del Tronto'];https://www.ascolinotizie.it/34223/controlli-della-polizia-tra-ascoli-piceno-e-san-benedetto-un-arresto-e-due-denunce;www.ascolinotizie.it;['marche']
26437;San Benedetto del Tronto, tatuatore abusivo di 23 anni denunciato dai Carabinieri;Continuano nel Piceno i controlli delle forze dell’ordine tesi a evitare la diffusione del contagio da Coronavirus: a San Benedetto del Tronto, nella giornata di lunedì 23 marzo, i Carabinieri si sono imbattuti in un tatuatore che esercitava abusivamente la propria attività.La scoperta è stata fatta presso un’abitazione del centro, nei pressi della quale i militari avevano notato un insolito viavai: una volta penetrati all’interno dell’edificio, essi si sono così trovati di fronte un 23enne del posto, il quale aveva dato vita a un proprio studio di tatuaggi benché privo di qualsiasi tipo di autorizzazione.I Carabinieri hanno immediatamente posto sotto sequestro ogni sorta di materiale adoperato dal giovane tatuatore, poi denunciato per esercizio abusivo della professione e per il mancato rispetto delle norme anti-Coronavirus: anche i suoi quattro clienti sorpresi nel locale al momento del blitz dovranno rispondere di quest’ultima accusa.;2020-05-11; Marche Notizie;['Marche', 'San Benedetto Del Tronto', 'Tatuaggi', 'Carabinieri'];https://www.ascolinotizie.it/34245/san-benedetto-del-tronto-tatuatore-abusivo-di-23-anni-denunciato-dai-carabinieri;www.ascolinotizie.it;['marche']
27318;Monteprandone, giovane cade in scooter sulla Salaria: interviene leliambulanza;Un ragazzo di 18 anni è rimasto ferito in maniera grave in seguito a un incidente stradale verificatosi a Monteprandone nella serata di lunedì 9 marzo.Secondo quanto ricostruito, il giovane stava percorrendo la via Salaria in sella al proprio scooter quando, forse a causa di un dosso artificiale, ha perso il controllo del veicolo, finendo così rovinosamente sull’asfalto.A seguito dell’allarme lanciato da alcuni automobilisti in transito, sul posto sono accorsi i sanitari del 118, che dopo aver prestato al 18enne le prime cure del caso ne hanno disposto il trasporto all’ospedale “Madonna del Soccorso” di San Benedetto del Tronto. Da qui il ragazzo è stato infine condotto in eliambulanza all’ospedale regionale di Torrette di Ancona per via della gravità delle lesioni riportate nella caduta.;2020-03-11; Marche Notizie;['Monteprandone', 'Incidenti Stradali'];https://www.ascolinotizie.it/34074/monteprandone-giovane-cade-in-scooter-sulla-salaria-interviene-leliambulanza;www.ascolinotizie.it;['marche']
29077;Spaccio nelle strade di San Benedetto del Tronto, tre le persone tratte in arresto;Tre persone sono state tratte in arresto nel corso dell’ultimo fine settimana a San Benedetto del Tronto con l’accusa di detenzione di stupefacenti ai fini di spaccio.A finire in manette sono stati due fratelli di origini campane di 58 e 52 anni e una 54enne del posto, compagna di uno di loro. I Carabinieri del comando locale hanno dapprima fermato nei pressi della Statale Adriatica uno dei due uomini, che ha dichiarato loro di essere diretto in una vicina farmacia sebbene privo di ricetta. Una volta rincasato, egli ha tentato invano di disfarsi della droga in suo possesso, venendo però bloccato dai militari.Quest’ultimi sono così riusciti a mettere le mani su all’incirca 150 grammi tra cocaina e eroina, che se immessi sul mercato avrebbero fruttato un guadagno stimabile in oltre 20.000 euro. Per i tre soggetti in questione è scattato inevitabilmente l’arresto.;2020-03-16; Marche Notizie;['Marche', 'San Benedetto Del Tronto', 'Gianfranco Fini'];https://www.ascolinotizie.it/34125/spaccio-nelle-strade-di-san-benedetto-del-tronto-tre-le-persone-tratte-in-arresto;www.ascolinotizie.it;['marche']
31942;Controlli della Polizia tra Ascoli Piceno e San Benedetto, un arresto e due denunce;Nel corso del fine settimana appena trascorso i controlli della Polizia di Stato di Ascoli Piceno e San Benedetto del Tronto hanno condotto a un arresto e a due denunce.A finire in manette è stato un 45enne di nazionalità marocchina, sorpreso dagli agenti nella serata di sabato 21 marzo all’esterno di un minimarket di piazza Garibaldi. Gli accertamenti svolti nei confronti di tale individuo hanno evidenziato come egli fosse ricercato da un mese su indicazione della Procura della Repubblica di Pescara: i poliziotti hanno così messo in atto il provvedimento di carcerazione emanato a suo carico, trasferendolo poi nel carcere di Marino del Tronto, dove dovrà scontare una condanna a sei mesi di reclusione per aver partecipato a una rissa nel capoluogo abruzzese.Ventiquattr’ore prima, a Porto d’Ascoli, un 30enne del luogo era stato denunciato per non aver rispettato le misure di contenimento anti-Coronavirus, in quanto sorpreso per strada senza un motivo valido.Sempre nella giornata di sabato, invece, un 27enne ascolano è stato denunciato per minacce a seguito di una furibonda lite familiare. Gli agenti sono intervenuti presso l’abitazione da lui condivisa con la madre, una donna di 58 anni in regime di arresti domiciliari, riscontrando gravi danni provocati dal giovane a mobili e infissi mediante l’utilizzo di un lungo coltello. Oltre all’arma in questione, all’interno dell’appartamento la Polizia ha inoltre rinvenuto e posto sotto sequestro altre lame potenzialmente pericolose.;2020-03-23; Marche Notizie;['Polizia', 'Marche', 'Ascoli Piceno', 'San Benedetto Del Tronto'];https://www.ascolinotizie.it/34223/controlli-della-polizia-tra-ascoli-piceno-e-san-benedetto-un-arresto-e-due-denunce;www.ascolinotizie.it;['marche']
32309;San Benedetto del Tronto, tatuatore abusivo di 23 anni denunciato dai Carabinieri;Continuano nel Piceno i controlli delle forze dell’ordine tesi a evitare la diffusione del contagio da Coronavirus: a San Benedetto del Tronto, nella giornata di lunedì 23 marzo, i Carabinieri si sono imbattuti in un tatuatore che esercitava abusivamente la propria attività.La scoperta è stata fatta presso un’abitazione del centro, nei pressi della quale i militari avevano notato un insolito viavai: una volta penetrati all’interno dell’edificio, essi si sono così trovati di fronte un 23enne del posto, il quale aveva dato vita a un proprio studio di tatuaggi benché privo di qualsiasi tipo di autorizzazione.I Carabinieri hanno immediatamente posto sotto sequestro ogni sorta di materiale adoperato dal giovane tatuatore, poi denunciato per esercizio abusivo della professione e per il mancato rispetto delle norme anti-Coronavirus: anche i suoi quattro clienti sorpresi nel locale al momento del blitz dovranno rispondere di quest’ultima accusa.;2020-03-24; Marche Notizie;['Marche', 'San Benedetto Del Tronto', 'Tatuaggi', 'Carabinieri'];https://www.ascolinotizie.it/34245/san-benedetto-del-tronto-tatuatore-abusivo-di-23-anni-denunciato-dai-carabinieri;www.ascolinotizie.it;['marche']
32757;Tenta un furto in un supermercato di Ascoli Piceno, denunciato un giovane;Nel pomeriggio di martedì 24 marzo i Carabinieri di Ascoli Piceno hanno denunciato un giovane del luogo, responsabile del furto di alcuni articoli presso un supermercato del capoluogo.L’individuo in questione, dopo essersi recato nel punto vendita Tigre situato in piazza Santa Maria Intervineas, ha raccolto dagli scaffali diversi prodotti in esposizione, dirigendosi quindi verso le casse: tuttavia, al momento di pagare, egli è scappato a gambe levate dal negozio, venendo inseguito da un addetto alla sicurezza.Immediata la segnalazione dell’accaduto ai Carabinieri, i quali hanno successivamente individuato il ladro nei pressi della via Salaria. Il giovane ha tentato invano di sottrarsi alle forze dell’ordine, venendo però rapidamente bloccato: egli dovrà ora rispondere dell’accusa di furto aggravato e resistenza a pubblico ufficiale.;2020-03-25; Marche Notizie;['Marche', 'Ascoli Piceno', 'Carabinieri'];https://www.ascolinotizie.it/34263/tenta-un-furto-in-un-supermercato-di-ascoli-piceno-denunciato-un-giovane;www.ascolinotizie.it;['marche']
33677;Castignano, evade dai domiciliari ma viene fermato dai controlli anti-Coronavirus;Nei giorni scorsi i Carabinieri di Castignano hanno tratto un arresto un 58enne del posto, sorpreso a vagare per strada nonostante fosse in regime di arresti domiciliari. L’individuo in questione, P.G. le sue iniziali, si sarebbe infatti dovuto trovare all’interno della propria abitazione per via di una condanna pregressa. Egli non ha però rispettato la misura restrittiva applicata nei suoi confronti, venendo sorpreso dalle forze dell’ordine nell’ambito dei controlli condotti per arginare la diffusione del Coronavirus.L’uomo è stato infine trasferito nel carcere ascolano di Marino del Tronto, in applicazione di un provvedimento di carcerazione emanato nel frattempo dal Tribunale di sorveglianza di Macerata.;2020-03-27; Marche Notizie;['Arresti Domiciliari', 'Carabinieri', 'Arresti'];https://www.ascolinotizie.it/34294/castignano-evade-dai-domiciliari-ma-viene-fermato-dai-controlli-anti-coronavirus;www.ascolinotizie.it;['marche']
36584;San Benedetto, scappa con il figlio sottratto allex-moglie: denunciato;Nei giorni scorsi la Polizia di Stato di San Benedetto del Tronto ha rintracciato e denunciato un uomo che, dopo essersi recato presso l’abitazione della moglie dalla quale si stava separando, si era allontanato con uno dei due figli.L’individuo in questione, già gravato da un provvedimento di divieto di avvicinamento nei confronti dell’ex, ha fatto perdere le proprie tracce per alcune ore. I poliziotti tuttavia, allertati proprio dalla coniuge dell’uomo, hanno condotto ricerche minuziose nell’intera provincia di Ascoli, riuscendo infine a rintracciare padre e figlio all’interno di un’autovettura.Il protagonista della vicenda è stato così denunciato per sottrazione di minore e atti persecutori: disposto inoltre un inasprimento delle misure precedentemente applicate a suo carico.;2020-04-3; Marche Notizie;['Marche', 'San Benedetto Del Tronto', 'Polizia'];https://www.ascolinotizie.it/34367/san-benedetto-scappa-con-il-figlio-sottratto-allex-moglie-denunciato;www.ascolinotizie.it;['marche']
