;title;content;date;author;tags;url;website-domain;region
15823;Task force dell'esercito, vigili e carabinieri forestali contro gli sversamenti abusivi di rifiuti...;Quello degli sversamenti abusivi, specie nella cosiddetta Terra dei fuochi, è un fenomeno sempre molto diffuso. Per porre un argine al problema, da oggi a Torre del Greco, sono stati disposti pattugliamenti da parte dell’esercito, polizia municipale e carabinieri forestali. Ad annunciarlo è il sindaco del comune vesuviano, Giovanni Palomba, che attraverso un comunicato del suo portavoce sottolinea come “l'intervento dei militari, richiesto attraverso la Prefettura di Napoli, si è reso necessario per fronteggiare l'evidente ed indiscriminato sversamento dei rifiuti e degli ingombranti in città, anche in considerazione dell'avvio del nuovo piano industriale del 'porta a porta’ e, al contempo, per evidenziare ed individuare anomalie ed eventuali responsabilità da ricondursi alla diretta raccolta degli stessi”. Così da oggi un dispiegamento di militari del Raggruppamento Campania a comando del nono reggimento fanteria Bari della Brigata Pinerolo e di forze armate, come si apprende dall'Ente comunale, opererà “per porre in essere azioni di controllo e di sorveglianza del territorio, in riferimento al rispetto degli orari e del conferimento, nonché della raccolta dei rifiuti secondo le indicazioni del calendario vigente”.;2020-02-26; Campanianotizie;['Carabinieri', 'Campania', 'Torre del Greco', 'Polizia'];http://www.campanianotizie.com/cronaca/napoli/154404-task-force-contro-sversamenti-abusivi-di-tifiuti-a-torre-del-greco-sindaco-palomba-individuare-anomalie.html;www.campanianotizie.com;['campania']
16083;Napoli, polizia sequestra arsenale nel Rione Baronessa: 6 pistole e centinaia di proiettili...;Uno zaino pieno pistole e munizioni è stato trovato mercoledì sera gli agenti del commissariato di polizia San Giovanni-Barra, intervenuti a seguito di una segnalazione anonima in via Raffaele Testa, nel Rione Baronessa di San Giovanni a Teduccio. Sei pistole e centinaia di munizioni. A tanto ammonta l'arsenale custodito nello zainetto. Un duro colpo ai clan di Napoli Est da tempo protagonisti di una guerra sotterranea per la spartizione degli affari.;2020-02-27; Campanianotizie;['Campania', 'Napoli', 'Polizia'];http://www.campanianotizie.com/cronaca/napoli/154409-napoli-polizia-sequestra-arsenale-nel-rione-baronessa-6-pistole-e-centinaia-di-proiettili-nascosti-in-uno-zaino.html;www.campanianotizie.com;['campania']
16084;Violenza sul figlio disabile, lo picchia brutalmente provocandogli una ferita alla testa: in...;I Carabinieri della Sezione Radiomobile di Nola, a San Gennaro Vesuviano, hanno arrestato per maltrattamenti in famiglia un 42enne del posto già noto alle forze dell’ordine. L’uomo ha picchiato il figlio disabile 24enne, con il quale convive, provocandogli delle lesioni. I militari sono intervenuti di notte presso l’abitazione della famiglia e hanno trovato il giovane in stato di agitazione e ferito alla testa. Hanno constatato che era stato aggredito dal padre. Il ragazzo è stato trasportato presso l’ospedale dal personale sanitario. Lì, ha ricevuto le cure del caso e gli è stato riscontrato un trauma cranico, graffi ed edemi guaribili in 10 giorni. Questa è stata l’ultima storia di violenza in quella famiglia dove si erano già verificati precedenti episodi di aggressione da parte del padre nei confronti del figlio. Il giovane aveva già denunciato suo padre in passato. L’arrestato è stato tradotto in carcere a Napoli ed è a disposizione dell’autorità giudiziaria.;2020-02-27; Campanianotizie;['Disabili', 'Carceri', 'Carabinieri', 'Nola', 'Arresti'];http://www.campanianotizie.com/cronaca/napoli/154410-violenza-sul-figlio-disabile-lo-picchia-brutalmente-provocandogli-una-ferita-alla-testa-in-carcere-42enne-del-napoletano.html;www.campanianotizie.com;['campania']
16085;Giugliano in Campania, trasporto e smaltimento illecito di rifiuti: 3 persone denunciate;Nel corso di un servizio ad alto impatto effettuato dai carabinieri e disposto dal comando provinciale di Napoli, i militari della compagnia di Giugliano insieme a quelli del reggimento Campania hanno incentrato i loro sforzi nella zona costiera della città. In particolare hanno denunciato un 36enne incensurato di Castel Volturno e una coppia di cittadini romeni, già noti alle forze dell’ordine per trasporto e raccolta illeciti di rifiuti. Il 36enne è stato controllato a bordo del proprio autocarro mentre trasportava circa un quintale di rifiuti speciali di tipo ferroso (pezzi di canna fumaria, lamiere zincate, sedie in disuso, tubi per segnaletica stradale) mentre la coppia, a bordo di un altro mezzo sprovvisto di targa e con telaio abraso, trasportavano senza alcuna autorizzazione 4 metri cubi circa di rifiuti di vario genere. I carabinieri hanno effettuato diverse perquisizioni a pregiudicati del posto e hanno denunciato 2 soggetti che, ristretti agli arresti domiciliari per stupefacenti, venivano trovati in possesso di droga.;2020-02-27; Campanianotizie;['Campania', 'Giugliano', 'Carabinieri', 'Napoli'];http://www.campanianotizie.com/cronaca/napoli/154411-giugliano-in-campania-trasporto-e-smaltimento-illecito-di-rifiuti-3-persone-denunciate.html;www.campanianotizie.com;['campania']
16141;VIDEO Acerra, dipendenti del Comune scaricano da tempo rifiuti in un terreno: i carabinieri...;Nella giornata di ieri, in località Marchesa ad Acerra, in uno dei loro giri di perlustrazione del territorio, i Volontari Antiroghi Acerra, di cui fanno parte i noti attivisti Vincenzo Petrella ed Alessandro Cannavacciuolo, hanno scoperto una pratica che andava avanti da oltre un anno: uomini e mezzi del comune erano soliti sversare in un terreno sfalci di potatura misti a rifiuti di altro genere. A seguito della loro denuncia i carabinieri hanno avviato le indagini per accertare eventuali responsabilità in materia di violazione delle norme ambientali e sequestrato l'intera area dove avvenivano gli sversamenti.;2020-02-27; Campanianotizie;['Video', 'Campania', 'Acerra', 'Carabinieri', 'Attivismo'];http://www.campanianotizie.com/cronaca/napoli/154415-video-acerra-dipendenti-del-comune-scaricano-da-tempo-rifiuti-in-un-terreno-i-carabinieri-sequestrano-lintera-area.html;www.campanianotizie.com;['campania']
16142;Violento incidente sull'Autostrada A1 all'altezza di Capua, traffico bloccato in direzione Milano:...;Erano circa le 10:30 quando sull’Autostrada A1, all’altezza di Capua, si è verificato un violento incidente: al km 728 una vettura è rimasta coinvolta in un sinistro stradale e da allora si sono formati 5 chilometri di coda. L'impatto è stato tremendo, anche a causa della velocità. Attualmente la carreggiata in direzione Milano è praticamente bloccata. Si procede a passo d'uomo con la polizia stradale che sta cercando di far ritornare regolare il traffico delimitando l'area dell'incidente. Importanti code, fino a 2 chilometri, si sono formate anche sulla carreggiata opposta, quella verso Napoli, a causa dei 'curiosi' che rallentano per guardare e capire quanto accaduto.;2020-02-27; Campanianotizie;['Incidenti Stradali', 'Capua', 'Lombardia', 'Milano'];http://www.campanianotizie.com/cronaca/caserta/154416-violento-incidente-sullautostrada-a1-allaltezza-di-capua-traffico-bloccato-in-direzione-milano-5-km-di-coda.html;www.campanianotizie.com;['lombardia', 'campania']
16185;Compravendita di auto estere con evasione totale dell'Iva, sgominata organizzazione operante nel...;"Un’ordinanza di custodia cautelare in carcere a carico di due persone (una in carcere e l’altra ai domiciliari), emessa dal Tribunale di Santa Maria Capua Vetere, è stata eseguita dalla Guardia di Finanza di Capua. Gli indagati sono ritenuti l'organizzatore e un componente di una associazione per delinquere finalizzata ad una ""insidiosa frode fiscale"" nel settore della compravendita di autovetture di lusso provenienti dall'estero. C'è stato inoltre un sequestro preventivo di beni per un valore di oltre mezzo milione di euro.  L'attività di indagine, denominata 'Foreign Cars' ha permesso di individuare e neutralizzare un gruppo criminale, operante a Santa Maria Capua Vetere, che ha commercializzato, solo dal 2014 al 2017, centinaia di veicoli di provenienza comunitaria in totale evasione d'imposta, immatricolate in Italia grazie a fatture false. L'organizzatore della frode, secondo il gip, è Raffaele Perrino, 56enne, che ha utilizzato 8 società italiane e 3 con sede in Repubblica Ceca, tutte intestate a prestanomi compiacenti ed evasori fiscali. L'organizzazione agiva in due modi: si compravano le auto da Germania, Belgio e Repubblica Ceca in sospensione d'imposta attraverso le società commerciali italiane e poi le fatture rilasciate dalle concessionarie estere venivano falsificate indicando falsamente quale acquirente il soggetto privato italiano a cui veniva rivenduta l'auto. In pratica risultava pagata all'estero con la relativa Iva che però non era mai stata assolta. Oppure si faceva addirittura figurare fittiziamente nella fattura quale venditore una società con sede a Praga, inserendo anche in questo caso l'Iva relativa come assolta all'atto della vendita in territorio estero. Complessivamente sono 12 i soggetti indagati tra i quali anche le 'teste di legno' che si sono prestate all'intestazione delle società. Nei guai anche due segretarie che hanno materialmente predisposto la documentazione falsa, distruggendola, su indicazione di Perrino, al termine di ogni giornata lavorativa così da non lasciare alcuna traccia. Decisivo ai fini dell'indagine il blitz della Finanza nel capannone utilizzato come base operativa che ha permesso anche di acquisire alcuni supporti informatici e apparati di telefonia mobile che hanno svelato le numerose operazioni illecite. Nell'indagine è emersa anche la complicità di un militare appartenente alla Guardia di Finanza, indagato per rivelazione di atti coperti da segreto d'ufficio in quanto avrebbe agevolato il Perrino sia nell'attività illecita, sia nel tentativo di vanificare gli approfondimenti investigativi in corso. L’altro indagato raggiunto dall’ordinanza di custodia cautelare ai domiciliari è uno dei più stretti collaboratori di Perrino, il 56enne Franco Emilio Viti.";2020-02-27; Campanianotizie;['Evasione Fiscale', 'Fisco', 'Tasse', 'IVA', 'Arresti', 'Arresti Domiciliari', 'Custodia Cautelare', 'Carceri', 'Giustizia', 'Tribunali'];http://www.campanianotizie.com/cronaca/caserta/154418-compravendita-di-auto-estere-con-evasione-totale-delliva-sgominata-organizzazione-operante-nel-casertano-2-arresti-e-oltre-500mila-euro-di-beni-sequestrati.html;www.campanianotizie.com;['campania']
16186;Stalking con calunnie e atti intimidatori per 'annientare' le vittime: in carcere 4 persone del...;Un'attività di stalking volta ad ‘annientare’ le vittime attraverso calunnie e azioni intimidatorie è stata scoperta e disarticolata dai carabinieri della stazione di Boscoreale che hanno dato esecuzione ad un'ordinanza di applicazione della misura cautelare della custodia in carcere, emessa dal gip di Torre Annunziata, su richiesta della Procura, nei confronti di quattro indagati, dei quali non sono state fornite le generalità, accusati a vario titolo e in concorso oltre che di stalking anche di incendio doloso, detenzione di sostanze stupefacenti e materiale esplodente e calunnia aggravata. Tutto ha preso il via dalla denuncia di una donna che si era vista incendiare alcune vetture di sua proprietà all'interno del cortile della sua abitazione. Le indagini su questi episodi hanno consentito ai militari dell'Arma di documentare una lunga serie di attività criminose tutte “dirette ad 'annientare’ le vittime - spiega in una nota il procuratore della Repubblica facente funzioni di Torre Annunziata, Pierpaolo Filippelli - e, grazie alla complessa reti di accertamenti tecnici attuata dagli inquirenti, sono stati individuati gli autori di quella che era una vera e propria escalation criminale volta a danneggiare le vittime”. L'esecuzione della misura cautelare nei confronti dei quattro soggetti coinvolti nell'indagine “ha di fatto - conclude Filippelli - liberato le vittime dalla morsa di gravissimi atti persecutori, fatti di danneggiamenti aggravati, minacce, calunnie ed attentati dinamitardi che avevano sconvolto l'esistenza delle vittime soggiogate dal sentimento di paura”.;2020-02-27; Campanianotizie;['Stalking', 'Carceri', 'Carabinieri', 'Boscoreale'];http://www.campanianotizie.com/cronaca/napoli/154419-stalking-con-calunnie-e-atti-intimidatori-per-annientare-le-vittime-in-carcere-4-persone-del-napoletano.html;www.campanianotizie.com;['campania']
16232;Sgominata organizzazione per il traffico internazionale di sigarette con base a Napoli: 8 arresti e...;Otto persone appartenenti ad un’organizzazione dedita al traffico internazionale di sigarette, che venivano importate dall’Est Europa all’Italia, sono state raggiunte da un’ordinanza di custodia cautelare, emessa dal Gip del Tribunale di Napoli ed eseguita dai finanzieri del Gico di Napoli. Le indagini, coordinate dalla Direzione Distrettuale Antimafia partenopea, hanno ricostruito l'operatività di un gruppo criminale che avrebbe avuto contatti con delle organizzazioni in Grecia. Gli indagati hanno sperimentato diverse rotte per l'importazione dei tabacchi di contrabbando in Italia, e dei sistemi di occultamento dei carichi. Sono stati scoperti, infatti, dagli specialisti del Gico pacchetti di sigarette nascosti all'interno di un carroponte industriale. Per quanto riguarda gli itinerari, la merce proveniente dall'Est Europa sarebbe stata introdotta in Italia via mare dalla Grecia a bordo di autoarticolati stranieri e occultata tra carichi di copertura diversi. Una volta sbarcati in Italia, nei porti di Bari o Brindisi, gli autotrasportatori si dirigono verso Napoli, ed avrebbero utilizzato delle 'staffette' per verificare l'assenza di posti di controllo delle Forze di Polizia lungo il percorso. In base agli elementi raccolti nel corso delle indagini, il sodalizio avrebbe cambiato il proprio modus operandi, dopo i numerosi sequestri, facendo arrivare i carichi solo via terra, nei depositi delle province di Parma e Bologna, optando quindi per un frazionamento delle spedizioni dall'Emilia Romagna a Napoli per ridurre il rischio dei sequestri. Nel corso delle indagini, sono state sequestrate oltre 30 tonnellate di sigarette e sono state arrestate in flagranza di reato 10 persone, alle quali si aggiungono gli 8 soggetti raggiunti dalla ordinanza di custodia cautelare. Il capo del gruppo criminale, F.S., è stato catturato in Grecia, anche grazie alla collaborazione della Polizia ellenica.;2020-02-27; Campanianotizie;['Campania', 'Napoli', 'Arresti', 'Custodia Cautelare', 'Giustizia', 'Tribunali'];http://www.campanianotizie.com/cronaca/napoli/154421-sgominata-organizzazione-per-il-traffico-internazionale-di-sigarette-con-base-a-napoli-8-arresti-e-oltre-30-tonnellate-di-bionde-sequestrate.html;www.campanianotizie.com;['campania']
16233;Appello del processo per l'omicidio dell'imprenditore Amelio nel Napoletano: condannati...;Erano tutti imputati nel processo per l’omicidio dell’imprenditore di Mugnano, Enrico Amelio, e sono stati tutti condannati all’ergastolo dal giudice della Corte d'Assise d'Appello di Napoli (prima sezione): Giuseppe Polverino, Salvatore Licciardi, Salvatore Simioli, Salvatore Cammarota e Claudio De Biase. Amelio cadde vittima di un agguato nel 2006 e trucidato dai sicari del clan Polverino. L'uomo, avvicinato dal killer assoldato dai Polverino nei pressi della scuola Gioberti di Quarto, fu centrato da tre colpi alla gamba destra e uno alla gamba sinistra. Fu l’ultimo proiettile ad essergli fatale: recise l'arteria femorale dell'imprenditore provocandogli la morte. L’agguato gli fu teso non molto tempo dopo Amelio si era trasferito nel basso Lazio.;2020-02-27; Campanianotizie;['Omicidi', 'Clan Napoletano', 'Ergastolo', 'Giuseppe Polverino', 'Mugnano Di Napoli', 'Giustizia', 'Campania', 'Napoli'];http://www.campanianotizie.com/cronaca/napoli/154422-appello-del-processo-per-lomicidio-dellimprenditore-amelio-nel-napoletano-condannati-allergastolo-mandanti-e-killer-del-clan-polverino.html;www.campanianotizie.com;['campania']
16308;Improvvisa una ditta di espurgo abusiva e 'smaltisce' i liquami delle abitazioni in un terreno del...;Offriva i suoi servizi con un’improvvisata ditta di espurgo per alcune civili abitazioni di Somma Vesuviana e Sant'Anastasia, ma dopo aver effettuato il lavoro per quale si faceva pagare scaricava tutto in un terreno agricolo. Questa è la pratica illecita scoperta dai carabinieri forestali Parco di Ottaviano, coordinati dal colonello Antonio Lamberti, che dopo alcune segnalazioni per gli odori pestilenziali che si avvertivano nella zona hanno sorpreso un 50enne di Somma Vesuviana intento a scaricare i liquami nel terreno. Dopo i controlli di rito l'uomo è stato denunciato alla Procura della Repubblica di Nola per raccolta, trasporto e smaltimento illecito di rifiuti liquidi. Il trattore utilizzato e il rimorchio sono stati sequestrati ai fini dell'eventuale confisca e disposta una ricognizione nell’area interessata dagli sversamenti per eventuali operazioni di bonifica.;2020-02-27; Campanianotizie;['Lavoro'];http://www.campanianotizie.com/cronaca/napoli/154423-improvvisa-ditta-di-espurgo-abusiva-e-smaltisce-i-liquami-delle-abitazioni-in-un-terreno-del-vesuviano-50enne-denunciato-e-mezzi-sequestrati.html;www.campanianotizie.com;['campania']
16361;Carcere di Secondigliano, 40enne si impicca in cella: era accusato di violenza sessuale;"Samuele Ciambriello, garante campano dei detenuti, rende noto che c'è stato un suicidio nel carcere di Secondigliano. Un quarantenne, della provincia di Salerno, in attesa di giudizio, accusato di violenza sessuale, si è tolto la vita impiccandosi in cella. Per Ciambriello ""ancora una volta si muore di carcere contravvenendo allo spirito costituzionale che all'articolo 27 recita che il carcere ha una funzione rieducativa e di socializzazione"". ""Anche in questo luogo così remoto vanno rispettati i diritti e la dignità delle persone"" aggiunge Ciambriello. Secondo il garante ""quando si muore di carcere ed in carcere è una sconfitta per tutti: sia per gli operatori che si prodigano quotidianamente, tra mille difficoltà per rendere più umane le pene, sia per la politica che ha fatto del carcere e, più in generale, della giustizia penale, un luogo di afflizione, di vendetta ed esclusione sociale"". A parere di Ciambriello ""occorre bilanciare la certezza della pena, il bisogno di giustizia delle vittime, con la possibilità di recuperare e far ricominciare a chi ha sbagliato"".";2020-02-27; Campanianotizie;['Carceri', 'Secondigliano', 'Campania', 'Salerno'];http://www.campanianotizie.com/cronaca/napoli/154426-carcere-di-secondigliano-40enne-si-impicca-in-cella-era-accusato-di-violenza-sessuale.html;www.campanianotizie.com;['campania']
16457;Napoli, 850 grammi di marijuana nascosti in casa: ai domiciliari 52enne per detenzione e spaccio di...;I Carabinieri del nucleo operativo della Compagnia Stella hanno arrestato per detenzione di droga a fini di spaccio, nel quartiere Pendino a Napoli, A. D., 52enne napoletana già nota alle forze dell'ordine. I militari in questi giorni hanno notato dei movimenti sospetti nei pressi dell'abitazione della donna e hanno deciso di perquisire la sua abitazione. Considerevole il ‘bottino’ che i carabinieri hanno trovato: 165 dosi di marijuana, già pronte per essere vendute, e 7 buste di cellophane della stessa sostanza per un peso complessivo di 850 grammi. La droga era nascosta nella stanza da letto tra l'infisso della finestra e la persiana. I carabinieri hanno anche trovato e sequestrato 2 bilancini di precisione e materiale vario per il confezionamento della sostanza stupefacente. La 52enne è stata collocata agli arresti domiciliari in attesa di giudizio.;2020-02-28; Campanianotizie;['Campania', 'Napoli', 'Droga', 'Carabinieri', 'Arresti', 'Gianfranco Fini'];http://www.campanianotizie.com/cronaca/napoli/154428-napoli-850-grammi-di-marijuana-nascosti-in-casa-ai-domiciliari-52enne-per-detenzione-e-spaccio-di-stupefacenti.html;www.campanianotizie.com;['campania']
16483;Truffa aggravata, riciclaggio e appropriazione indebita nel Casertano: maxi sequestro beni da 25...;"All'esito di mirati accertamenti economico-patrimoniali e dopo una prolungata istruttoria in contraddittorio con la parte, il Tribunale di Santa Maria Capua Vetere - Sezione Misure di Prevenzione ha disposto la confisca di beni mobili e immobili, nonché di partecipazioni societarie e relativi compendi aziendali, per un valore stimato in circa 25 milioni di curo, nella disponibilità di Pasquale Piccirillo, 56enne imprenditore operante nei settori sanitario, editoriale, delle telecomunicazioni e immobiliare, nei confronti del quale è stata, altresì, applicata la misura della sorveglianza speciale di pubblica sicurezza per la durata di anni 2. Il provvedimento è in corso di esecuzione da parte dei militari del Nucleo di Polizia Economico Finanziaria della Guardia di Finanza di Caserta in Campania, Lazio, Veneto e Svizzera. L'odierna attività costituisce l'epilogo di un'articolata attività investigativa svolta dalle Fiamme Gialle e coordinata dall’Ufficio giudiziario, finalizzata alla ricostruzione del profilo di pericolosità sociale di Piccirillo e all'individuazione dei proventi illeciti che gli hanno permesso un ingiustificato arricchimento personale e l'accumulazione nel tempo di un ingente patrimonio. Il 56enne è stato, infatti, riconosciuto quale imprenditore connotato da una pericolosità sociale del tipo ""economico-finanziaria"" alla luce del suo coinvolgimento, nel periodo 2007-2017, in molteplici vicende giudiziarie concernenti, in particolare, numerosi e diversi delitti a sfondo patrimoniale, quali truffe aggravate per il conseguimento di erogazioni pubbliche, riciclaggio, appropriazione indebita e delitti tributari per evasione fiscale ed utilizzo ed emissione di fatture per operazioni inesistenti. Sulla base di queste evidenze, già nel marzo del 2018 veniva sequestrato il patrimonio nella disponibilità dell'imprenditore e iniziava così una prolungata fase istruttoria dinanzi al collegio giudicante che, esaminate le deduzioni difensive e gli esiti degli ulteriori approfondimenti investigativi svolti, riconosceva la pericolosità sociale del proposto, disponendo la confisca, delle quote societarie e relativi complessi aziendali di 2 imprese (tra cui la società ""cassaforte"", utilizzata quale schermo per disporre del patrimonio illecitamente accumulato), 98 immobili (ubicati nelle province di Caserta, Napoli, Latina, Avellino, l'Aquila e in territorio svizzero), 15 autoveicoli e 1 motoveicolo nonché delle disponibilità finanziarie presenti in numerosi conti correnti, conti di deposito e altri investimenti finanziari, per un valore totale stimato superiore ai 25 milioni di curo. Gli esiti di questa attività, che per peculiarità, rilevanza e approccio investigativo, non ha precedenti sul territorio provinciale, costituiscono ulteriore chiara testimonianza del costante presidio esercitato da questa Procura, per l'aggressione dei patrimoni illecitamente accumulati attraverso la commissione di gravi reati economico-finanziari.";2020-02-28; Campanianotizie;['Truffe', 'Giustizia', 'Tribunali', 'Santa Maria Capua Vetere'];http://www.campanianotizie.com/cronaca/caserta/154430-truffa-aggravata-riciclaggio-e-appropriazione-indebita-nel-casertano-maxi-sequestro-beni-da-25-milioni-di-eruo-per-il-dentista-editore-piccirillo.html;www.campanianotizie.com;['campania']
16484;Napoli, ruba lo smatphone e 10 euro a un coetaneo: in carcere 19enne già noto alle forze dell'ordine;Un 19enne del quartiere Avvocata di Napoli, già noto alle forze dell’ordine, è stato arrestato dai Carabinieri della stazione Vomero-Arenella. Il Gip del Tribunale di Napoli, su proposta della Procura partenopea ed in accordo con i risultati investigativi dell'Arma, ha emesso un'ordinanza di custodia cautelare in carcere. Il giovane è gravemente indiziato per il reato di rapina, commesso il 21 settembre scorso, vicino alla Stazione della metro ‘Salvator Rosa’. Insieme ad un complice, ancora da identificare, il 19enne ha rubato ad un coetaneo lo smartphone e 10 euro. Il ragazzo è stato arrestato e portato al carcere di Poggioreale.;2020-02-28; Campanianotizie;['Campania', 'Napoli', 'Carceri', 'Arresti', 'Carabinieri', 'Giustizia', 'Tribunali', 'Inchieste-investigazioni-indagini'];http://www.campanianotizie.com/cronaca/napoli/154431-2020-02-28-09-32-04.html;www.campanianotizie.com;['campania']
