;title;content;date;author;tags;url;website-domain;region
180;Gel igienizzante pericoloso venduto online e in alcuni negozi del Salernitano: sequestrati 10mila...;La Guardia di Finanza di Salerno, su disposizione della procura di Vallo della Lucania, ha sequestrato, oltre 10.000 confezioni da 500 ml di gel igienizzante, in vendita anche on-line. In particolare, i Finanzieri della Compagnia di Agropoli, hanno notato in alcuni negozi di Agropoli e Capaccio-Paestum, nel Salernitano, diversi flaconi di un gel igienizzante per le mani, la cui etichetta ne esaltava la proprietà battericida e ne ammetteva l'utilizzo senz'acqua. Dagli esami, invece, è emerso che il gel, prodotto e posto in commercio da una società di Brusciano, era composto da una particolare miscela chimica, il cui utilizzo, in base alle norme comunitarie in materia, impone l'immediato risciacquo. Il ministero della Sanità ha certificato che l'igienizzante sarebbe stato prodotto con ingredienti non ammessi, specificando che la sostanza contenuta è vietata nei prodotti senza risciacquo, per problemi legati all'insorgenza di allergie cutanee.;2020-05-9; Campanianotizie;['Guardia di Finanza', 'Campania', 'Salerno', 'Agropoli'];http://www.campanianotizie.com/cronaca/salerno/155771-gel-igienizzante-pericoloso-venduto-online-e-in-alcuni-negozi-del-salernitano-sequestrati-10mila-flaconi-di-prodotto.html;www.campanianotizie.com;['campania']
209;Mascherine per bambini non sicure: 900 pezzi contraffatti sequestrati dalla guardia di finanza nel...;Il Comando Provinciale della Guardia di Finanza di Napoli ha sequestrato nella zona industriale circa 900 mascherine per bambini non a norma e con loghi contraffatti. L’operazione ha preso le mosse da un normale controllo anticovid-19 agli esercizi commerciali nel corso del quale le Fiamme Gialle del 2° Nucleo Operativo Metropolitano hanno notato che in un negozio di “Cinamercato” venivano messi in vendita dispositivi di protezione individuali “sospetti”. Grazie ai successivi riscontri, anche di natura documentale, è stato appurato che le mascherine, oltre a riportare loghi contraffatti di famosi personaggi dei videogiochi e serie televisive (quali “Fortnite”, “Bing” e “Me contro Te”), non erano a norma dal punto di vista sanitario. In particolare, i dispositivi, venduti a 5 euro ciascuno, erano sprovvisti della certificazione obbligatoria di conformità e non avrebbero garantito alcuna sicurezza ai bambini contro il rischio contagio. Le mascherine sono state sequestrate e il titolare del negozio, un 46enne di origine cinese, è stato denunciato all’Autorità Giudiziaria per frode in commercio, contraffazione marchi e ricettazione.;2020-05-9; Campanianotizie;['Contraffazione', 'Guardia di Finanza', 'Campania', 'Napoli'];http://www.campanianotizie.com/cronaca/napoli/155770-mascherine-per-bambini-non-sicure-900-pezzi-contraffatti-sequestrati-dalla-guardia-di-finanza-nel-napoletano.html;www.campanianotizie.com;['campania']
239;Sversamento illecito di liquami, reflui di azienda bufalina nelle acque circostanti: denunciato...;Un imprenditore 45enne della provincia di Caserta è stato denunciato dai carabinieri della stazione di Varcaturo, insieme ai forestali della stazione di Pozzuoli hanno denunciato per gestione di rifiuti non autorizzata. L’uomo è titolare di un’azienda zootecnica bufalina situata nella zona costiera della città. Senza utilizzare vasche o reti di contenimento ha permesso che liquami e letame degli animali fossero sversati sul suolo nudo e raggiungessero le acque superficiali circostanti. L’azienda, estesa su una superficie di circa 3500 mq, contenente un allevamento di circa 100 capi di bestiame, sorge a ridosso del Lago Patria: lo sversamento è stato notato grazie ai controlli fatti dall’alto da un velivolo del 7° nucleo elicotteri di Pontecagnano.;2020-05-9; Campanianotizie;['Campania', 'Caserta', 'Carabinieri', 'Pozzuoli'];http://www.campanianotizie.com/cronaca/caserta/155772-sversamento-illecito-di-liquami-reflui-di-azienda-bufalina-nelle-acque-circostanti-denunciato-imprenditore-45enne-del-casertano.html;www.campanianotizie.com;['campania']
260;Spaccio di droga 'a conduzione familiare' ad Aversa, coppia di coniugi sorpresi con hashish e una...;I carabinieri della sezione operativa della compagnia di Marcianise hanno tratto in arresto, ad Aversa, per detenzione ai fini di spaccio di sostanza stupefacente e detenzione illegale di arma comune da sparo, M. F., 33enne, e P. S., 28enne, coniugi del posto. I militari dell’Arma, a seguito di perquisizione presso la loro l’abitazione hanno rinvenuto e sequestrato una pistola marca Colt, calibro 38, con 4 proiettili dello stesso calibro, e 2 panetti di sostanza stupefacente del tipo “hashish” per un peso complessivo di circa 80 grammi, nonché 5 telefoni cellulari di varie marche e la somma contante di 480 euro, ritenuta provento di attività illecita. La donna, al momento dell’irruzione nell’appartamento da parte dei carabinieri, ha tentato di disfarsi dell’arma e dello stupefacente, gettandoli dal balcone. I militari posti a cinturazione dell’edificio hanno immediatamente recuperato sia l'arma che lo stupefacente.  L’uomo è stato condotto presso il carcere di Santa Maria Capua Vetere mentre, la donna è stata posta ai domiciliari presso la propria abitazione.;2020-05-9; Campanianotizie;['Droga', 'Campania', 'Aversa', 'Carceri', 'Carabinieri', 'Marcianise', 'Gianfranco Fini'];http://www.campanianotizie.com/cronaca/caserta/155775-spaccio-di-droga-a-conduzione-familiare-ad-aversa-coppia-di-coniugi-sorpresi-con-hashish-e-una-pistola-in-casa-lui-in-carcere-e-lei-ai-domiciliari.html;www.campanianotizie.com;['campania']
261;Operazione 'Strade Sicure', scarico di liquami in un terreno agricolo: fondo da 20mila mq...;Militari appartenenti alla Stazione Carabinieri Forestale di Marcianise, allertati da una pattuglia dell’Esercito Italiano del contingente “Strade Sicure” impegnata nell’espletamento di un’attività di controllo del territorio finalizzata al contrasto dei reati in danno all’ambiente nell’ambito della problematica di emergenza ambientale della cosiddetta “Terra dei Fuochi”, si sono portati su un fondo agricolo in comune di San Tammaro, in una zona limitrofa alla discarica di R.S.U. denominata “Maruzzella III”, laddove hanno accertato un ingente sversamento di reflui su suolo nudo, trasportati mediante l’utilizzo di due grosse autocisterne. I conducenti delle due autocisterne sono risultati anche essere due dei tre fratelli comproprietari del fondo agricolo interessato dall’ingente sversamento di “digestato” proveniente da un impianto per la produzione di biogas situato in provincia di Salerno. Benché i proprietari fossero in possesso di una Comunicazione formalizzata al Comune di San Tammaro per porre in essere un’utilizzazione agronomica ammessa dalla normativa vigente a determinate condizioni, lo stato dei luoghi, invece, evidenziava la chiara volontà di volersi disfare illecitamente del materiale “digestato” utilizzando il fondo come sito di smaltimento. Infatti, sul fondo agricolo interessato non vi erano colture agricole in atto e le peculiari modalità di sversamento del “liquido”, effettuata tramite tubo di grosso diametro in un medesimo punto, hanno fatto chiaramente comprendere che non si stavano perseguendo le finalità agronomiche previste dalle leggi di settore mediante un corretto, proporzionato e razionale spandimento con finalità di concimante ed ammendante del terreno e nel rispetto delle concentrazioni massime di apporto di nitrati e di sostanza organica (senza pericolo per l’ambiente e la salute umana). Le modalità di sversamento del “digestato” erano, invece, molto più simili ad una vera e propria operazione di “lagunaggio”, operazione di smaltimento rifiuti liquidi prevista dal Testo Unico Ambientale. Per quanto rilevato i predetti militari hanno proceduto al sequestro preventivo dell’intero fondo agricolo, dell’estensione di circa 20.000 mq, per il reato di gestione illecita di rifiuti speciali non pericolosi, deferendo all’Autorità Giudiziaria, in stato di libertà, i tre germani proprietari del fondo agricolo. Seguiranno accertamenti per stabilire se la condotta penalmente rilevante posta in essere possa anche aver prodotto una contaminazione della matrice suolo e delle sottostanti acque di falda a causa del probabile superamento della normale capacità di assorbimento da parte del suolo a causa degli ingenti concentrati apporti in termini di azoto e di sostanza organica biodegradabile.;2020-05-9; Campanianotizie;['Carabinieri', 'Campania', 'Marcianise'];http://www.campanianotizie.com/cronaca/caserta/155776-operazione-strade-sicure-scarico-di-liquami-in-un-terreno-agricolo-fondo-da-20mila-mq-sequestrato-e-due-fratelli-denunciati.html;www.campanianotizie.com;['campania']
383;Napoli, accoltella l'attuale compagno dell'ex moglie: arrestato 32enne del Rione Traiano. Vittima...;Un 32enne del Rione Traiano a Napoli ha aggredito, anche con un coltello, il compagno 20enne della sua ex moglie: per questo è stato arrestato dai militari della Compagnia di Bagnoli e del Nucleo Radiomobile. Il ferito è attualmente ricoverato in prognosi riservata all'Ospedale Cardarelli. L'aggressione è avvenuta nel tardo pomeriggio di ieri. La vittima è stata avvicinata sotto casa, nel Rione Traiano: lì in pochi minuti si è verificata l'aggressione, poi la fuga in macchina. Sul posto è rimasto traumatizzato e gravemente ferito il 20enne che soccorso dal 118 è stato trasportato in codice rosso al Cardarelli. I militari appena giunti sul posto hanno messo insieme i primi elementi che hanno consentito di individuare e fermare, in breve tempo, l'aggressore.;2020-05-9; Campanianotizie;['Campania', 'Napoli', 'Arresti', 'Nucleo Radiomobile'];http://www.campanianotizie.com/cronaca/napoli/155778-napoli-accoltella-lattuale-compagno-dellex-moglie-arrestato-32enne-del-rione-traiano-vittima-ricoverata-in-ospedale-con-prognosi-riservata.html;www.campanianotizie.com;['campania']
384;Fase 2, controlli serrati a Napoli anche col supporto di un elicottero: due denunce per droga e una...;Controlli serrati durante l’inizio della ‘fase 2’ a Napoli. Sin dalle prime luci dell’alba i carabinieri del comando provinciale di Napoli, insieme a quelli del nucleo cinofili di Sarno e del nucleo elicotteristi di Pontecagnano. Riflettori puntati su Quartieri Spagnoli e Pignasecca: molte le perquisizioni e le persone controllate. Due le persone denunciate per detenzione di stupefacente a fini di spaccio: nella loro auto fermata durante un posto di controllo è stato rinvenuto un pacchetto contenente 61 grammi di marijuana. La droga, posta sotto sequestro, era verosimilmente destinata allo smercio nel centro città. Un 40enne dei Quartieri Spagnoli è stato denunciato per porto abusivo di arma da taglio: nelle sue tasche un coltello da “lancio” di circa 10 cm. Controllato in Vico Lungo San Matteo, l'uomo è stato perquisito e trovato in possesso della lama, poi sequestrata. Due le persone denunciate per false generalità: sperando di superare indenni i controlli anti-contagio dei militari hanno fornito nomi inventati. Smascherati, sono stati denunciati. Tre, invece, le persone denunciate per guida senza patente. I controlli continueranno anche nei prossimi giorni.;2020-05-9; Campanianotizie;['Campania', 'Napoli', 'Droga', 'Tagli', 'Carabinieri'];http://www.campanianotizie.com/cronaca/napoli/155779-fase-2-controlli-serrati-a-napoli-anche-col-supporto-di-un-elicottero-due-denunce-per-droga-e-una-per-possesso-di-arma-da-taglio.html;www.campanianotizie.com;['campania']
737;Paura ad Aversa, forte esplosione all'ora di pranzo: carabinieri e vigili del fuoco sul posto per...;Un forte boato ha scosso i residenti di via Giotto ad Aversa all’ora di pranzo. La tranquillità della seconda domenica di maggio, dedicata alla festa della mamma, è stata spezzata da un’esplosione che si è verificata all’interno di un palazzo. Al momento non è ancora chiaro a cosa sia dovuta la deflagrazione ma il potente scoppio ha attirato l’attenzione di tante persone che, poco dopo le ore 14, erano a tavola per il pranzo. Allertati, sul luogo posto sono giunti i vigili del fuoco ed i carabinieri che stanno effettuando le verifiche del caso. Non sono stati registrati feriti.;2020-05-10; Campanianotizie;['Campania', 'Aversa', 'Carabinieri', 'Vigili Del Fuoco'];http://www.campanianotizie.com/cronaca/caserta/155796-paura-ad-aversa-forte-esplosione-allora-di-pranzo-carabinieri-e-vigili-del-fuoco-sul-posto-per-verificare-laccaduto.html;www.campanianotizie.com;['campania']
744;Camion dei rifiuti ostruisce il passaggio, va su tutte le furie e picchia i netturbini con un...;Un 20enne di Scampia, già noto alle forze dell’ordine, è stato denunciato dai Carabinieri della stazione del quartiere 167 per interruzione di un servizio pubblico o di pubblica necessità, per lesioni e danneggiamento. Un dipendente della società Asia, azienda per l'igiene urbana, è stato aggredito mentre era impegnato nel servizio di raccolta rifiuti. Il motivo - secondo la ricostruzione dei Carabinieri - è dovuto all'interruzione momentanea del traffico: l'aggressore, a bordo della sua auto, non intendeva attendere il termine delle operazioni. Il 20enne, brandendo un bastone che aveva in auto, ha colpito prima alle gambe il dipendente addetto alla raccolta rifiuti per poi distruggere, prima di allontanarsi, il finestrino dell'autocompattatore. La vittima, trasportata al San Giovanni Bosco, se la caverà con 7 giorni di prognosi. I carabinieri, avviate le indagini, hanno individuato l'uomo. Sequestrato anche il bastone.;2020-05-10; Campanianotizie;['Scampia', 'Carabinieri'];http://www.campanianotizie.com/cronaca/napoli/155795-camion-dei-rifiuti-ostruisce-il-passaggio-va-su-tutte-le-furie-e-picchia-i-netturbini-con-un-bastone-denunciato-20enne-del-napoletano.html;www.campanianotizie.com;['campania']
774;Enorme incendio nel Napoletano, vastissima coltre di fumo sovrasta sulla città di San Giovanni a...;Un’imponente colonna di fumo nero si è levata alta vicino alle pendici del Vesuvio. Uno spaventoso incendio si è sviluppato pochi minuti fa nella zona Gianturco a Napoli. La coltre nera e densa sovrasta gran parte della città. Dalle prime informazioni pare che si tratti di un'area compresa tra i depositi di articoli cinesi e la Linea 2 della Metro.  Varie autobotti dei vigili del fuoco sono già sul posto.;2020-05-10; Campanianotizie;['Incendi', 'Vigili Del Fuoco', 'Vesuvio'];http://www.campanianotizie.com/cronaca/napoli/155799-enorme-incendio-napoletano-coltre-fumo-sovrasta-san-giovanni-a-teduccio.html;www.campanianotizie.com;['campania']
788;Enorme incendio in zona Gianturco, in fiamme un'area tra i depositi di articoli cinesi: vastissima...;Un’imponente colonna di fumo nero si è levata alta vicino alle pendici del Vesuvio. Uno spaventoso incendio si è sviluppato pochi minuti fa nella zona Gianturco a Napoli. La coltre nera e densa sovrasta gran parte della città. Dalle prime informazioni pare che si tratti di un'area compresa tra i depositi di articoli cinesi e la Linea 2 della Metro.  Varie autobotti dei vigili del fuoco sono già sul posto.;2020-05-10; Campanianotizie;['Incendi', 'Campania', 'Napoli', 'Vesuvio'];http://www.campanianotizie.com/cronaca/napoli/155799-enorme-incendio-gianturco-coltre-fumo-sovrasta-citta-napoli.html;www.campanianotizie.com;['campania']
1046;Corruzione nel Napoletano, pagavano il cancelliere per ottenere e distruggere i fascicoli dei...;Nell’ambito di un’indagine coordinata dalla Procura di Nola, un cancelliere del giudice di pace di Marigliano, 10 avvocati e un 'factotum', ex dipendente dello stesso Comune, sono stati arrestati. L’attività portata avanti dai carabinieri ha consentito di fare luce su una costante e consolidata gestione illecita degli affari penali nell'Ufficio del Giudice di Pace di Marigliano. Per gli inquirenti, in cambio di 'regalie' (anche un costoso oggetto d'oro) il cancelliere, che si occupava delle iscrizioni a ruolo, piegava le sue funzioni alle esigenze di suoi amici avvocati i quali, con la sua complicità, riuscivano ad ottenere fascicoli di cui erano patrocinatori al giudice di pace loro più gradito. Accertata anche la distruzione e la falsificazione dei fascicoli, inserendo come parti processuali persone decedute o inesistenti, e danno alle casse dello Stato, da circa 40mila euro, con l'uso di marche da bollo contraffatte per l'iscrizione a ruolo di cause presso gli uffici del giudice di pace di Nola.;2020-05-11; Campanianotizie;['Corruzione', 'Avvocati', 'Arresti', 'Inchieste-investigazioni-indagini', 'Giustizia', 'Nola', 'Marigliano', 'Carabinieri'];http://www.campanianotizie.com/cronaca/napoli/155803-corruzione-nel-napoletano-pagavano-il-cancelliere-per-ottenere-e-distruggere-i-fascicoli-dei-processi-10-avvocati-arrestati.html;www.campanianotizie.com;['campania']
1047;Blitz della polizia a Napoli: ordinanza di custodia cautelare per 20 persone accusate di rapine,...;Nelle prime ore di questa mattina a Napoli è partita una vasta operazione della polizia, in esecuzione di un'ordinanza di custodia cautelare emessa nei confronti di una ventina di persone, dal gip presso il tribunale di Napoli, su richiesta dalla Procura del capoluogo campano. Sono gravemente indiziate, a vario titolo, di associazione a delinquere finalizzata alla commissione di una serie indeterminata di delitti contro il patrimonio, in particolare, rapine a mano armata, ricettazione e riciclaggio di orologi di valore.;2020-05-11; Campanianotizie;['Polizia', 'Campania', 'Napoli', 'Custodia Cautelare', 'Giustizia', 'Tribunali'];http://www.campanianotizie.com/cronaca/napoli/155804-blitz-della-polizia-a-napoli-ordinanza-di-custodia-cautelare-per-20-persone-accusate-di-rapine-riciclaggio-e-ricettazione.html;www.campanianotizie.com;['campania']
1048;Riciclaggio, capitali della camorra napoletana reinvestiti in Toscana: ordinanza per due persone...;"La Dda di Firenze ha coordinato un’operazione finalizzata a contrastare il reimpiego in Toscana di capitali di provenienza illecita. I Carabinieri del nucleo Investigativo del Comando provinciale di Firenze hanno eseguito questa mattina un'ordinanza di custodia cautelare emessa dal gip del capoluogo toscano nei confronti di due indagati residenti a Napoli. Le indagini, che rappresentano la prosecuzione dell'operazione 'Vello d''oro' del 2018, avrebbero messo in luce, così gli investigatori, ""complessi meccanismi di riciclaggio e documentato rapporti affaristici tra soggetti contigui al clan camorristico Lo Russo e imprenditori toscani del settore conciario"".";2020-05-11; Campanianotizie;['Mafia', 'Camorra', 'Clan Camorristici', 'Toscana', 'Firenze', 'Carabinieri', 'Inchieste-investigazioni-indagini'];http://www.campanianotizie.com/cronaca/napoli/155805-riciclaggio-capitali-della-camorra-napoletana-reinvestiti-in-toscana-ordinanza-per-due-persone-vicine-al-clan-lo-russo.html;www.campanianotizie.com;['toscana', 'campania']
1049;Sparatoria in pieno giorno ad Aversa, tentata rapina al portavalori fuori alla filiale della Bnl:...;Banditi in azione ad Aversa: assalto armato alla filiale Bnl di Viale Kennedy. Da quanto si è appreso uomini armati, intorno alle 11, hanno cercato di svaligiare l'istituto di credito. I criminali appena entrati hanno esploso almeno 10 proiettili e alcuni di questi hanno raggiunto un vigilantes e un poliziotto fuori servizio. I feriti sono stati immediatamente trasportati al Pronto Soccorso del vicino ospedale Moscati di Aversa. Allertate, sul posto sono giunte le pattuglie delle forze dell’ordine: volanti dal commissariato di Aversa, guidate dal primo dirigente Vincenzo Gallozzi, pattuglie dei carabinieri e della polizia municipale. Le indagini sono partite subito, con i rilievi della scientifica e l’ascolto di testimonianze raccolte in zona. Per cercare di braccare i malviventi sono stati disposti posti di blocco in tutta la città normanna.;2020-05-11; Campanianotizie;['Sparatoria', 'Campania', 'Aversa', 'Portavalori', 'Banca Nazionale Del Lavoro'];http://www.campanianotizie.com/cronaca/caserta/155806-sparatoria-aversa-tentata-rapina-portavalori-bnl-vigilantes-feriti-in-ospedale.html;www.campanianotizie.com;['campania']
1095;Evasione fiscale a Santa Maria Capua Vetere, società di articoli elettronici falsifica le...;In data odierna, la Compagnia della Guardia di Finanza di Capua, su delega della Procura della Repubblica, sta eseguendo un decreto di sequestro preventivo di beni fino ad un valore soglia di 1,2 milioni di euro avente ad oggetto le disponibilità finanziarie della PROMOTEK S.r.l., società operante nel settore del commercio di articoli elettronici, con sede operativa in Santa Maria Capua Vetere, nonché il patrimonio personale dei rappresentanti legali pro-tempore. Il sequestro preventivo è stato emesso dal G.I.P. del Tribunale di Santa Maria Capua Vetere, su richiesta della Procura, che ha proposto la misura cautelare reale all’esito della verifica fiscale svolta dallo stesso Reparto della Guardia di Finanza, conclusa con la denuncia dei titolari della società per reati tributari. Questi ultimi, infatti, si sono resi responsabili di aver indicato nelle dichiarazioni dei redditi relative agli anni 2016 e 2017 elementi attivi inferiori a quelli effettivi per circa un milione e mezzo di euro nonché costi fittizi derivanti da fatture per operazioni inesistenti emesse da società compiacenti per oltre centomila euro, al fine di ridurre l’ammontare del reddito da tassare. Dagli accertamenti svolti è, infatti, emerso che la PROMOTEK S.r.l. contabilizzava anche costi relativi ad acquisti di merce da una società - risultata essere evasore totale - assolutamente non inerenti rispetto al suo oggetto sociale (ad esempio pezzi di ricambio per bici) che poi rivendeva nella stessa giornata con una percentuale di ricarico minima, pari a circa l’l%, ma in completa evasione di imposta. Tale meccanismo fraudolento ha consentito quindi alla società sammaritana di abbattere illecitamente il carico fiscale e di poter praticare sul mercato prezzi di vendita decisamente più competitivi così da contrastare i concorrenti onesti. Considerato l’elevato valore indiziario degli elementi raccolti nel corso dell’attività d’indagine, veniva delegata alla Guardia di Finanza l’effettuazione di mirati accertamenti patrimoniali finalizzati all’individuazione delle disponibilità finanziarie della società nonché dei beni mobili ed immobili intestati e\o riconducibili ai suoi amministratori al fine di sequestrare il profitto della frode e inibire il consolidamento del vantaggio economico derivante dall’evasione. Il G.I.P., accordando la predetta richiesta, ha quindi emesso il decreto di sequestro preventivo fino a concorrenza delle imposte sottratte alle casse dello Stato. Anche questo provvedimento conferma l’attenzione della Procura della Repubblica di Santa Maria Capua Vetere nel contrastare, in stretta sinergia con il Comando Provinciale della Guardia di Finanza di Caserta, ogni forma di evasione fiscale e di illecita concorrenza basata su pratiche fraudolente.;2020-05-11; Campanianotizie;['Evasione Fiscale', 'Fisco', 'Tasse', 'Delega Fiscale', 'Santa Maria Capua Vetere', 'Guardia di Finanza', 'Giustizia', 'Decreti'];http://www.campanianotizie.com/cronaca/caserta/155807-evasione-fiscale-santa-maria-capua-vetere-sociata-articoli-elettronici-falsifica-dichiarazione-dei-redditi-maxi-sequestro-beni.html;www.campanianotizie.com;['campania']
1096;Agguato dell'Epifania a Napoli Est, colpi d'arma da fuoco fino al quarto piano: arrestati i due...;Attesero la vittima davanti casa per poi seguirla, sparando all'impazzata, fino al quarto piano del palazzo dove abita l'obiettivo dell'agguato: i carabinieri della compagnia Poggioreale di Napoli hanno arrestato due persone, ritenute affiliate al clan Formicola, con l'accusa di tentato omicidio premeditato, aggravato dal metodo mafioso. Si tratta di Salvatore Rispoli e di Giuseppe Guadagnuolo, entrambi di 33 anni, identificati dai militari grazie alle immagini del sistemi di videosorveglianza. Il raid è scattato la sera dello scorso 6 gennaio, ai danni di Giuseppe Capolupo e nonostante i numerosi colpi d'arma da fuoco esplosi dai due killer, nessuno degli inquilini del palazzo e dei cittadini che abitano in zona ha presentato una denuncia alle forze dell'ordine.;2020-05-11; Campanianotizie;['Campania', 'Napoli', 'Arresti', 'Video', 'Carabinieri', 'Poggioreale'];http://www.campanianotizie.com/cronaca/napoli/155808-agguato-dellepifania-a-napoli-est-colpi-darma-da-fuoco-fino-al-quarto-piano-arrestati-i-due-killer-incastrati-dalle-telecamere-di-video-sorveglianza.html;www.campanianotizie.com;['campania']
