;title;content;date;author;tags;url;website-domain;region
22461;Nigeriano in giro a spacciare a Sampierdarena: arrestato dalla polizia;Ieri sera i poliziotti dell’U.P.G. e del Commissariato Cornigliano hanno arrestato un 21enne nigeriano, irregolare sul territorio nazionale e pluripregiudicato, per detenzione di sostanza stupefacente ai fini dello spaccio e resistenza a publbico ufficiale.L’uomo è stato notato dai poliziotti mentre camminava in una via Avio pressoché deserta.Alla vista della volante ha però avuto una reazione inaspettata cominciando a correre nel tentativo di sottrarsi al controllo. Immediato è scattato l’inseguimento a piedi che si è concluso in via Pacinotti quando gli agenti, nonostante la resistenza opposta, lo hanno immobilizzato.Durante il controllo il giovane è stato trovato in possesso di due involucri di marijuana del peso di circa 20 grammi, della somma di 60 euro in banconote di piccolo taglio, nonché di un mazzo di chiavi di cui il 21enne non ha voluto fornire spiegazioni circa la provenienza.Supponendo potesse dimorare in zona, gli operatori hanno provato ad aprire alcuni portoni della via con le stesse chiavi riuscendo ad avere accesso ad un appartamento in cui sono stati trovati alcuni effetti personali del fermato, insieme ad altri 110grammi di derivati della cannabis suddivisi in piccoli involucri e alla somma di 650 euro.Il giovane, dopo l’arresto, è stato associato presso il carcere di Marassi.;2020-03-28; Liguria Notizie;['Arresti', 'Polizia', 'Gianfranco Fini', 'Liguria'];https://www.ligurianotizie.it/nigeriano-in-giro-a-spacciare-a-sampierdarena-arrestato-dalla-polizia/2020/03/28/374467/;www.ligurianotizie.it;['liguria']
22479;Via Calamandrei, 55enne genovese accoltella 19enne marocchino: arrestato;Ieri sera in via Calamandrei tra Voltri e Prà, un genovese ha colpito con un coltello un 19 enne marocchino e poi è fuggito nascondendosi nella sua abitazione.Si tratta di un 55enne, gravato da pregiudizi di polizia.Il genovese è stato rintracciato poco dopo dai Carabinieri del Nucleo Radiomobile.Alla vista dei Carabinieri, il 55enne, sempre in possesso del coltello, li ha minacciati al fine di sottrarsi al controllo e all’identificazione.Tuttavia, i militari sono riusciti a disarmarlo e a bloccarlo mediante l’utilizzo dello spray urticante.Il genovese è stato arrestato per “resistenza e minaccia aggravata a pubblico ufficiale” e rinchiuso nel carcere di Marassi. ;2020-03-28; Liguria Notizie;['Arresti', 'Polizia'];https://www.ligurianotizie.it/via-calamandrei-55enne-genovese-accoltella-19enne-marocchino-arrestato/2020/03/28/374476/;www.ligurianotizie.it;['liguria']
22480;Prè, spaccio di droga non si ferma: 21enne nigeriano preso con cocaina;Nel tardo pomeriggio di ieri in via Prè i Carabinieri della Compagnia di Ge-Centro, durante un normale servizio per il controllo del territorio, nonché per l’uso e lo spaccio di sostanze stupefacenti, hanno sorpreso un africano mentre cedeva una dose di cocaina a un cliente.Lo straniero, allo scopo di sottrarsi al controllo, ha opposto attiva resistenza contro i militari, che dopo averlo bloccato, lo hanno identificato in un nigeriano di 21 anni, senza fissa dimora, con pregiudizi di polizia e mai rimpatriato.Il 21enne è stato denunciato in stato di libertà per “detenzione ai fini di spaccio di sostanze stupefacenti e resistenza a pubblico ufficiale”. ;2020-03-28; Liguria Notizie;['Droga', 'Carabinieri'];https://www.ligurianotizie.it/pre-spaccio-di-droga-non-si-ferma-21enne-nigeriano-preso-con-cocaina/2020/03/28/374485/;www.ligurianotizie.it;['liguria']
22608;Reparto Mobile Polizia dispiegato a Genova: stanotte sanificazione strade;Come già avvenuto a Milano, partirà questa notte a Genova la sanificazione delle strade in centro città con i mezzi del VI Reparto Mobile della Polizia a Genova.L’iniziativa è stata lanciata dal sindacato di Polizia Sap e accolta dal questore Vincenzo Ciarambino e dal sindaco Marco Bucci.L’igienizzazione verrà fatta usando un idrante del reparto scortato da un discovery della Polizia.L’operazione partirà da viale Brigate Liguria per risalire da via XX Settembre fino a piazza della Nunziata.Anche gli operatori di Amiu da questa mattina hanno cominciato iniziato la sanificazione con un camion. L’azienda partecipata dal Comune si occuperà del Ponente cittadino in due distinti percorsi, mentre la Polizia del centro e del Levante cittadino.Le operazioni avverranno dal lunedì al sabato. ;2020-03-28; Liguria Notizie;['Polizia', 'Liguria', 'Genova', 'Lombardia', 'Milano', 'Sindacati'];https://www.ligurianotizie.it/reparto-mobile-polizia-dispiegato-a-genova-stanotte-sanificazione-strade/2020/03/28/374569/;www.ligurianotizie.it;['liguria', 'lombardia']
22619;YouPol: lApp della Polizia anche per denunciare le violenze domestiche;Nel periodo di emergenza Covid-19, la maggior parte dei cittadini resta a casa in ottemperanza alle indicazioni governative.Per garantire la massima accessibilità al pronto intervento della Polizia di Stato, l’applicazione Youpol si aggiorna prevedendo la possibilità di segnalare i reati di violenza domestica con le stesse modalità e caratteristiche delle altre tipologie di segnalazione.Ideata per contrastare bullismo e spaccio di sostanze stupefacenti nelle scuole, l’app è caratterizzata dalla possibilità di trasmettere in tempo reale messaggi ed immagini agli operatori della Polizia di Stato.Le segnalazioni sono automaticamente geo-referenziate, ma è possibile per l’utente modificare il luogo dove sono avvenuti i fatti. E’ inoltre possibile dall’app chiamare direttamente il 113. Tutte le segnalazioni vengono ricevute dalla Sala Operativa della Questura competente per territorio.Per chi non vuole registrarsi fornendo i propri dati, è prevista la possibilità di segnalare in forma anonima.Anche chi è stato testimone diretto o indiretto – per esempio i vicini di casa – può ovviamente denunciare il fatto all’autorità di polizia, inviando un messaggio anche con foto e video.L’applicativo, nato dalla ferma convinzione che ogni cittadino è parte responsabile ed attiva nella vita democratica del Paese, è facilmente installabile su tutti gli smartphone e tablet accedendo alle piattaforme per i sistemi operativi IOS e Android.;2020-03-28; Liguria Notizie;['Applicazioni', 'Polizia', 'Liguria'];https://www.ligurianotizie.it/youpol-lapp-della-polizia-anche-per-denunciare-le-violenze-domestiche/2020/03/28/374559/;www.ligurianotizie.it;['liguria']
22649;Arrestato per aggressione durante il controllo anti contagio;Poco dopo le 10 di oggi agenti del I distretto Territoriale, nell’ambito dei controlli per il rispetto delle misure di salute pubblica nell’ambito delle norme del decreto Conte sull’emergenza coronavirus, hanno fermato un cittadino italiano in piazza del Cappuccini, sopra Corvetto.L’uomo, alla richiesta di esibire i documenti e interpellato circa la motivazione della sua presenza in zona, ha prima rifiutato di fornire le generalità, poi ha inveito contro gli agenti e quindi li ha colpiti.Successivamente, anziché calmarsi, ha tentato di colpirli di nuovo, non riuscendo però a far andare a segno i suoi colpi.Il violento, dopo l’aggressione, è stato immobilizzato e arrestato. ;2020-03-28; Liguria Notizie;['Arresti', 'Decreti', 'Polizia', 'Liguria'];https://www.ligurianotizie.it/arrestato-per-aggressione-durante-il-controllo-anti-contagio/2020/03/28/374596/;www.ligurianotizie.it;['liguria']
22737;Reparto Mobile dispiegato a Genova: idranti della Polizia contro nemico invisibile;Anche a Genova la Polizia di Stato ha messo in campo tutte le risorse a disposizione per contrastare la diffusione del Covid-19.Non solo uomini per i controlli in città ma anche mezzi per la sanificazione “in particolare quelli che normalmente vengono impiegati nei servizi di ordine pubblico o nelle operazioni di soccorso e che, in questa situazione d’emergenza senza precedenti, verranno utilizzati per pulire e disinfettare le strade genovesi”.Dalla scorsa notte, come avevamo annunciato ieri, in accordo con A.M.I.U., il veicolo con idrante in dotazione al VI Reparto Mobile Iveco 190.30, ha percorso le vie del centro, nella zona compresa tra via Brigata Liguria e la stazione ferroviaria di Principe, spruzzando acqua e soluzione disinfettante.E’ previsto che le operazioni proseguano anche in altre zone della città.Con i suoi 8.000 litri di capienza e una pompa motore in grado di svuotare l’intero serbatoio in 6 minuti, con getti d’acqua che possono arrivare fino a 10 atmosfere, il veicolo idrante della Polizia è rimasto in attività fino alle prime luci dell’alba di oggi, contribuendo così ai servizi di sanificazione già avviati dall’azienda partecipata dal Comune. ;2020-03-29; Liguria Notizie;['Liguria', 'Genova', 'Polizia'];https://www.ligurianotizie.it/reparto-mobile-dispiegato-a-genova-idranti-della-polizia-contro-nemico-invisibile/2020/03/29/374626/;www.ligurianotizie.it;['liguria']
22810;Terremoto di magnitudo 3.4 in provincia di Torino;Un terremoto di magnitudo ML 3.4 è avvenuto a 6 km S Coazze, in provincia di Torino questa mattina alle 09:11:34 con epicentro con coordinate geografiche 45 di latitudine e 7.28 di longitudine ad una profondità di 20 km.A rilevarlo è stato l’INGV, Istituto Nazionale di Geofisica e Vulcanologia.C’è stata un po’ di paura tra la popolazione, ma non si segnalano, né feriti, né morti.L’evento sismico INGV: http://terremoti.ingv.it/event/24176941;2020-03-29; Liguria Notizie;['Terremoti', 'Terremoto A Torino', 'Torino', 'Piemonte', 'Istituto Nazionale Di Geofisica E Vulcanologia', 'Liguria'];https://www.ligurianotizie.it/terremoto-di-magnitudo-3-4-in-provincia-di-torino/2020/03/29/374664/;www.ligurianotizie.it;['liguria', 'piemonte']
22811;Diccap-Sulpl a Viale: fare tamponi a tutti operatori Polizia Locale della Liguria;Emergenza coronavirus e tamponi Covid-19. Oggi il responsabile della segreteria del sindacato Diccap-Sulpl della Polizia Locale Claudio Musicò ha comunicato di avere inviato una “lettera aperta” al vicepresidente e assessora regionale alla Sanità Sonia Viale.Ecco il testo integrale.“Oggetto: richiesta controllo tamponi per gli Operatori della Polizia Locale della Regione Liguria.Egr. Assessora,Come da Lei dichiarato, il controllo della popolazione attraverso i tamponi è necessario per garantire la sicurezza di tutti.Giustamente i controlli sono iniziati con delle priorità, Medici e Infermieri che quotidianamente sono in prima linea a lottare contro questa pandemia, e proseguiranno a tappeto su tutta la popolazione.Per questo motivo crediamo doveroso attenzionarLa sul ruolo della Polizia Locale che ci pregiamo di rappresentare e sulla necessità per gli Operatori di sentire vicine le istituzioni.Sappiamo perfettamente che Lei e tutta la l’Amministrazione Regionale conosce e apprezza il lavoro svolto quotidianamente dalla Polizia Locale ed è per questo che, in questo momento, è importante un Suo riscontro che confermi questa vicinanza.Il controllo attraverso i tamponi non rende immuni gli Operatori ma aumenterebbe quella sensazione di sicurezza che è fondamentale per poter lavorare con maggiore serenità.La ringraziamo anticipatamente per il riscontro che vorrà dare agli Operatori della Polizia Locale”. ;2020-03-29; Liguria Notizie;['Polizia', 'Liguria', 'Sindacati'];https://www.ligurianotizie.it/diccap-sulpl-a-viale-fare-tamponi-a-tutti-operatori-polizia-locale-della-liguria/2020/03/29/374669/;www.ligurianotizie.it;['liguria']
22888;Emergenza Covid-19, ma loro oggi omaggiano terrorista BR e assassino di Guido Rossa;“Fiori freschi e memoria viva!” e un cuoricino rosso, seguito da diversi commenti con i pugni in alto e frasi così: “Onore ai compagni caduti”.In piena emergenza coronavirus, l’ex dirigente della colonna romana delle Brigate Rosse Barbara Balzerani oggi su facebook (che censura qua e là, ma che al momento non ha censurato questo post e i commenti) si è preoccupata di rendere omaggio alla bestia assassina Riccardo Dura, ucciso la notte del 28 marzo 1980 durante il conflitto a fuoco con i carabinieri in via Fracchia a Genova.Considerato un terrorista estremamente motivato, determinato e aggressivo, il brigatista rosso partecipò direttamente ad alcuni sanguinosi attentati durante i cosiddetti Anni di piombo.Tra le sue vittime vi furono il magistrato genovese Francesco Coco, il commissario Antonio Esposito e il sindacalista genovese della Cgil Guido Rossa.Il terrorista delle BR partecipò anche all’omicidio del tenente colonnello dei Carabinieri Emanuele Tuttobene e dell’appuntato Antonino Casu, che avvenne il 25 gennaio 1980 in via Riboli a Genova Albaro.;2020-03-29; Liguria Notizie;['Terrorismo', 'Omicidi', 'Brigate Rosse', 'Liguria'];https://www.ligurianotizie.it/emergenza-covid-19-ma-loro-oggi-omaggiano-terrorista-br-e-assassino-di-guido-rossa/2020/03/29/374687/;www.ligurianotizie.it;['liguria']
22952;Ciclista entra in mare con la bici per cercare di evitare il controllo | Video;Com’è noto, per contenere la diffusione dei contagi da Covid-19 sono state introdotte, con un decreto del presidente del Consiglio dei ministri, sanzioni salate che vanno dai 400 ai 3000 euro oltre al rischio di una denuncia penale.Il tutto per scoraggiare gli irresponsabili ad andare a zonzo senza una delle motivazioni contemplate nel decreto.Eppure c’è chi, senza un valido motivo, trasgredisce le regole e nell’inutile tentativo di sottrarsi al controllo, pur di evitare la multa salata, ha preferito, forse spaventato, entrare in mare con la propria bicicletta.È quanto è successo stamane sul litorale di Otranto, in Puglia, dove le Forze dell’ordine hanno sorpreso il ciclista intento a non rispettare le prescrizioni del decreto Conte sull’emergenza coronavirus.Il ciclista è stato più volte invitato dagli agenti ad uscire dal mare per essere identificato, ma lui ha preferito restare in acqua, con tutta la bicicletta, per diversi minuti, dicendo al poliziotto “non ho fatto nulla” e lui che ha continuato a dirgli “Esci fuori… l’identificazione dobbiamo fare”.Inevitabile la denuncia e la salata sanzione. (Video Giovanni d’Agata) ;2020-03-29; Liguria Notizie;['Video', 'Decreti', 'Liguria'];https://www.ligurianotizie.it/ciclista-entra-in-mare-con-la-bici-per-cercare-di-evitare-il-controllo-video/2020/03/29/374767/;www.ligurianotizie.it;['liguria']
23095;Allospedale di Sanremo è morto Claudio Ghiglione, consigliere comunale di Imperia;Imperia – Dallo scorso 17 marzo era ricoverato all’ospedale Borea di Sanremo. La notte scorsa è morto Claudio Ghiglione, 60 anni, consigliere comunale di «Imperia Insieme».L’esponente di maggioranza è stato sconfitto dal coronavirus.«Una notizia che mi addolora e con me tutta l’Amministrazione. Abbiamo pregato per lui nella speranza che la situazione si potesse risolvere. E’ una perdita gravissima».;2020-03-30; Liguria Notizie;['Liguria', 'San Remo', 'Imperia'];https://www.ligurianotizie.it/allospedale-di-sanremo-e-morto-claudio-ghiglione-consigliere-comunale-di-imperia/2020/03/30/374827/;www.ligurianotizie.it;['liguria']
23513;Cornigliano, prende il bus per andare al lavoro: nigeriano arrestato con un chilo di droga;Ieri i carabinieri della locale Stazione dell’Arma, durante un servizio per il controllo del territorio e per il rispetto degli spostamenti in merito alle disposizioni del decreto Conte sull’emergenza coronavirus, in via Cornigliano hanno fermato un africano a una fermata del bus.Lo straniero, durante la fase del controllo e dell’identificazione, improvvisamente è fuggito a piedi.Tuttavia, i carabinieri sono riusciti ad acchiapparlo dopo un breve inseguimento.Il giovane è stato quindi identificato come un nigeriano di 25 anni, gravato da pregiudizi di polizia e mai rimpatriato, domiciliato a Genova.Nella successiva perquisizione personale, è stato trovato in possesso di 1.2 chili di “marijuana”, suddivisa in sei pacchetti in plastica.Pertanto, il 25 enne è stato arrestato per “detenzione ai fini di spaccio di sostanze stupefacenti”.La droga è stata sequestrata e il nigeriano è stato rinchiuso nel carcere di Marassi. ;2020-03-31; Liguria Notizie;['Lavoro', 'Arresti', 'Droga', 'Carabinieri', 'Decreti', 'Liguria'];https://www.ligurianotizie.it/cornigliano-prende-il-bus-per-andare-al-lavoro-nigeriano-arrestato-con-un-chilo-di-droga/2020/03/31/375010/;www.ligurianotizie.it;['liguria']
23514;Tunisino agli arresti domiciliari se ne frega e va in giro: preso dai carabinieri;Ieri un i carabinieri di un equipaggio del Nucleo Radiomobile, impegnati nella sorveglianza delle persone sottoposte a misure restrittive alternative sul territorio di Genova, hanno controllato l’abitazione di un tunisino di 53 anni, gravato da pregiudizi di polizia, attualmente agli arresti domiciliari.Durante l’ispezione, lo straniero non è stato trovato in casa.Il nordafricano è stato rintracciato successivamente dai militari, che lo hanno preso e rimesso a casa, denunciandolo  per “evasione”.Inoltre gli è stata contesta la violazione amministrativa per l’inosservanza delle misure urgenti per il contenimento dell’epidemia in riferimento al decreto Conte sull’emergenza coronavirus. ;2020-03-31; Liguria Notizie;['Arresti', 'Arresti Domiciliari', 'Carabinieri', 'Nucleo Radiomobile', 'Liguria', 'Genova'];https://www.ligurianotizie.it/tunisino-agli-arresti-domiciliari-se-ne-frega-e-va-in-giro-preso-dai-carabinieri/2020/03/31/375015/;www.ligurianotizie.it;['liguria']
23540;San Teodoro, donna tenta suicidio dal balcone: salvata da ex marito e carabinieri;Ieri un 60enne ha lanciato un allarme telefonando alla Stazione Carabinieri di Ge-San Teodoro e Scali, poiché l’ex moglie non rispondeva più al telefono.Una pattuglia si è quindi portata immediatamente presso l’abitazione della donna in via Digione.Una volta arrivati, hanno visto l’ex moglie sul balcone di casa, sito al secondo piano, in forte stato di agitazione, che stava scavalcando la ringhiera minacciando di lanciarsi nel vuoto.I carabinieri, con la collaborazione di un militare della Guardia di Finanza libero dal servizio, non ci hanno pensato e sono riusciti a raggiungere il balcone sottostante l’appartamento della donna.Improvvisamente, la donna si è lasciata cadere nel vuoto, ma i militari, sfruttando la posizione guadagnata, sono riusciti in qualche modo a tenerla per le gambe, frenandone la caduta e traendola in salvo.Successivamente, la donna è stata trasportata e ricoverata presso l’ospedale Villa Scassi di Sampierdarena. ;2020-03-31; Liguria Notizie;['San Teodoro', 'Carabinieri'];https://www.ligurianotizie.it/san-teodoro-donna-tenta-suicidio-dal-balcone-salvata-da-ex-marito-e-carabinieri/2020/03/31/375018/;www.ligurianotizie.it;['liguria']
23541;Centro storico, fa la spesa e lascia bicicletta fuori dal negozio: rubata da marocchino;Ieri in via Garibaldi a Genova una 35 enne, dopo essere entrata in un esercizio commerciale, si è accorta che, uno straniero le stava le rubando la bicicletta.La donna ha quindi lanciato l’allarme ai carabinieri di una pattuglia della Stazione Carabinieri di Ge-Maddalena, in servizio nel Centro storico.Poco dopo, i militari, insieme alla donna, sono riusciti a individuare e fermare il ladro.Il malfattore è stato quindi identificato in un marocchino di 24 anni, irregolare sul territorio nazionale, con pregiudizi di polizia e mai rimpatriato.Il nordafricano è stato denunciato in stato di libertà per “furto”.La bicicletta è stata restituita alla legittima proprietaria, che ha ringraziato i carabinieri. ;2020-03-31; Liguria Notizie;['Liguria', 'Genova', 'Carabinieri'];https://www.ligurianotizie.it/centro-storico-fa-la-spesa-e-lascia-bicicletta-fuori-dal-negozio-rubata-da-marocchino/2020/03/31/375024/;www.ligurianotizie.it;['liguria']
23542;Corea, nuovi contagi salgono a 125: un anno di carcere per chi vìola quarantena;Ieri la Corea del Sud ha registrato un rialzo di nuovi casi da Covid-19 a 125, dai 78 di domenica, a causa dei problemi nel tenere sotto controllo focolai interni e contagi importati dall’estero.Secondo il Korea Centers for Disease Control and Prevention, le infezioni totali sono 9.786 e i decessi 162 (4 in più rispetto a domenica).Inoltre, risultano 15 i casi importati, 518 in totale.I guariti sono 5.408, mentre i pazienti in cura 4.275.La Corea del Sud ha varato una quarantena obbligatoria di 14 giorni per tutti gli arrivi, anche per i 530 sudcoreani attesi dall’Italia.Lo ha riferito oggi l’agenza Ansa, ma TgCom24 ha riportato che la Corea del Sud ha anche imposto il carcere per coloro che non rispettano la quarantena e le regole dell’isolamento.Chiunque violi le norme rischia un anno di prigione o una multa di 8.200 dollari in base alla nuova legge promulgata per l’emergenza coronavirus. Il provvedimento restrittivo e coercitivo entrerà in vigore il 5 aprile. ;2020-03-31; Liguria Notizie;['Carceri'];https://www.ligurianotizie.it/corea-nuovi-contagi-salgono-a-125-un-anno-di-carcere-per-chi-viola-quarantena/2020/03/31/375038/;www.ligurianotizie.it;['liguria']
23650;Incidente tra tir sulla A12 a Sarzana: due feriti;La squadra dei Vigili del Fuoco del distaccamento di Sarzana è intervenuta ieripomeriggio sull’autostrada A12 per un incidente stradale che ha coinvolto due mezzi pesanti.Due tir si sono scontrati all’altezza del casello di Sarzana in corsia sud. L’urto è stato molto violento e i mezzi sono andati quasi completamente distrutti.Entrambi i conducenti sono stati trasportati al pronto soccorso.I Vigili del Fuoco hanno dovuto, dapprima estingure un principio d’incendio al motore di uno dei due mezzi, e successivamente metterli in sicurezza per consentire alle gru di rimuoverli dalla strada.Sul posto anche personale della polizia Stradale per i rilevamenti del caso.;2020-03-31; Liguria Notizie;['Incidenti Stradali', 'Vigili Del Fuoco', 'Liguria'];https://www.ligurianotizie.it/incidente-tra-tir-sulla-a12-a-sarzana-due-feriti/2020/03/31/375111/;www.ligurianotizie.it;['liguria']
23651;Assembramenti a Genova, fanno un picnic a due passi dalla Questura: sanzionati 9 romeni;Ieri pomeriggio i poliziotti dell’U.P.G. hanno sanzionato amministrativamente 9 cittadini rumeni, di età compresa tra i 18 e i 36 anni,  poiché sorpresi in strada senza nessuno dei motivi indicati dal decreto Conte sull’emergenza coronavirus.I giovani sono stati visti mentre facevano un picnic seduti sul prato, fumando e bevendo come se nulla fosse e senza rispettare le previste distanze di sicurezza.Per i romeni che se ne sono infischiati delle regole, è quindi scattata la salata sanzione. ;2020-03-31; Liguria Notizie;['Liguria', 'Genova', 'Decreti'];https://www.ligurianotizie.it/assembramenti-a-genova-fanno-un-picnic-a-due-passi-dalla-questura-sanzionati-9-romeni/2020/03/31/375110/;www.ligurianotizie.it;['liguria']
23656;Senza fissa dimora ruba elemosine in Chiesa a Zoagli: denunciato. Originario di Biella;Aveva trovato rifugio all’interno della Chiesa di San Martino di Zoagli, con il solo scopo di forzare le cassette delle offerte.Il ladro, mentre tentava di scassinarle, è stato però scoperto dal parroco della canonica ed è quindi fuggito.Poco dopo, i carabinieri della locale Stazione dell’Arma sono riusciti ad acchiapparlo e a bloccarlo presso lo scalo ferroviario della cittadina del Tigullio.Identificato in un 58enne originario di Biella, senza fissa dimora e con pregiudizi di polizia anche specifici, il ladro è stato perquisito e trovato in possesso di grimaldelli, poi sequestrati.Alla fine è stato denunciato per “tentato furto aggravato e possesso ingiustificato di chiavi alterare o di grimaldelli”. ;2020-03-31; Liguria Notizie;['Piemonte', 'Biella', 'Liguria'];https://www.ligurianotizie.it/senza-fissa-dimora-ruba-elemosine-in-chiesa-a-zoagli-denunciato-originario-di-biella/2020/03/31/375137/;www.ligurianotizie.it;['liguria', 'piemonte']
23781;Covid-19: si è spento 85enne allospedale Sestri Levante;Un uomo di 85 anni, è morto la notte del 30 marzo 2020, all’ospedale di Sestri Levante. La vittima del covid-19 era nato a Torino e resideva a Segrate, in provincia di Milano.L’uomo, quando è stato ricoverato, si trovava a Leivi ed il decesso è stato telefonicamente confermato, questa mattina, dalla moglie dell’anziano al sindaco Vittorio Centanaro. Sul proprio profilo Facebook il primo cittadino ha scritto un messaggio di condoglianze.All’ospedale San Martino di Genova, invece, nel pomeriggio del 30 marzo 2020 si è spento un uomo di 90 anni, nato a Genova, ma residente a Pieve Ligure. L’uomo era ricoverato presso il padiglione 12. ABov;2020-03-31; Liguria Notizie;['Liguria', 'Sestri Levante', 'Torino', 'Piemonte', 'Lombardia', 'Segrate', 'Milano'];https://www.ligurianotizie.it/covid-19-si-e-spento-un-85enne-ospedale-sestri-levante/2020/03/31/375153/;www.ligurianotizie.it;['liguria', 'lombardia', 'piemonte']
