;title;content;date;author;tags;url;website-domain;region
24535;Litiga con l'ex dipendente per gli arretrati e gli spara a una gamba: arrestato imprenditore 40enne...;Va a chiedere gli arretrati al suo datore di lavoro e dopo una lite ‘rimedia’ un proiettile a una gamba. È successo a Giugliano, dove i Carabinieri della stazione di Varcaturo, coordinati dalla Procura di Napoli Nord, hanno sottoposto a fermo di indiziato di delitto per tentata estorsione, lesione personale aggravata, detenzione e porto illegale di arma comune da sparo un imprenditore 40enne del posto. I militari, allertati dal 112, hanno trovato in via Licola Mare un cittadino extracomunitario 55enne ferito alla gamba da colpi di arma da fuoco. La vittima è stata soccorsa e trasportata da personale sanitario all'ospedale di Pozzuoli. Lì ha riferito ai Carabinieri cosa fosse accaduto: aveva avuto l'ennesima discussione con il suo ex datore di lavoro per prestazioni ancora non pagate e perché non era mai stato regolarizzato. L'imprenditore a quel punto aveva esploso alcuni colpi di pistola colpendolo due volte alla gamba. I Carabinieri, supportati dai militari del Nucleo investigativo di Castello di Cisterna, hanno trovato due bossoli sul luogo della sparatoria e arrestato il responsabile. Dalle indagini dei Carabinieri è emerso anche che l'imprenditore aveva già minacciato il suo ex dipendente perché voleva obbligarlo a ritirare una vertenza sindacale presentata in passato. Il 55enne è stato dimesso e giudicato guaribile in 30 giorni per la frattura di tibia e femore. Il 40enne è stato portato in carcere.;2020-03-20; Campanianotizie;['Arresti', 'Lavoro', 'Campania', 'Giugliano', 'Carabinieri', 'Giustizia', 'Napoli'];http://www.campanianotizie.com/cronaca/napoli/154842-litiga-ex-dipendente-arretrati-spara-gamba-arrestato-imprenditore-40enne.html;www.campanianotizie.com;['campania']
24536;Coronavirus, produce mascherine in casa senza autorizzazione e le vende online: denunciato 48enne...;Un uomo di 48 anni di Acerra è stato denunciato dai carabinieri perché produceva mascherine in casa e per venderle aveva anche messo degli annunci pubblicitari on line. I militari hanno perquisito la sua abitazione trovando 22 mascherine nonché materiale per la produzione di nuove protezioni come elastici, supporti in gomma e colla. E' stato tutto sequestrato e sono in corso accertamenti per appurarne la provenienza.;2020-03-20; Campanianotizie;['Campania', 'Acerra', 'Carabinieri', 'Pubblicità'];http://www.campanianotizie.com/cronaca/napoli/154843-coronavirus-produce-mascherine-senza-autorizzazione-denunciato-48enne.html;www.campanianotizie.com;['campania']
24592;Coronavirus, nuovi contagi in provincia di Caserta. Quarto caso a Orta di Atella: è un bambino di 6...;Quarto caso di contagio a Orta di Atella. Ad essere risultato positivo al Covid-19 è un bambino ed è il primo in provincia di Caserta. Si tratta di un bimbo di 6 anni, figlio di una coppia che era stata già sottoposta al test e che era risultata positiva. Il piccolo sta bene. In serata confermata la positività anche di un uomo che era stato ricoverato all’ospedale di Sessa Aurunca con sintomi: ha 70 anni ed è residente a Teano. I numeri in provincia di Caserta sono in aumento. Sono 92 quelli certificati al 19 marzo: 7 persone risultate positive al Covid-19 sono decedute. L’ultima vittima è stata una donna 89enne di Vitulazio. Attualmente però il caso che desta preoccupazioni è quello del dirigente sanitario del carcere di Santa Maria Capua Vetere. Tutte i protocolli sono già stati attivati: medici e persone della struttura che sono stati in contatto con l’uomo sono stati sottoposti ai test del tampone.;2020-03-20; Campanianotizie;['Campania', 'Caserta', 'Carceri', 'Santa Maria Capua Vetere'];http://www.campanianotizie.com/cronaca/caserta/154846-coronavirus-nuovi-contagi-provincia-caserta-bambino-orta.html;www.campanianotizie.com;['campania']
24635;Coronavirus, ancora violazioni delle norme per il contenimento dei contagi: denunciati 5 runners ad...;Gli appelli e i richiami delle istituzioni locali si susseguono incessantemente ma nonostante questo ad Aversa il “restate a casa” ancora non è stato recepito da tutti i cittadini. Tant’è che anche questa mattina gli agenti della polizia locale guidati dal comandante Stefano Guarino sono stati costretti a denunciare cinque persone beccate in giro senza alcuna motivazione. Tra questi sono stati fermate due persone che stavano facendo jogging per le strade della città di Aversa. Ora tutti e cinque rischiano condanne fino a 3 mesi di carcere o una ammenda di 206 euro per aver eluso le disposizioni del decreto del presidente del consiglio dei ministri Giuseppe Conte adottato per fronteggiare l’emergenza da coronavirus.;2020-03-20; Campanianotizie;['Campania', 'Aversa', 'Polizia'];http://www.campanianotizie.com/cronaca/caserta/154847-coronavirus-ancora-violazioni-delle-norme-per-il-contenimento-dei-contagi-denunciati-5-runners-ad-aversa.html;www.campanianotizie.com;['campania']
24720;Controllo del territorio per il rispetto delle misure anticontagio nel Napoletano:arrestati un...;Durante il servizio di controllo del territorio finalizzato a garantire il rispetto delle misure urgenti per la gestione dell’emergenza Coronavirus, gli agenti dei commissariati San Giovanni-Barra e Ponticelli, su segnalazione della centrale operativa sono intervenuti in via Don Agostino Cozzolino Parroco per un furto a una tabaccheria. I poliziotti, giunti sul posto, hanno sorpreso un uomo che stava uscendo di corsa dal negozio con due borsoni, lo hanno inseguito fino ad un appartamento in via Napoli a Ponticelli dove aveva tentato di nascondersi e lo hanno bloccato dopo aver recuperato 510 pacchetti di sigarette di cui si era disfatto. A. D., 21enne napoletano, è stato arrestato per furto aggravato e denunciato ai per inottemperanza alle prescrizioni del D.P.C.M. 9 marzo 2020.;2020-03-20; Campanianotizie;['Arresti'];http://www.campanianotizie.com/cronaca/napoli/154854-controllo-del-territorio-per-il-rispetto-delle-misure-anticontagio-nel-napoletanoarrestati-un-21enne-per-aver-ripulito-un-tabaccaio-e-2-ladri-che-stavano-saccheggiando-un-supermercato.html;www.campanianotizie.com;['campania']
24795;Coronavirus a Napoli, matrimonio sul lungomare di Chiaia: denunciati sposi e testimoni per...;Stamattina gli agenti del commissariato San Ferdinando, Durante il servizio di controllo del territorio, finalizzato anche a garantire il rispetto delle misure urgenti per la gestione dell’emergenza epidemiologica da COVID-19, gli agenti del commissariato San Ferdinando sono stati allertati stamattina dalla centrale operativa per la segnalazione della celebrazione di un matrimonio in via Chiaia. I poliziotti hanno notato gli sposi in via Partenope all’angolo con piazza Vittoria, mentre, con altre due persone, scattavano alcune foto ricordo e li hanno denunciati per inottemperanza alle prescrizioni del D.P.C.M. 9 marzo 2020.;2020-03-20; Campanianotizie;['Campania', 'Napoli', 'Chiaia'];http://www.campanianotizie.com/cronaca/napoli/154858-coronavirus-a-napoli-matrimonio-sul-lungomare-di-chiaia-denunciati-sposi-e-testimoni-per-violazione-delle-misure-anticontagio.html;www.campanianotizie.com;['campania']
24959;Coronavirus, la denuncia del medico di Torre Annunziata: scendiamo a fare il nostro dovere e l'Asl...;Una denuncia presentata al procuratore del tribunale oplontino, Pierpaolo Filippelli, è partita dal medico Mario Iovane, di Torre Annunziata, a causa di una serie di mancanze delle Asl, tra cui la mancata fornitura dei dispositivi di protezione per gli operatori sanitari. “Il nostro territorio ha un rischio esponenziale, in assenza di presidi sanitari”. Il professionista spiega che “Il fatto che non sia l'Asl a metterle a disposizione è un fatto grave. Noi non possiamo esimerci dal visitare i nostri pazienti. Anche io, come tutti ho paura, ma scendo e vado a fare il mio dovere”. Intanto a Torre Annunziata c'è il secondo caso positivo: l'uomo, ricoverato al Covid center di Boscotrecase, è in condizioni stabili - come riporta Il Mattino. Migliorano le condizioni dell'82enne, primo contagio in città. Ma i disservizi non mancano. Il sindaco Vincenzo Ascione, come altri, denuncia la lentezza degli esiti dei tamponi. “Da giorni stiamo aspettando alcuni risultati- sottolinea - Lo stesso ospedale che ospita tutti i malati Covid al momento non è ancora efficiente, mancano infrastrutture che sono state acquistate ma non sono ancora arrivate. Non è ancora partita la sperimentazione del medicinale utilizzato dai medici del Pascale. Ci sono ancora problemi burocratici”. Il primo cittadino ha inoltre imposto agli amministratori condominiali e ai proprietari di unità abitate di eseguire la disinfezione delle parti in comune degli stabili, come le scale, gli ascensori e i portoni.;2020-03-21; Campanianotizie;['Campania', 'Torre Annunziata', 'Giustizia', 'Tribunali'];http://www.campanianotizie.com/cronaca/napoli/154867-coronavirus-la-denuncia-del-medico-di-torre-annunziata-scendiamo-a-fare-il-nostro-dovere-e-lasl-non-ci-fornisce-i-dispositivi-di-protezione.html;www.campanianotizie.com;['campania']
25042;Coronavirus, noncuranti dei divieti prendono il sole e fanno il bagno al mare: 4 persone denunciate...;Nonostante le diverse misure adottate per il contenimento dei contagi da Coronavirus, erano in spiaggia a prendere il sole e a fare il bagno. Sono 4 le persone denunciate dai Carabinieri tra Ischia e Procida Nel primo caso i militari della stazione di Ischia hanno denunciato un uomo di 45 anni e una donna di 29, sorpresi a prendere il sole su una spiaggia poco distante dalla caserma. A Procida, invece, due donne di 43 e 73 anni sono state deferite per l'inosservanza dei provvedimenti dell'autorità, sorprese sulla spiaggia della Chiaia mentre facevano il bagno.;2020-03-21; Campanianotizie;['Carabinieri'];http://www.campanianotizie.com/cronaca/napoli/154872-coronavirus-noncuranti-dei-divieti-prendono-il-sole-e-fanno-il-bagno-al-mare-4-persone-denunciate-tra-ischia-e-procida.html;www.campanianotizie.com;['campania']
25110;Coronavirus, ragazzo di Qualiano festeggia i 18 anni in casa con amici e parenti violando le norme...;Nei giorni della quarantena hanno pensato di organizzare la festa di 18 anni in casa a Qualiano, ma violando ugualmente tutte le norme che vietano gli assembramenti. Tutto è filato liscio per i ragazzi fino a quando qualche residente non ha allertato i carabinieri della locale stazione che li hanno sorpresi in flagrante e hanno denunciato dieci persone per inosservanza del decreto governativo. Nonostante gli obblighi di isolamento domestico e i divieti di uscire se non per motivi di urgenza e necessità, parenti e amici si sono radunati a casa del festeggiato per celebrare il suo 18esimo compleanno. Proprio mentre il sindaco Raffaele De Leonardis, annunciava il primo caso di positività al coronavirus in città e invitava tutti i cittadini a mantenere la calma e ad osservare le misure anticontagio disposte da Governo e Regione Campania.;2020-03-21; Campanianotizie;['Carabinieri'];http://www.campanianotizie.com/cronaca/napoli/154876-coronavirus-ragazzo-di-qualiano-festeggia-i-18-anni-in-casa-con-amici-e-parenti-violando-le-norme-anticontagio-tutti-denunciati-dai-carabinieri.html;www.campanianotizie.com;['campania']
25191;"""Devo portare gli animali a passeggio"" e va in giro con cavallo e capretta: 49enne di Giugliano...";Durante il servizio di controllo del territorio, finalizzato anche a garantire il rispetto delle misure urgenti per la gestione dell’emergenza epidemiologica da Covid-19, gli agenti del commissariato Giugliano-Villaricca hanno notato un uomo che passeggiava con una capretta e un cavallo al guinzaglio. I poliziotti lo hanno fermato e l'uomo, un 49enne di Giugliano, ha dichiarato di dover “portare gli animali a passeggio”. L'uomo è stato denunciato per inottemperanza alle prescrizioni del D.P.C.M. 9 marzo 2020.;2020-03-21; Campanianotizie;['Campania', 'Giugliano', 'Villaricca'];http://www.campanianotizie.com/cronaca/napoli/154880-giugliano-portare-animali-passeggio-denunciato-violazione-norme-coronavirus.html;www.campanianotizie.com;['campania']
25200;Coronavirus a Napoli, prendono il sole sulla spiaggia di via Coroglio: 5 donne denunciate per...;Ieri pomeriggio avevano deciso di andare sulla spiaggia di via Coroglio, a Bagnoli, cinque donne, tra i 44 e i 60 anni, per godersi del primo sole primaverile. Ma sono state sorprese e denunciate dagli agenti della polizia, durante il servizio di controllo del territorio finalizzato anche a garantire il rispetto delle misure urgenti per la gestione dell'emergenza coronavirus. Lì hanno trovato le cinque donne intente a prendere il sole sedute sulle sdraio, denunciandole per inottemperanza alle prescrizioni contenute nel dpcm del 9 marzo 2020.;2020-03-21; Campanianotizie;['Campania', 'Napoli', 'Polizia'];http://www.campanianotizie.com/cronaca/napoli/154882-coronavirus-a-napoli-prendono-il-sole-sulla-spiaggia-di-via-coroglio-5-donne-denunciate-per-violazione-delle-misure-anticontagio.html;www.campanianotizie.com;['campania']
25354;Coronavirus, altra vittima a San Giorgio a Cremano: sale a 35 il bilancio dei decessi in Campania;Aumenta il numero di vittime in Campania per cause collegate al Coronavirus. Dopo la morte di un avvocato napoletano di 57 anni, deceduto nella terapia intensiva del Cotugno, questa notte è morto un uomo di 86 anni residente a San Giorgio a Cremano ricoverato da quattro giorni in ospedale. È stato il sindaco Giorgio Zinno a darne notizia: “Oggi una famiglia, a cui vanno le nostre condoglianze, non potrà neanche dare l’ultimo saluto ad un padre, un marito, un nonno, perché la legge vieta le cerimonie funebri. La morte è già qualcosa di drammatico, ma quando arriva così violenta, inaspettata e portata da un virus che non si arresta anche a causa di ignoranti che continuano a trasgredire le norme, resta poco altro da aggiungere”. Si aggrava dunque il bilancio in Campania: 35 vittime, il 4 per cento tra i contagiati accertati. E resta il nodo degli ospedali: terapie intensive e reparti di medicina d’urgenza a Giugliano e Frattamaggiore, dopo Pozzuoli, pronti ad accogliere i pazienti Covid-19. 11 su 13 posti occupati in rianimazione al Policlinico Federico II, 10 su 10 al Loreto Mare dove entro martedì ne sono previsti 20 in sub intensiva, di sostegno al Cotugno già pieno che va verso un ulteriore ampliamento dei reparti.;2020-03-22; Campanianotizie;['Campania', 'San Giorgio a Cremano', 'Avvocati'];http://www.campanianotizie.com/cronaca/napoli/154885-coronavirus-altra-vittima-a-san-giorgio-a-cremano-sale-a-35-il-bilancio-dei-decessi-in-campania.html;www.campanianotizie.com;['campania']
25387;Coronavirus, ancora violazioni delle norme sanitarie: maxi sequestro di igienizzante per le mani...;"Gli agenti dei commissariati Arenella e Giugliano-Villaricca, con il supporto della Compagnia della guardia di finanza di Giugliano, hanno effettuato un controllo ad un magazzino di stoccaggio merci in corso Italia a Villaricca. Qui hanno sorpreso tre persone impegnate nell'attività di confezionamento di un gel per le mani ed hanno trovato numerose scatole di prodotti già realizzati ed altre contenenti flaconi vuoti ed etichette nonché 25 taniche di candeggina da 5 litri utilizzate per la realizzazione del prodotto. Sequestrate 5060 confezioni di diversi prodotti detergenti, tra i quali un ""gel igienizzante per mani"", non conformi alle normative sanitarie, privi di tracciabilità e di autorizzazioni. La società a cui fa riferimento l'intera attività effettuava vendite on line per proprio conto e anche attraverso noti siti di e-commerce a prezzi sensibilmente maggiorati. In tre sono stati denunciati per manovre speculative su merci e frode in commercio.";2020-03-22; Campanianotizie;['Campania', 'Giugliano', 'Villaricca', 'Guardia di Finanza'];http://www.campanianotizie.com/cronaca/napoli/154889-coronavirus-ancora-violazioni-delle-norme-sanitarie-maxi-sequestro-di-igienizzante-per-le-mani-prodotto-senza-autorizzazioni-nel-napoletano.html;www.campanianotizie.com;['campania']
25457;Coronavirus a Benevento, controlli della municipale in tutta la città: 767 verifiche effettuate e...;Nel comune di Benevento, come disposto dal sindaco Clemente Mastella, sono iniziati controlli a tappeto su tutte le auto in transito da parte della polizia municipale di Benevento. Sono state 767 le verifiche effettuate ieri dai vigili del capoluogo sannita, il numero più alto in una sola giornata. Sono state due le denunce all'autorità giudiziaria, di cui una effettuata a tarda ora a carico di un 38enne che circolava senza riuscire a fornire valide giustificazioni. Il servizio di controllo finalizzato al rispetto delle misure di contenimento della diffusione del Covid-19 è stato disposto, a differenza dei giorni scorsi, con dei veri e propri posti di blocco nei vari punti della città. Nella prima mattinata sono stati presidiati i varchi di ingresso alla città e poi i blocchi sono stati trasferiti nelle zone più centrali del capoluogo. Anche oggi continueranno i posti di blocco che saranno posizionati nei vari punti strategici della città. “Abbiamo dato piena attuazione alle disposizioni del sindaco - dichiara il dirigente del Settore Affari generali Gennaro Santamaria - che anche in questo caso aveva visto giusto. Purtroppo ci sono ancora in giro troppe persone e molto spesso le loro uscite non sono del tutto plausibili”. Il comandante del Corpo, Fioravante Bosco, sottolinea infine “l'abnegazione e l'impegno” che i suoi uomini stanno dimostrando in questo difficile momento. “Devo dare atto - afferma - della professionalità e della disciplina con cui gli appartenenti al corpo stanno svolgendo il loro lavoro. Tutto avviene bilanciando la giusta fermezza e la ragionevole tolleranza”.;2020-03-22; Campanianotizie;['Campania', 'Benevento', 'Clemente Mastella', 'Polizia'];http://www.campanianotizie.com/cronaca/benevento/154892-2020-03-22-13-08-43.html;www.campanianotizie.com;['campania']
25565;Coronavirus, un'altra vittima in Campania: morto anziano a San Giorgio a Cremano;Il Coronavirus continua a mietere vittime in Campania. Dopo la morte di un avvocato napoletano di 57 anni deceduto nella terapia intensiva dell'ospedale di Cotugno, questa notte è morto un uomo di 86 anni residente a San Giorgio a Cremano ricoverato da quattro giorni in ospedale. Ricoverato in terapia intensiva da quattro giorni giorni, le sue condizioni erano già gravi a causa di pregresse patologie polmonari. È stato il sindaco Giorgio Zinno a darne notizia: «Oggi una famiglia, a cui vanno le nostre condoglianze, non potrà neanche dare l’ultimo saluto ad un padre, un marito, un nonno, perché la legge vieta le cerimonie funebri. La morte è già qualcosa di drammatico, ma quando arriva così violenta, inaspettata e portata da un virus che non si arresta anche a causa di ignoranti che continuano a trasgredire le norme, resta poco altro da aggiungere».;2020-03-22; Campanianotizie;['Campania', 'San Giorgio a Cremano', 'Avvocati'];http://www.campanianotizie.com/cronaca/napoli/154905-coronavirus-morto-san-giorgio-a-cremano.html;www.campanianotizie.com;['campania']
25723;Assalto alla filiale del banco di Napoli di Teverola, colpo mancato: ladri in fuga a mani vuote;Assalto nella notte alla filiale del banco di Napoli di Teverola. L’obiettivo dei delinquenti era di quello di portare via il denaro contenuto nel roller cash. Nel corso del colpo qualcosa però è andato storto e i malviventi sono stati costretti a fuggire a mani vuote. Tra le ipotesi c’è quella che la gang abbia provato ad appiccare le fiamme al forziere. Nelle ultime ore sono state diverse le attività commerciali finite nel mirino delle bande di ladri, alcune delle quali addirittura due volte nel giro della stessa settimana come “Future Games” a San Tammaro e la caffetteria “Lombardi” a Maddaloni.;2020-03-23; Campanianotizie;['Campania', 'Napoli', 'Teverola'];http://www.campanianotizie.com/cronaca/caserta/154913-assalto-alla-filiale-del-banco-di-napoli-di-teverola-colpo-mancato-ladri-in-fuga-a-mani-vuote.html;www.campanianotizie.com;['campania']
25771;Coronavirus a Napoli, gruppi di preghiera raccolti nelle chiese a porte chiuse: 9 persone denunciate;Grazie ad alcune segnalazioni pervenute attraverso l'applicazione 'Youpol', la polizia ha sorpreso un gruppo di cinque persone nella chiesa Evangelica di via Ferrante Loffredo ed altri quattro in un'altra sede in via Carlo Della Gatta. I nove erano tutti uomini e di nazionalità nigeriana, regolari sul territorio nazionale. Sono stati individuati durante il servizio di controllo del territorio, finalizzato a garantire il rispetto delle misure urgenti per la gestione dell'emergenza epidemiologica da Covid-19. Per tutti e nove è scattata la denuncia.;2020-03-23; Campanianotizie;['Campania', 'Napoli', 'Polizia'];http://www.campanianotizie.com/cronaca/napoli/154916-coronavirus-a-napoli-gruppi-di-preghiera-raccolti-nelle-chiese-a-porte-chiuse-9-persone-denunciate.html;www.campanianotizie.com;['campania']
25772;Rischio collasso funerali in Campania, la denuncia dei sindacati: le imprese si rifiutano per paura...;"L’emergenza sanitaria sta portando una serie di problemi, anche gravi. Uno di questi riguarda ora i funerali: molte imprese sembra si stiano rifiutando di prestare il loro servizio per il timore del contagio da Coronavirus. ""Ci pervengono ormai decine di segnalazioni di imprese funebri campane che rifiutano più e più volte di effettuare le operazioni funebri per i casi di coronavirus. Questo diniego, dettato soprattutto dalla paura di un contagio, sta creando uno squilibrio insostenibile con il carico che pende verso chi invece, per senso di dovere e collettività, continua a fornire i servizi indispensabili in questo momento storico. Ma non possiamo continuare così o altrimenti l'intero sistema rischia il collasso"". E' la denuncia di Gennaro Tammaro, delegato campano di EFI (Eccellenza Funeraria Italiana), sindacato di categoria delle imprese funebri. Ciò che viene chiesto è un intervento ''deciso'' delle istituzioni a iniziare dal Comune di Napoli e dalla Regione Campania affinché si argini ''questa emergenza nell'emergenza''. Sebbene siano vietati i funerali, le operazioni che precedono e seguono di norma il rito continuano a essere svolte.";2020-03-23; Campanianotizie;['Funerali', 'Campania'];http://www.campanianotizie.com/cronaca/napoli/154918-rischio-collasso-funerali-in-campania-la-denuncia-dei-sindacati-le-imprese-si-rifiutano-per-paura-del-contagio-da-coronavirus.html;www.campanianotizie.com;['campania']
25863;Contenimento del contagio da Covid-19, raddoppiate le pattuglie della polizia metropolitana a...;"Rafforzati i controlli da parte della Polizia Metropolitana di Napoli, che raddoppia le pattuglie per le attività di contenimento del rischio da Coronavirus, portando all'80% delle forze disponibili il contingente dedicato al controllo del rispetto delle norme previste sugli spostamenti delle persone per il contrasto alla diffusione del contagio. Più di 60 i controlli già effettuati in poche ore solo nella Sanità, l'area che presenta allo stato maggiori criticità, 15 in via Pignasecca, che questa mattina, grazie anche alla presenza degli agenti della Polizia Metropolitana, si presentava ordinata e semi-deserta. È stato attivato anche un numero (0813736320) attraverso il quale i cittadini possono ricevere informazioni circa l'applicazione delle misure previste, ma soprattutto possono segnalare assembramenti e violazioni delle norme anti-contagio. ""È il momento in cui tutti dobbiamo lottare, impegnando tutte le nostre forze, per uscire al più presto da questa emergenza"", afferma il sindaco della Città Metropolitana, Luigi de Magistris.";2020-03-23; Campanianotizie;['Polizia', 'Campania', 'Napoli', 'Luigi De Magistris'];http://www.campanianotizie.com/cronaca/napoli/154921-contenimento-del-contagio-da-covid-19-raddoppiate-le-pattuglie-della-polizia-metropolitana-a-napoli-de-magistris-qimpegnamo-tutte-le-nostre-forze-per-uscire-dallemergenzaq.html;www.campanianotizie.com;['campania']
25864;Assalto armato nel Napoletano, colpo al furgone portavalori fuori all'Ad hoc di Arzano: indagano i...;Assalto armato fuori all’Ad hoc. Quattro banditi che hanno assaltato un furgone portavalori ad Arzano, che aveva appena prelevato l’incasso del punto vendita della nota catena. L’azione criminale è andata in scena poco dopo le 13 di sabato, due auto hanno affiancato il camioncino all’ingresso del centro commerciale bloccandolo. Dalle vetture sono scesi quattro uomini a volto coperto armati di fucili a pompa e mitragliette d’assalto ed hanno immediatamente disarmato i 3 vigilantes. In due hanno tenuto sotto tiro le guardie giurate mentre gli altri prelevavano l’incasso. I ladri sono poi fuggiti sulla circumvallazione con le due auto usate per bloccare il camioncino della vigilanza. Un’azione fulminea che fortunatamente non è finita nel sangue. Sul posto sono intervenuti i Carabinieri che hanno poi avviato le indagini per risalire all’identità dei rapinatori.;2020-03-23; Campanianotizie;['Portavalori', 'Campania', 'Arzano', 'Carabinieri'];http://www.campanianotizie.com/cronaca/napoli/154922-assalto-armato-nel-napoletano-colpo-al-furgone-portavalori-fuori-allad-hoc-di-arzano-indagano-i-carabinieri.html;www.campanianotizie.com;['campania']
